It’s not that negative  People are making assumptions without even watching it    I was expecting way worse but I thought it was pretty factual and very neutral  Almost every person interviewed was rooting for retail investors and they mentioned the connection between RH and Citadel  Some people have made posts saying it looked fishy because people interviewed had all new houses    that’s not true at all 🤣  There were a couple of Reddit users that clearly weren’t in some set up home    People are also bitching because they claim it ended the story on GME’s lowest prices  But that’s also not true  At the end of it it addresses that the price soared again on 3/8 and this story isn’t over    I’m definitely someone who doesn’t trust the media and I question the intentions of shows like this  But I’ve been on this sub for the whole ride and I didn’t think it was that bad  JMHO,2021-03-16 02:20:01.038736
You have done an excellent job at wasting my time    *I am a bot and this action was performed automatically  Please [contact the moderators of this subreddit]/message/compose/?to=/r/wallstreetbets if you have any questions or concerns *,2021-03-16 02:20:01.038868
This is the way,2021-03-16 02:20:01.629543
Ive never seen a more emotional trader than a GME’r   ,2021-03-16 02:20:02.240619
Those are rookie numbers,2021-03-16 02:20:04.167891
The damn thing got halted at $300 after being at $350  How could you hold at $300 and sell today?,2021-03-16 02:20:05.271635
aw c'mon,2021-03-16 02:20:07.321162
What calls you thinking?,2021-03-16 02:20:07.321288
It didn't last that long,2021-03-16 02:20:08.432485
"User age checks out    /s   Look I hope GME goes to obscene heights just like the rest of you but there are a lot of people basically zombie echoing the same thing over and over   1 Hold/HODL 2 🚀 💎 🐵 3 ""it's going to the moon!!"" 4 witching day seriously you idiots need help   None of this concerns you people? It's getting all sorts of Q-stinky in here lately ",2021-03-16 02:20:08.432625
yea stop fighting AMC like its your enemy your enemy is the HF i am happy to see AMC up and GME up and i aint envy when GME is up while AMC is not moving stop being a bitch,2021-03-16 02:20:08.432727
I think they could utilize their physical space more  Like Wang Ba’s in China - I would definitely pay a membership fee at GameStop if I could drop in and play current games on the best hardware/consoles/hi-def TVs  Plus they could have tournaments and shit e-sports at a local level ,2021-03-16 02:20:09.064121
Why is ur stupid ass still messaging me  U wanna suck my dick r something ?! Sorry guy I don’t roll that way  Like u said in the previous message  WELCOME TO WALLSTREET MF,2021-03-16 02:20:10.170398
A true autist,2021-03-16 02:20:10.170537
u/bolsonarosucksdick you’re famous!,2021-03-16 02:20:10.763097
PLTR $29C 3/19,2021-03-16 02:20:11.863088
lmfao cramer seems to have got the reeducation treatment for cnbc 😂 shilling the game store and amc! either way apes r fuk,2021-03-16 02:20:12.965892
Can ree mem bah wut spend $200 on aftah?,2021-03-16 02:20:12.966124
I think if I squint it says BOOBS,2021-03-16 02:20:14.070767
I vaguely remember saving pangolins or some shit 2-3 years ago  How we do ,2021-03-16 02:20:14.732845
I’m looking for text format  But thanks anyway!,2021-03-16 02:20:15.838323
Where's BlackBerry though? or is that just not high risk but safe bet,2021-03-16 02:20:18.368513
Lmao 😂,2021-03-16 02:20:19.471411
# A🚀M🚀C,2021-03-16 02:20:20.102653
You nailed it 🦍😊👍🏻💎👐💎🍌🚀🚀🚀🚀,2021-03-16 02:20:20.102818
Hi I’m DFV and welcome to Jackass!  *Pours in 401K*,2021-03-16 02:20:22.073912
$195,2021-03-16 02:20:22.074160
I feel dumb as shit but I am on my 4th crayon tonight   I heard earnings were coming out and I looked for an announcement of an emergency one and saw the annual one was scheduled for summer   thanks,2021-03-16 02:20:23.208353
So your theory is they pulled out trillions in cash then put it back into other stocks a few days later?,2021-03-16 02:20:23.802708
Harambe shall be honored,2021-03-16 02:20:26.595588
You went to the Marine Corps school didnt you? *Munching on crayon*,2021-03-16 02:20:27.682276
So Jim Cramer walks into a bar     *   and sues the studio *,2021-03-16 02:20:27.682399
AFAIK:  March 23rd is earnings call   March 19th a bunch of option calls expire ,2021-03-16 02:20:28.291504
I’m fuckin dead 💀💀💀💀,2021-03-16 02:20:28.291631
Physical silver,2021-03-16 02:20:30.222854
don't be a goddamn karen,2021-03-16 02:20:30.223050
The shitter  $0 75/share,2021-03-16 02:20:35.232571
Puts?,2021-03-16 02:20:35.232700
There's a randomize button just for you!,2021-03-16 02:20:35.232778
You call everyone that gets your panties in a bunch a shill or just this guy?,2021-03-16 02:20:35.232853
Here comes $2 5bil US because we ares apes and can't do conversion to save the day just like AMC,2021-03-16 02:20:35.232932
Even the cheapest GME call is way more than what I paid for my first car ,2021-03-16 02:20:35.354483
Who the fucks stupid enough to throw more money at these losers,2021-03-16 02:20:35.354609
“WSB goes long on SILVER back gorillas”- CNBC headline tomorrow lying shit fucks ,2021-03-16 02:20:39.506676
Oh wow an activist!,2021-03-16 02:20:39.506806
$2 98,2021-03-16 02:20:43.492757
Just heard about this company  Will buy some shares tomorrow,2021-03-16 02:20:43.492893
I got brain damage from looking at this,2021-03-16 02:20:43.493939
Feel like there’s enough words and convincing tone for me to buy a dozen or so options 🦍,2021-03-16 02:20:43.494038
He has taken profits,2021-03-16 02:20:43.494115
Do any of u dummies pushing NOK know what a float is?,2021-03-16 02:20:43.494185
I'm torn  Now I have to hold but it feels dirty somehow     God damn it ,2021-03-16 02:20:43.725431
Bulllllush,2021-03-16 02:20:43.725565
Just want to piggy back off the top comment for visibility    They didn't borrow anything they are trying to raise cash by issuing bonds and they are trying to raise [$60 billion not 600 million]https://markets businessinsider com/bonds/citadel_finance_llcdl-notes_202121-26_regs-bond-2026-usu1718raa69 look at the issue volume and the issue,2021-03-16 02:20:45.294731
"All the people who try to be the ""leaders"" of their respective memestocks were probably Guides in bootcamp ",2021-03-16 02:20:45.294869
The office ,2021-03-16 02:20:45.294951
AMC Push the Hedgies out or force them to buy  Hey Hedgies lenders down 13-7 lmao  Your all getting pushed slowly  You made the wrong move  Might want to switch teams  When DTCC happens y’all getting those daily margin calls  🍿🚀🌑,2021-03-16 02:20:46.871531
Or ban?,2021-03-16 02:20:46.871726
GE with coming reverse split  That is a no go ,2021-03-16 02:20:50.841337
But he sold his car    ,2021-03-16 02:20:50.841491
Twas a quote from a comedian,2021-03-16 02:20:52.325362
This guy fucks,2021-03-16 02:20:52.325498
Both  Definitely both ,2021-03-16 02:20:53.930711
No fuckin way,2021-03-16 02:20:53.930830
Demon Slayer is a fighting anime  If you want something that will test your feels try Violet Evergarden on Netflix  Made a grown man cry ,2021-03-16 02:20:54.021933
Stupid question how common is this to happen? Have they ever done this before?,2021-03-16 02:20:56.124811
Not asking for advice  I also think NOK is undervalued but I'm discouraged by the way it hardly ever moves and wondering what it's going to take to make it climb  Thought the AWS/MSFT/GOOG news would be a catalyst but it seemed ho-hum   Maybe I've been following WSB stocks too much because I now expect wild stock rides daily  NOK is like watching paint dry  Hopefully we will both be rewarded  Best of luck to you ,2021-03-16 02:20:56.124944
PLTR is the rage quit of meme stocks,2021-03-16 02:20:56.728685
🦍🦍🦍 APES ARE STRONG 🦍🦍🦍,2021-03-16 02:20:57.326882
This aged well,2021-03-16 02:20:59.534436
You mean AMC?,2021-03-16 02:20:59.534566
This should’ve been flagged as NSFW so I don’t click on it in the office  I’m laughing uncomfortable and everybody thinks a list it,2021-03-16 02:21:00.625260
GME open at $300 bring that volatility back 🚀,2021-03-16 02:21:02.648282
Bullish,2021-03-16 02:21:02.648408
This dip wouldn't bother me but up until today I proudly maintained a $45 avg buy-in price  Throughout the course of the day I obliterated that and averaged up higher than I want to find out  Today was a bit of a kick in the dick tip but thats at least in part because I had unrealistic expectations   Aside from the eerie absence of predictions for tomorrow here I'm not remotely worried  We're still up big time and I sure as hell won't be selling anytime soon ,2021-03-16 02:21:02.648510
    but what about my UWMC calls?,2021-03-16 02:21:03.268618
🤣👍🏼,2021-03-16 02:21:03.268834
Who cares  The only way I'm selling is if RC and his chewy crew leave GME,2021-03-16 02:21:07.729837
Can someone who is shifting a stock double borrow a stock?,2021-03-16 02:21:07.829344
We should crowdfund it   I'm into that idea - apes go apey for shit like that ,2021-03-16 02:21:08.430246
What was it last week? 6 x 5 minute circuit breakers in under 32 minutes one day last week? I’m sure that’s humans trading   ,2021-03-16 02:21:09.019862
No whistling though  Gotta whistle ,2021-03-16 02:21:10.138394
We just like the *apes*! Fuck CNBC ,2021-03-16 02:21:10.138530
Nice 🚀🚀🚀,2021-03-16 02:21:10.138613
Im actually hoping jpow nukes the market so I can buy everything in a massive discount like two weeks ago,2021-03-16 02:21:10.758279
He asked which hedge funds have been bailed out  LTCM was bailed out    OK dude ,2021-03-16 02:21:11.865023
XLE up or downs 🤷🏻‍♂️,2021-03-16 02:21:14.374181
I sold my amc calls today,2021-03-16 02:21:14.374301
It said hodl and had cats and the moon,2021-03-16 02:21:14.374488
I sold my measley 8 shares at 230 today  I should have sold them at 300 last week LOL  I know I'm probably going to get downloaded to hell but now that he's endorsing it and seeing the last few days play out I'm scared that it's going to keep crashing  I almost bought a put option LOL,2021-03-16 02:21:14.374572
Looooool a bears wet dream,2021-03-16 02:21:14.979074
Apes r fucked and baby apes will be the new veal,2021-03-16 02:21:14.979190
Somebody went to the school of WSB     https://www reddit com/r/wallstreetbets/comments/l8lxuy/if_your_friends_and_family_are_wondering_why/,2021-03-16 02:21:17.516763
Bottom line:   HF's HAVE to buy your precious shares  YOU make your own price  Don't get it twisted ,2021-03-16 02:21:18.129468
AMC “mooning” will be $40  GME “mooning” could be $40k ,2021-03-16 02:21:20.356257
Exercise all those options early especially that July one   boom pocket sand!,2021-03-16 02:21:21.464322
I'm making some conservative spy investments and getting a little crazy and investing 5% of my portfolio into QQQ what can I say I'm risky  Oh and I'm dedicating 80% of my portfolio straddling $230-232 with GME I'm gonna call this shit so good!,2021-03-16 02:21:21.464483
I’ve never seen a more fuk name than Vlad,2021-03-16 02:21:21.464584
Weird how Dave “Paper Hands” Portnoy spends a “milly” on GME and then SPY hits new ATHs while GME remains in the $200 range   Coincidence?,2021-03-16 02:21:21.464667
"""I keep getting told they covered"" is your response to someone mentioning Citadel ",2021-03-16 02:21:22.104587
Sorry for your loss,2021-03-16 02:21:22.104709
🦍❤️🏞️,2021-03-16 02:21:24.172325
Ez position upsize  I hope ,2021-03-16 02:21:24.172426
Lol I just realized that you had a question mark on your comment  I read it as a statement and not a question ,2021-03-16 02:21:25.312963
"i think he liked the ""I will survive"" music video ",2021-03-16 02:21:25.313112
You know it brother  But need to get premarket in the green to help push momentum,2021-03-16 02:21:25.313199
These numbers are super low compared to January  It would be better to show some of the ETFs instead since we know they are shorting those ,2021-03-16 02:21:25.313371
But are you a cat?  Yes or no?,2021-03-16 02:21:25.313482
NOK  That’s all that matters  🦧,2021-03-16 02:21:29.738183
Apes no read,2021-03-16 02:21:29.738311
I cant believe people legit ask for price targets on meme stocks in this sub lmao,2021-03-16 02:21:31.313902
Hold!,2021-03-16 02:21:31.899529
That’s scary I hope PLTR flies for you brother,2021-03-16 02:21:32.479392
Anyone else optimistic about UWMC?,2021-03-16 02:21:34.546054
apple eow price target?,2021-03-16 02:21:34.546190
So retail sales number tomorrow at 8:30am? Forecast - 5%  I bet we beat it  I see crowd in malls and retail stores 🏬,2021-03-16 02:21:35.134184
When he was a young warthooooooog!,2021-03-16 02:21:35.763511
I honestly feel like it'll get close,2021-03-16 02:21:36.885958
"saying goes ""quickest way to have 1 million""   start with two ",2021-03-16 02:21:36.886206
This is it  I've been looking for this song for damn near a decade  All I had to go on was 2012 whistling and a line animation    I thought I'd never see it again,2021-03-16 02:21:37.972805
When did Cosmo Cramer start talking about stocks? I must have missed that episode of Seinfeld,2021-03-16 02:21:37.972928
🦍💪,2021-03-16 02:21:37.973008
Weekly reminder on how to [safely invest]https://www besthealthmag ca/list/carry-your-bag-properly/ in GME & AMC ❤️,2021-03-16 02:21:40.462246
That'd be dope if DFV actually got that title on Times magazine,2021-03-16 02:21:44.738430
I'm just going to drive this cadillac down my private road    YOLO!,2021-03-16 02:21:44.738561
More than Melvin has ever donated,2021-03-16 02:21:44.738640
Good lad,2021-03-16 02:21:44.738711
A silver for your sadness retard ,2021-03-16 02:21:46.333001
That was my logic  It's nice because when GME pops and the rest of the market has a seizure it's like a Dollar Store version of Wall Street ,2021-03-16 02:21:55.168153
Flip a coin,2021-03-16 02:21:55.168252
prob not averages too low for boomers crawl up,2021-03-16 02:21:55.168349
"I talked to Ryan from Fidelity today to figure out why even though I was approved level 1 I still couldn't buy options  He told me it requires level 2 and I didn't apply for it  I waited three hours on the phone to talk to him  He was holding back laughter   So then while I was pulling up my account on the computer just to make sure I did it right this time I was asking him how it was going with everything going on  He was laughing at said he's never seen anything like this and it's funny because he's used to dealing with people during retirement and now all he's been doing is talking to ""young professionals that are getting into trading for the first time ""  Thanks Ryan from Fidelity ",2021-03-16 02:21:56.711535
Can anyone help me out I’m trying to figure out what level I should pick for call options on Webull level 1 or level 2,2021-03-16 02:21:56.711694
Get outta here intern  Also how do you look yourself in the mirror at night  Aren't you ashamed? Or you don't mind working for the ppl that robbed your grandparents retirement,2021-03-16 02:21:58.467540
What's funny is our sentiment would have been accepted on this sub as recently as last year  You were literally a retard if you didn't take insane profits when you had the chance and people let you know it  Now it's a clown car driven by downvoters in denial ,2021-03-16 02:21:58.467662
Boy it would be a wild show if SPY slow melted to $380 over the next month,2021-03-16 02:22:02.532015
I do my best to buy options close to the strike price but I keep getting burned by them ,2021-03-16 02:22:02.532110
“Shitadel”,2021-03-16 02:22:02.532164
Yes ,2021-03-16 02:22:02.532210
Kinda wanna short these bonds until they go bankrupt ,2021-03-16 02:22:04.344821
 but does it win the pre market and after hours 🧐,2021-03-16 02:22:04.344925
💎🙌💎🍆,2021-03-16 02:22:08.261221
Oh wow and I thought I was the retarded one  ,2021-03-16 02:22:08.261315
Nice ,2021-03-16 02:22:08.261366
Lmao but they are FiGHtiNg the Hedge Funds to OcCuPy WalLStrEEt,2021-03-16 02:22:09.997170
I found myself in a deep rabbit hole last night calculating everything I could until I saw the numbers in my hands  Went full retard and bought 17 5 4/16 calls of $HIMS  They sell bones pills and fix hairlines and shit  Literally cant go tits up ,2021-03-16 02:22:11.537260
Sold apha for GME but kind of wanna get back in idk we’ll see,2021-03-16 02:22:11.537367
From looking at this chart I suppose the real question is What is the plan you are talking about?,2021-03-16 02:22:11.631557
Have stores in malls not much volume   ,2021-03-16 02:22:13.284183
Hi it’s me retard,2021-03-16 02:22:13.284278
*100,2021-03-16 02:22:14.769307
Its on the SSR list so I expect 240 tomorrow and 180 on wed,2021-03-16 02:22:14.769402
Gaming has reached its peak,2021-03-16 02:22:16.228135
DKNG fucked me in the ass today no thank,2021-03-16 02:22:16.228260
Says GME is a distraction yet still own shares you may be wrong but at least you ain't stupid,2021-03-16 02:22:16.330376
Because one has a possible future and the other really doesn't  Also one ripped us off at every chance the whole time it was relevant and the other didn't ,2021-03-16 02:22:17.908073
Get outta here with your international bullshit this IS America ,2021-03-16 02:22:18.081593
LoL looks sweet to me!,2021-03-16 02:22:22.003563
Being a bear is like playing chess with queen odds  And if you're somehow winning JPOW will snatch your rooks mid-game ,2021-03-16 02:22:22.003662
Flat futures following big eod pump stimulus GME red presence of many 🌈🐻s and a new ATH means rally continues tomorrow ,2021-03-16 02:22:22.003732
When a price gaps up meaning there is a gap between the bottom of one candle and the top of the previous eventually the price tends to go back down to fill in that gap  Meaning it will go back down to where the top of the first candle was  before continuing the previous trend   The chart looks like it literally fills the gap as It moves ,2021-03-16 02:22:22.003788
Cramer eats the outside crust of a pop tart and throws the middle part away ,2021-03-16 02:22:22.108256
Be at comment on here 😆,2021-03-16 02:22:22.513307
Either you're referencing Mr  Robot or you need to watch Mr  Robot ,2021-03-16 02:22:24.015276
U mad jim?,2021-03-16 02:22:24.598489
they didnt just limit it to fellow apes i believe i saw at least 4 Elephants and a hedgehog as well ,2021-03-16 02:22:24.598613
I am a new smooth brained ape  Not looking for financial advice just a good ape move   I own several  $10 00 options that expire Fruday  If I have the $$ do I exercise and buy the stock or sell the options?  I am  leaning on the side of finding the $$ and exercising my option   Ape thoughts welcome ,2021-03-16 02:22:29.132620
Go jack off with your tears,2021-03-16 02:22:29.132853
🍆💦🌈,2021-03-16 02:22:29.132936
From who!?!?!?,2021-03-16 02:22:29.254231
All jokes aside why the fuck are they even dealing with Gamestop anymore?  It's so obviously a much higher risk to short especially given the situation   Just go somewhere else   If they're holding a grudge well that's how you lose everything ,2021-03-16 02:22:30.782067
Jim Cramer went to Hawaii once because he said he wanted to watch Hulu ,2021-03-16 02:22:30.782171
Is BBB junk? or are they about to become junk rated?,2021-03-16 02:22:30.782223
Plenty to mine for the right price,2021-03-16 02:22:30.782271
Oh I read every word it’s just a stupid misleading title,2021-03-16 02:22:31.380727
a big thumbs up retard fellowwsb ,2021-03-16 02:22:33.400111
I got Effie too!,2021-03-16 02:22:33.986000
I am a bot  You submitted a Gain/Loss/YOLO that didn't look like it included **large** positions  Please read the rules ,2021-03-16 02:22:35.089320
Who's not leaving? WE'RE NOT FUCKIN,2021-03-16 02:22:35.699004
Tomorrow will be a glorious bountiful day of bananas and tendies my dear ape brother  🙌💎 4 lyfe,2021-03-16 02:22:36.828037
Sir I ate crayons  Idk,2021-03-16 02:22:39.379332
Green in the morning Janet Yellen horney,2021-03-16 02:22:39.379427
What’s their stance,2021-03-16 02:22:39.379541
SLS to the moon🚀,2021-03-16 02:22:39.379610
I'm considering buying some of the following tomorrow      $SNOW 04/01 282 5c   $CAN 04/16 45c  $GM  04/01 65c  $AA 04/16 35c,2021-03-16 02:22:39.379664
The only good thing I’ve ever done in my life is sell PLTR at $38,2021-03-16 02:22:40.013721
"Maybe I'm blowing things up but I feel like I should address this since you're not the only one with these concerns:  1  I don't really like how everything I say gets overanalyzed  I don't remember exactly when I said that but it's entirely possible I was tired joking or just plain frustrated  At times my actions toe the line of what acceptable when you take hundreds of mod actions a day it's inevitable  Every decision I make ends up with at least one unhappy party  Understandably I get roasted for when I cross the line and that's completely fair  But bringing it up many weeks later is a real bummer and makes me think twice before doing something fun like posting that cat megathread lest it be considered ""a distraction""  This isn't directed at you just people in general  2  The whole team was exhausted from being attacked from both sides  GME cultists / new users who saw WSB as a pumping ground and anything non-WSB as treason and old and ""old"" users who were frustrated with the complete excess of GME content on the sub   Not to mention we had a whole host of other problems like trying to reinvent the mod bots / automod working with admins avoiding media slander defending against people stealing our name / logo and avoiding anything that could remotely be construed as illegal or unethical   In all honesty when GME fell in Jan/Feb I was relieved  We were all running on empty and it was brutal waking up to hundreds or thousands of hate messages every day    Did we do everything right? Heck no  We weren't even close to optimal  There's a lot of things we -- I did that could have gone better  But given the circumstances I'm proud of how we handled it and know we can handle the future even better ",2021-03-16 02:22:42.747885
Yep,2021-03-16 02:22:43.343512
Whatever Jimmy Shill says do the opposite ,2021-03-16 02:22:43.343644
No,2021-03-16 02:22:43.936246
Who would bet billions on gamestop? Talk about going full retard!,2021-03-16 02:22:43.936365
He's also a class B psychopath ,2021-03-16 02:22:46.426966
Here to see positions,2021-03-16 02:22:47.000713
Do what right? Withdraw the funds?   Fuck you  Positions or GTFO ,2021-03-16 02:22:48.093083
kirk,2021-03-16 02:22:48.692615
Typical,2021-03-16 02:22:49.809093
PLTR gang: we average our price for the last 6 months now  it will moon any day just wait!! 🤡,2021-03-16 02:22:49.809185
*Oof* imagine the Big Hedgehogs start shorting bananas,2021-03-16 02:22:50.908098
I dodged that shit,2021-03-16 02:22:52.028302
when this shit blow up people gonna wish their average is what you have right now just be patient and trust in GME and RC,2021-03-16 02:22:53.139526
AMC still had a long way to go! Very hot stock that will get hotter in the upcoming months  Trend stock entertainment is what tech was last year,2021-03-16 02:22:55.123764
Just a crumb of $PSTH news please,2021-03-16 02:22:55.123887
Trying to at least  We have no idea how far the shorts have gone  And if anything the change is to protect the DTCC which could protect the system but I bet its more for self preservation,2021-03-16 02:22:55.123964
130,2021-03-16 02:22:56.203559
Apple didn't get a $50-billion bailout last month bruh ,2021-03-16 02:22:56.203685
As someone that works for a small charity this would be nuts  Literally insane  Charity workers spend half their time worrying about funding  This solves so many problems    Yall made them cry for sure  The weekend must have been insane and so exciting for them    That's what I love about the whole gme thing tbh  It's making things happen  It's shaking things up  Love it ,2021-03-16 02:22:56.203773
I do what I want when I want-no handler   excommunicado aficionado,2021-03-16 02:23:00.614208
apes eating the moneys just like nature intended,2021-03-16 02:23:00.614336
Plz do this to every DD ,2021-03-16 02:23:00.614465
Well matters the company a lot of other variable,2021-03-16 02:23:02.120724
That's a lot of blow jobs ,2021-03-16 02:23:02.120820
Cramer😡,2021-03-16 02:23:02.775012
I can feel how much he hates not being liked like his fake hedge fund bros,2021-03-16 02:23:02.775108
In the scenario above what would you expect the difference in profits to be between exercising the option or instead just selling the contract itself? I assume it's usually more profitable to exercise the contract and then turn around and sell the shares into the market right?,2021-03-16 02:23:03.371428
What’s up totally not asking for financial advice sitting on gains right now and want to further them should I get into AMC? Dumped it a while back and I’m noticing it’s moving in a good direction just thought I’d get a different viewpoint on this,2021-03-16 02:23:03.371595
This is blatantly sarcastic ,2021-03-16 02:23:03.371686
Yes  Yes it is ,2021-03-16 02:23:12.351056
There is no float enjoy the dip and hold or don't   The end is inevitable ,2021-03-16 02:23:12.351213
That’s dedication now that the Titty bars are open again ,2021-03-16 02:23:12.351283
Alright guys i just found out my dog needs a $6000 surgery today so I’m gonna need this to moon for her sake,2021-03-16 02:23:14.096080
5k to 25k?,2021-03-16 02:23:14.096204
Thats disrespectful beautiful and brutal all at once ,2021-03-16 02:23:15.692256
