Non-AMP Link: [https://www fool com/investing/2021/03/12/1-big-red-flag-in-amcs-earnings-report/]https://www fool com/investing/2021/03/12/1-big-red-flag-in-amcs-earnings-report/  I'm a bot  [Why?]https://np reddit com/user/NoGoogleAMPBot/comments/lbz2sg/ | [Code]https://github com/laurinneff/no-google-amp-bot | [Report issues]https://github com/laurinneff/no-google-amp-bot/issues,2021-03-16 19:51:51.642938
Thank you to all Apes and Whales who bought and held today    Sincerely from a ape in the red,2021-03-16 19:51:53.219703
Now I know why i loved The 7 deadly sins thank you ,2021-03-16 19:51:53.219812
Lol I'm lookin at dogs today too,2021-03-16 19:51:53.219866
I feel like winning today,2021-03-16 19:51:53.219914
That would actually be pretty impressive  That’s like 80 episodes,2021-03-16 19:51:53.219973
Come on let's close at 220$,2021-03-16 19:51:53.220023
Da fuq? You know something called Covid?  https://www politico eu/article/spain-adopts-curfew-state-of-emergency-to-curb-coronavirus/  https://www reuters com/article/us-health-coronavirus-spain-idINKBN27E2B2  I swear to god some of you are straight up dumb,2021-03-16 19:51:53.220228
Do what you gotta do my brother ,2021-03-16 19:51:53.876101
Had enough for one stock now have 5 gme and holding,2021-03-16 19:51:53.876192
You won’t,2021-03-16 19:51:53.876244
*****17 an hour*****,2021-03-16 19:51:54.514631
Both,2021-03-16 19:51:54.514722
They come when we are gone and downvote everything like fairys,2021-03-16 19:51:54.514773
Uh oh! Better sell at 200 after we didnt sell at $50! You sure got us hedgies! We lose!,2021-03-16 19:51:55.108523
I'll bite  But i feel like we should be buying calls like what a month or two out at least?,2021-03-16 19:51:55.108653
We all know exactly what he's gonna say so who knows how the market will react,2021-03-16 19:51:57.271960
Discount shares    don’t mind if I do🦍🦍🙌🏿🙌🏿🔥🔥🚀🚀,2021-03-16 19:51:57.272060
GME is the only Way you can ride the wave or get hit by the wave the choice is yours 🌊🐳,2021-03-16 19:51:57.272115
Don’t listen to this autist,2021-03-16 19:51:57.272187
Or just do it anyway,2021-03-16 19:51:57.272234
ItS DifFeReNt!!!!!!!!!,2021-03-16 19:51:58.371413
I didn't hear no bell ,2021-03-16 19:51:58.371569
Just got a job at this place I wanna work at but just found out I gotta take a drug test in a few days  I smoke copious amounts of weed daily    WHAT DO I DO,2021-03-16 19:51:58.371652
I thought it might be a fun little thing  I know $35 isn't a lot ,2021-03-16 19:51:58.371731
Do you know what time it is at on Wednesday?,2021-03-16 19:51:58.371821
Wtf is with your pfp,2021-03-16 19:51:58.991882
what a pussy lol,2021-03-16 19:51:58.992001
On which timeframe?,2021-03-16 19:51:58.992076
Man you let your girl do that every night,2021-03-16 19:51:58.992149
double nunchuck jabberwocky pattern forming,2021-03-16 19:52:00.161945
You've had that conversation too,2021-03-16 19:52:00.162064
We're dealing with some real galaxy brains these guys are smart,2021-03-16 19:52:00.162145
Everyone’s all jpow this jpow that just wait until chairman sanders starts trustbusting tomorrow too,2021-03-16 19:52:02.429113
You mean April 19th? Cause that's the real date  Shareholders must call in shares by April 20th to vote in the June shareholders meeting   Everything is likely just baby squeeze up until those first two weeks of april,2021-03-16 19:52:02.429216
Thank you kind ape,2021-03-16 19:52:02.429277
ET   CHECK THE TICKER    If you can read charts   If you cannot buy calls 2 weeks out ,2021-03-16 19:52:02.429329
It’s like it’s both of ours,2021-03-16 19:52:03.547304
Good bot,2021-03-16 19:52:04.170498
GREEN EOD,2021-03-16 19:52:04.170623
*Knock knock knockin on heaven’s door* 🚪   Got kids to feed and a wife that needs attention 👙,2021-03-16 19:52:04.788850
Jim Cramer uses a Crown Royal bag to hold his PedEgg,2021-03-16 19:52:05.906586
# Can’t stonk,2021-03-16 19:52:07.093338
This is the way,2021-03-16 19:52:10.441657
Meanwhile Jim Cramer is eating pizza with a fork ,2021-03-16 19:52:10.441782
LMAO 10 more minutes lets make this fucking chart green so close!!!,2021-03-16 19:52:10.441864
540,2021-03-16 19:52:10.441938
"""How can we have insider knowledge when we have no knowledge?""   *I am a bot and this action was performed automatically  Please [contact the moderators of this subreddit]/message/compose/?to=/r/wallstreetbets if you have any questions or concerns *",2021-03-16 19:52:10.442015
327 GME AND I AINT LEAVING,2021-03-16 19:52:10.442100
Just bought 16k of CRWD in preparation for an earnings beat,2021-03-16 19:52:10.442171
WISH,2021-03-16 19:52:10.442242
We did good today people 💎👑🖖  Patience and ✌️👑💎  Have a good night/day,2021-03-16 19:52:11.053059
Pump it pump it,2021-03-16 19:52:11.053189
We are not cats  Apes ,2021-03-16 19:52:11.053264
Gonna name my son Andy but spell it &y,2021-03-16 19:52:11.682163
Is this Perth Amboy?,2021-03-16 19:52:11.682273
Why does it look like my whole town is for sale ,2021-03-16 19:52:11.682327
I’d buy this $X dip while you can  We taking off this week🚀,2021-03-16 19:52:11.682378
Does the 10 year yield have any effect on GME? I mean the kind of people who yolo Into GME like myself don't give af about it,2021-03-16 19:52:12.280901
[Well obviously you have to remove the brain before trying this method ]https://i imgur com/TDjETvF jpg Water can’t get in there otherwise    We will see each other on the moon with tendies in hand  🚀,2021-03-16 19:52:12.927543
They will be worth everything ,2021-03-16 19:52:12.927672
He can't even afford to use paintbrush,2021-03-16 19:52:12.927748
Seven dollars come on baby,2021-03-16 19:52:12.927821
I would love to see a whale push this positive right now,2021-03-16 19:52:14.045679
This slaps,2021-03-16 19:52:15.198321
FCUKING HODL 🦍 🐳,2021-03-16 19:52:15.198447
Don't force it  The market is open 253 days of the year  It only takes one bad day to blowup your portfolio so be patient   Do some market research  Are there any catalysts occurring in the near future? Odds are if you find a ticker here you're probably late to the party ,2021-03-16 19:52:15.198795
Holy shit OP you are genuinely retarded    Godspeed,2021-03-16 19:52:17.387618
PLTR PLEASE 26 2 CLOSE,2021-03-16 19:52:17.387713
JESUS bro I shudder from seeing your position  You  Have  Balls  of  Diamond  Good luck man!,2021-03-16 19:52:17.387765
Just revisiting this thread to share some new information regarding Nokia and a new strategic partnership in regards to 5g platform solution   https://translate google com/translate?sl=auto&tl=de&u=https://www golem de/news/open-ran-nokia-und-microsoft-verbinden-cloud-und-5g-produkte-eng-2103-154963 amp html?xing_share%3Dnews  As mentioned in a previous post  I would strongly advise delayering the 5g value chain for your DD  PM me if your serious on doing a DD on this   Tl;dr: they seem to think that they wont be the burner as O-RAN platform partner therefore teaming up with MS-Azure ,2021-03-16 19:52:17.387824
BABA might be the biggest on sale in the whole market,2021-03-16 19:52:17.387894
Alexa Play Diamond Hands Rockets,2021-03-16 19:52:18.516677
WTF!,2021-03-16 19:52:18.516769
Bearish signal from my trading bot recommending selling Mar19 SPX 3995/4010 call credit spreads  I'm not doing it because I don't think the risk/reward profile is very good but help yourself if you like ,2021-03-16 19:52:18.516833
LMAO you fucking apes putting in ASKs for 5-50K just now  That's a low value  Aim higher   &#x200B;  This is not financial advice ,2021-03-16 19:52:18.516908
Careful $ASS is a pump and dump,2021-03-16 19:52:19.188778
hodl,2021-03-16 19:52:19.188881
Also some options need to be covered from Friday among other things ,2021-03-16 19:52:19.188939
Whats with these? Its almost close  You had plenty of dips today ,2021-03-16 19:52:19.797566
All that work for around a 3% eod drop huh hedgies?  Feeling scurred yet?,2021-03-16 19:52:20.934623
That's the average of a sales associate now ,2021-03-16 19:52:20.934740
It might dip last few min hodl on my fellow apes  I CANT WAIT FOR TOMORROW!!!!,2021-03-16 19:52:22.197971
Am with you :,2021-03-16 19:52:22.198064
Sounds like you deserve a little good karma  I’ve got my fingers crossed for you ,2021-03-16 19:52:22.198116
Technoking 💯💎🙌,2021-03-16 19:52:23.317132
really? dang   never been a big fan of Dominos  For some reason I always get stomach sickness after eating Dominos or Little Caesars   But hey if that's what they wanted   then great  You did a good job!,2021-03-16 19:52:23.317351
Great point  It does look like cold brew  work won’t know the difference,2021-03-16 19:52:23.975916
I’m holding until at least long term capital gains,2021-03-16 19:52:23.976041
You have to know what the hell you are looking at  In the meantime wait  I estimate bottom between 85-130,2021-03-16 19:52:23.976122
We need 7 $$,2021-03-16 19:52:23.976213
Lets close over $225 you fuckers ,2021-03-16 19:52:25.173689
Ah yes the perfect time for a stock to hit its low for the day **10 minutes before closing**  Fuck my life here comes even more panic selling on VUZI,2021-03-16 19:52:25.173815
Uuuhhhh ummm 🍌 !!!,2021-03-16 19:52:25.173900
Mark Twain could never be more proud of this Community,2021-03-16 19:52:25.173974
Less amazing than a 223 close,2021-03-16 19:52:25.174046
Fuck yea let’s do it  I’ll chug one as soon as I get home,2021-03-16 19:52:25.809614
So excited for stimmy day tomorrow,2021-03-16 19:52:25.809751
How retarded would it be to enter new positions today when I'll be on a plane and unable to watch them tomorrow?,2021-03-16 19:52:26.949348
Do not fight J POW learnt last year,2021-03-16 19:52:26.949513
Stimmy coming in hot tomorrow GME to the moon!! 💎🙌🚀!!!,2021-03-16 19:52:26.949602
#Boing!,2021-03-16 19:52:26.949682
"*Merci frère singe français *  The French saved us ""the last time"" when we were not allowed to think for ourselves   we may need you guys again soon   LOL   Longue vie à la APES!",2021-03-16 19:52:26.949756
Remember: hedgies planned for this to be worth ZERO  It’s currently worth over TWO HUNDRED  They are LOSING  ✋🏻💎,2021-03-16 19:52:28.059547
I CANT STOP WHACKIN IT TO THIS STOCK,2021-03-16 19:52:29.197292
Awww fuck thats tomorrow  J,2021-03-16 19:52:29.197412
My green puts too ,2021-03-16 19:52:29.197502
Rkt y u do dis?,2021-03-16 19:52:29.197579
Proof that something like this exist  ?,2021-03-16 19:52:29.820391
yes or no?,2021-03-16 19:52:29.820536
Let me start from the beginning when I was a boy in Bulgaria     *I am a bot and this action was performed automatically  Please [contact the moderators of this subreddit]/message/compose/?to=/r/wallstreetbets if you have any questions or concerns *,2021-03-16 19:52:29.820623
Options now available today! Weren't yesterday  Cathy need apesmash,2021-03-16 19:52:30.955747
I mean         Ok      I love them but some of their songs are purely full-blown leftwing propaganda ,2021-03-16 19:52:30.955871
Has my mans bought those 5k shares yet?,2021-03-16 19:52:30.955950
Play for EOD?,2021-03-16 19:52:30.956019
Come on green,2021-03-16 19:52:30.956086
Can I get the zerohedge full body work out plan?,2021-03-16 19:52:33.532720
CRSR,2021-03-16 19:52:33.532982
Might as WHALE buy \*cough cough\*,2021-03-16 19:52:33.533044
Sir this is a catnip lounge   *I am a bot and this action was performed automatically  Please [contact the moderators of this subreddit]/message/compose/?to=/r/wallstreetbets if you have any questions or concerns *,2021-03-16 19:52:34.114470
GME $1000 eod save this comment,2021-03-16 19:52:34.114622
This  Check out some of the subs stickied posts there's an faq linked with all the exploitations,2021-03-16 19:52:34.800306
Eat my dongus you fuckin nerd   *I am a bot and this action was performed automatically  Please [contact the moderators of this subreddit]/message/compose/?to=/r/wallstreetbets if you have any questions or concerns *,2021-03-16 19:52:35.919847
Anyone else thinks there's gonna be a drilling tomorrow?,2021-03-16 19:52:35.919970
What are his plays,2021-03-16 19:52:35.920046
One punch is the greatest but god I hate it dubbed,2021-03-16 19:52:35.920118
MODS!,2021-03-16 19:52:37.033409
What is 70% of the public float anyway? About 5% of outstanding shares?,2021-03-16 19:52:37.033565
MACD at the precipice of crossing it just needs to fucking cross already,2021-03-16 19:52:38.147110
🧡 u more,2021-03-16 19:52:38.147208
So VXX is my mom?,2021-03-16 19:52:38.147259
Urine sample from a friend?,2021-03-16 19:52:38.147305
Im wondering why we have days where we fill three threads and days where the comment count is less than 50k ,2021-03-16 19:52:38.751315
It could be more erect tho,2021-03-16 19:52:39.878567
200+ is a win in my book  The entire market took a shit today GME is floating in the middle of my portfolio a sea of red,2021-03-16 19:52:41.015182
Do what you think is best  You don’t have to listen to the apes telling you you must hold  Me personally I would hang on for just a bit longer at least because these next three days seem extremely good for GME,2021-03-16 19:52:42.130101
POV that guy's wife,2021-03-16 19:52:42.130224
TSLA FDs or what?,2021-03-16 19:52:42.734848
Jim Cramer doesn't use his turn signals ,2021-03-16 19:52:45.369435
How are you facing your family after this day?  Will you talk to them in a shitty mood?,2021-03-16 19:52:45.369596
Remember when Portnoy was bullish then paper handed then fomo'd back in?  Dont be that guy ,2021-03-16 19:52:46.504397
Perfect,2021-03-16 19:52:46.504535
*ENPH ENPH ENPH LETS GO 200 in 2 weeks*,2021-03-16 19:52:46.504594
there’s a huge difference between 900k people buying and selling like in the first minute of buying vs 900k people just buying  the later is closer to what we’d expect,2021-03-16 19:52:46.504649
It wants to go green so bad,2021-03-16 19:52:46.504705
Proof or ban,2021-03-16 19:52:47.107766
Suck my dongus you fucking nerd,2021-03-16 19:52:47.107858
#RETAIL WILL OWN ALL SHARES THAT PHYSICALLY EXIST   #THUNDERSTRUCK !,2021-03-16 19:52:47.107913
Alexa play só vendo a vista from Martinho da Vila,2021-03-16 19:52:47.713735
I'M RECLAIMING MY TIME!!!   *I am a bot and this action was performed automatically  Please [contact the moderators of this subreddit]/message/compose/?to=/r/wallstreetbets if you have any questions or concerns *,2021-03-16 19:52:48.835877
Choppy choppy pee pee!,2021-03-16 19:52:48.835977
No ones seen them together in the same room tho ,2021-03-16 19:52:48.836028
seen the stock price be *$xxx* 77 and *$xxx* 33 a lot of times today  that’s a good sign! i’m confident tomorrow is gonna be great,2021-03-16 19:52:48.836080
What are those?,2021-03-16 19:52:49.988305
Well done 👍,2021-03-16 19:52:49.988406
༼ つ ◕_◕ ༽つ GME TAKE MY ENERGY ༼ つ ◕_◕ ༽つ,2021-03-16 19:52:51.088400
Based on what I've seen from RKT UWMC CRSR etc  I bet they smash earnings and their stock will fall 20% because bankers prefer raspberries ,2021-03-16 19:52:51.088543
Returning to the gold standard is both literally impossible and also a form of fiat currency   Anyone who believes that moving to a gold backed currency will solve more problems than it creates doesn't understand how currency works  Or how gold works did you know that it's necessary for electronics? Do you understand the effects of the source of value for a currency being a resource required for basically every industry?****  There is about $10 trillion of gold ever dug up  Worldwide  How much is still on the market? How much still is accessible? Impossible to tell   Moving to a gold backed currency will destroy economy of any nation that tried  Even post economic failure it will never be possible for gold to back a currency  Unless society as a whole collapses in some apocalyptic future the amount of people alive and the amount of goods and services that must be exchanged make a gold economy unfeasible ,2021-03-16 19:52:51.694720
You have done an excellent job at wasting my time    *I am a bot and this action was performed automatically  Please [contact the moderators of this subreddit]/message/compose/?to=/r/wallstreetbets if you have any questions or concerns *,2021-03-16 19:52:51.694890
Been sitting on 50% cash for like 3 days now  No clear plays at all after a big correction then bounce  Can’t feel anything without 100% of my money in the markets tho  What do,2021-03-16 19:52:51.694981
Thoughts on how earnings will go? I just put down 16k,2021-03-16 19:52:51.695065
Dildo alert,2021-03-16 19:52:52.791784
"He wont say anything other than ""we are watching inflation and rates closely    we are targeting long term 2% inflation    we may overshoot that in the short term but all indications are that we are close to on target for our expected and desired inflation levels    We are constantly evaluating but as of right now we dont see any reason to drastically change our long term course   ""  And then the markets will tank ",2021-03-16 19:52:53.925242
🚀🚀🚀🚀🚀🚀🚀🚀🚀🚀🚀🚀🚀🚀🚀  🚀🚀🚀🚀🚀🚀🚀🚀🚀🚀🚀🚀🚀🚀🚀  🚀🚀🚀🚀💎💎💎💎💎💎💎🚀🚀🚀🚀  🚀🚀🚀💎💎💎💎💎💎💎💎💎🚀🚀🚀  🚀🚀💎💎💎💎💎💎💎💎💎💎💎🚀🚀  🚀🚀🚀💎💎💎💎💎💎💎💎💎🚀🚀🚀  🚀🚀🚀🚀💎💎💎💎💎💎💎🚀🚀🚀🚀  🚀🚀🚀🚀🚀💎💎💎💎💎🚀🚀🚀🚀🚀  🚀🚀🚀🚀🚀🚀💎💎💎🚀🚀🚀🚀🚀🚀  🚀🚀🚀🚀🚀🚀🚀💎🚀🚀🚀🚀🚀🚀🚀  🚀🚀🚀🚀🚀🚀🚀🚀🚀🚀🚀🚀🚀🚀🚀  🚀🚀🚀🚀🚀🚀🚀🚀🚀🚀🚀🚀🚀🚀🚀,2021-03-16 19:52:55.028692
Hopefully you are out of the wash sale window,2021-03-16 19:52:56.158138
All the way out to April 16th?  Nice   You'll be in the money tomorrow ,2021-03-16 19:52:56.158347
That's OTC ,2021-03-16 19:52:56.158463
ily green whale,2021-03-16 19:52:56.765758
Please mass produce,2021-03-16 19:52:56.765879
100% cowboy 🤠,2021-03-16 19:52:56.765962
This just dilutes equity ,2021-03-16 19:52:57.891692
DONT CALL IT A COMEBACK,2021-03-16 19:52:59.021704
Feels like it's time to       BUY MORE AMC BABY!! OH YEAH! LET'S GO,2021-03-16 19:52:59.021801
You missed it sorry dick,2021-03-16 19:52:59.021855
ALEXA PLAY GREEN DAY,2021-03-16 19:52:59.021903
Looking for someone with real knowledge of options to give me a pointer  Say a hypothetical stock is at $25sp I expect by expiration date of 3/26 said stock will be around $40   is it better to buy a call closer to the $25sp current say maybe like $27-30sp then hold it until $40 or is it better to buy the call closer to the $40sp say around $33-37sp range?,2021-03-16 19:52:59.021953
It almost feels like they dumped their bag the last 2 days to hedge the coming gamma squeeze from last weeks options  ,2021-03-16 19:53:00.145997
Can anyone tell me why it's so hard to get the live chart on yahoo finance app?,2021-03-16 19:53:00.763335
Naw that’s the best  No need to watch it everyday ,2021-03-16 19:53:01.866317
"Problem is their very name sounds Boomeresque which is a death-knell  Golden Nugget sounds like where my Trumptard uncles and cousins go to in Vegas because everything on The Strip sounds too ""modern"" ",2021-03-16 19:53:02.974652
Contributed a modest 5 shares purchase to powerhour,2021-03-16 19:53:02.974777
"I get the first people who paper handed when it went from 380+ to 40 I can understand  Retards who panicked at the second fake ""crash"" a few days ago? Well they might have been new  But paperhanding on a third obviously vapid effort to drive the price down? Just before a day that should be bullish? Come on dude! You might be lost if you were looking for r/investing   ",2021-03-16 19:53:04.133854
If we finish in the green at 220 that is a colossal victory,2021-03-16 19:53:04.133958
8 MORE MINUTES,2021-03-16 19:53:04.134011
This GME's one helluva drug!  Same time tomorrow then?  See ya Apes!,2021-03-16 19:53:04.744911
I am a bot from /r/wallstreetbets  You submitted a picture with a banned phrase ,2021-03-16 19:53:05.875976
I'm scared that you might not be joking ,2021-03-16 19:53:05.876075
Where? That's a stock I'm pretty sure,2021-03-16 19:53:05.876127
400 EOW and I will livestream myself making tendies from scratch on that bullshit reddit streaming thing,2021-03-16 19:53:05.876176
If you’re being sarcastic you must have never had a Bud Ice 🤮,2021-03-16 19:53:05.876228
We're doing fine guys  Am I the only one who remembers it dropping like a rock and bottoming at $40? This is nothing ,2021-03-16 19:53:07.002744
I needed this earlier when it went sub $180 look at us now,2021-03-16 19:53:07.002851
Hair or piss test?,2021-03-16 19:53:08.114843
HFs can't keep us grounded  They got bad vibes! We're on that💎🙌🦍🚀 shit! We're on fumes to the moon! 🌝,2021-03-16 19:53:08.740206
I'm in how big a rock?,2021-03-16 19:53:10.035839
If true I’ll buy you scotch ,2021-03-16 19:53:10.035937
Remember apes these dips won’t even be on the graph because of how high this will go,2021-03-16 19:53:10.035991
If you follow this logic you will exit the banking system by buying silver and gold and holding it physically  Go Galt my son  Buy silver and free yourself ,2021-03-16 19:53:10.036044
Synthetic urine my mang,2021-03-16 19:53:11.135560
right I agree with you in terms of instant buying power however I signed up with TDA and was able to deposit and buy immediately as well    RH is taking the full 5-7 business days to clear deposits through and this was even before the Jan spike that they were taking that long    I would not trust RH when it comes time to sell either ,2021-03-16 19:53:11.135691
Still up from open  I’ll take that as a win,2021-03-16 19:53:11.789695
Boooom 💥 haha 🥳 another great day to be a ape - thanks for the amazing sales,2021-03-16 19:53:11.789836
****BARNACLES HAVE THE LARGEST DICKS PROPORTIONAL TO THEIR SIZE****  Strap yourself to a whale and ride this wave to the moon!,2021-03-16 19:53:11.789923
Your mom is probably a nice lady,2021-03-16 19:53:11.790002
ɴᴏᴡ ᴘʟᴀʏɪɴɢ: [Wegen S*x im Auto Rücken geb]https://www youtube com/watch?v=DO8fWMiufWg ─────────⚪───── ◄◄⠀[▶]https://www youtube com/watch?v=DO8fWMiufWg⠀►►⠀12:55 / 19:23 ⠀ ───○ 🔊 ᴴᴰ ⚙️,2021-03-16 19:53:12.919462
Same but I will eat a dog this shit goes 420 69,2021-03-16 19:53:12.919606
Awesome lol bet that was surprising as hell!,2021-03-16 19:53:12.919682
you are winning son,2021-03-16 19:53:12.919755
Did any connection between GME and SLGG ever get confirmed? SLGG is going crazy rn maybe getting bought by gamestop ah?,2021-03-16 19:53:14.129146
🚀🚀🚀🚀🚀🚀🚀🚀🚀🚀🚀🚀🚀🚀🚀🚀🚀🚀🚀🚀🚀🚀🚀🚀🚀🚀🚀🚀🚀🚀🚀🚀🚀🚀🚀🚀🚀🚀🚀🚀🚀🚀🚀🚀🚀AMC IS LOOKING GOOD BOYS! 🚀🚀🚀🚀🚀🚀🚀🚀🚀🚀🚀🚀🚀🚀🚀🚀🚀🚀🚀🚀🚀🚀🚀🚀,2021-03-16 19:53:14.129251
That’s pretty nice  I get paid $12/hr to take care of 20 preschoolers a day ,2021-03-16 19:53:14.129308
RemindMe! 1 day,2021-03-16 19:53:14.129359
Can you cancel/replace an order this way? I would enjoy dangling the carrot all the way up to 420069,2021-03-16 19:53:15.250770
I'll let her peg me if it closes 😎,2021-03-16 19:53:15.250897
Aquaman  Summon the whales!!!,2021-03-16 19:53:15.250978
I see you got some downvotes here but I'm with you  I get my stimmy tomorrow and I wanna buy more!,2021-03-16 19:53:15.251053
bought today  hope you’re right ,2021-03-16 19:53:15.251130
*buy buy GME,2021-03-16 19:53:15.866185
Shit 1 or 2 shares will be worth a few hundred grand soon enough ,2021-03-16 19:53:15.866302
Where’s homeboy whose shit i upvoted today in the thread   We need you to buy them shares and get this bitch moving on up,2021-03-16 19:53:15.866383
This place is bunk now  Why would they ban this person  Let him buy  Fuck You Melvin,2021-03-16 19:53:15.866478
✊,2021-03-16 19:53:16.980608
Only if the stock goes up  A FTD = short supply on the market that shouldn’t be anymore   Stock market = price discovery mechanism  FTD implies they didn’t buy back the shares their required too  Which implies a supply demand imbalance favoring the sell side ,2021-03-16 19:53:16.980736
Fortunately for us that’s not the case  If it were there would be no squeeze ,2021-03-16 19:53:18.160132
#REEEEEEEEEEEEEEEEEE,2021-03-16 19:53:18.160257
They're probably gonna beat Q4 expectations because of the console launch  My local gamestop had lines out the door for PS5 and XBOX sales during the holidays season  The more interesting thing is that they'll probably beat Q1 expectations too because of the stock mania which would be hilarious ,2021-03-16 19:53:18.160338
Bad bot ,2021-03-16 19:53:18.786711
Panini is an unlisted PLC,2021-03-16 19:53:18.786831
That may be but the whales like DFV are guiding us  Even if they do it for selfish purposes like getting they're profits up an extra 5-10% this is a fight worth fighting  Plus I rather like the months pay I'll be getting out of this ,2021-03-16 19:53:19.900274
Urinate in your mouth and spit it into the cup when you go in for the test ,2021-03-16 19:53:19.900375
700?,2021-03-16 19:53:19.900428
so help dumb ape is gain or loss now?,2021-03-16 19:53:19.900537
yOalaooi,2021-03-16 19:53:19.900614
Slainte,2021-03-16 19:53:21.031018
You need Wendy’s,2021-03-16 19:53:21.031144
Did that guy buy his 5k shares yet?,2021-03-16 19:53:22.145084
