Buy 27c for this time next year and be rich  Guarenteed,2021-03-16 19:22:21.150325
idk some guy down in the comments said he follows it til 10pm which is 2 hours after it closes lollll,2021-03-16 19:22:21.150463
I'm at UTC+2  So premarket to close ,2021-03-16 19:22:22.271326
Does wine count? It's basically fruit ,2021-03-16 19:22:22.271481
Down $777  Buying calls,2021-03-16 19:22:22.271561
Get excel certified literally talk to any highschool teacher that teaches a computer class,2021-03-16 19:22:22.271633
Is xvideos the best?,2021-03-16 19:22:22.886329
PAMP IT !,2021-03-16 19:22:22.886447
Anytime you need to do something google it  There's a fuckton of articles and clips to teach you how to accomplish any task and forms of helpful people to give feedback ,2021-03-16 19:22:23.989086
Meow,2021-03-16 19:22:23.989220
He didn't name names but I'm 100% confident he was talking about Facebook and Alphabet,2021-03-16 19:22:25.123763
Karp fucks with us he knows whats good,2021-03-16 19:22:25.123885
it harmed my ears and eyes before i figured out how to turn it off,2021-03-16 19:22:25.757014
Melvins used short!  Its    not very effective   ,2021-03-16 19:22:25.757140
I know but yeah you’re able to disable it,2021-03-16 19:22:26.903943
Are we salmons or are we apes?,2021-03-16 19:22:26.904067
IF YOU'RE GOING TO FILIBUSTER YOU SHOULD RUN FOR SENATE!   *I am a bot and this action was performed automatically  Please [contact the moderators of this subreddit]/message/compose/?to=/r/wallstreetbets if you have any questions or concerns *,2021-03-16 19:22:26.904152
Gina Valentina is incredible,2021-03-16 19:22:26.904236
That's a legit PR strategy,2021-03-16 19:22:26.904307
"P  Diddy in 2007 reminded me of what happens when you're rich and the people around you don't critique you  His political ""humor"" was cringe",2021-03-16 19:22:26.904382
If GME finishes in the green today I swear to the mods that I will be happy that we had a green day ,2021-03-16 19:22:26.904474
so would DFV be a Silverback Alpha gorilla?,2021-03-16 19:22:28.026066
"No no you eat all the crayons you want as long as they're the legit non-toxic ones  Sick apes aren't helpful  I meant that ""s"" word you said ",2021-03-16 19:22:28.026191
I am a bot from /r/wallstreetbets  You submitted an image I've already seen before                     If you're submitting a position screenshot use Gain/Loss/YOLO flair or it'll be duplicate checked                      If you submitted something and then immediatley deleted it    don't do that next time                     Ask mods for an approval  If you edit non-OC just to repost it you will probably be banned ,2021-03-16 19:22:28.026279
Holy moly man,2021-03-16 19:22:29.137341
Solid finish sounds like staying hard after you $CUM,2021-03-16 19:22:29.137479
Palantir = Sold  GME position = 265 shares    YOLO ,2021-03-16 19:22:29.137568
Ape brain to smooth  Slope good,2021-03-16 19:22:29.767342
EAT DONGUS MELVIN,2021-03-16 19:22:29.767486
I am also a gay bear when it comes to this stock ,2021-03-16 19:22:29.767689
![img]emote|wsb_emojis|bull,2021-03-16 19:22:30.936334
ape no care ape just buy and hold  ape also like bananas,2021-03-16 19:22:30.936468
Does that come with a certification i could throw on my resume? Looks good ,2021-03-16 19:22:32.042060
I bought a FD right before the run up and made 1100% before selling   I still think it's a shit stock   I'm holding a $25 call for this week that will go nowhere ,2021-03-16 19:22:32.042189
Who the fuck is using YouTube without adblock?,2021-03-16 19:22:34.658391
Again if we finish in green I will not have a wank tonight   💎🍆🦍,2021-03-16 19:22:35.271068
10k is meme and I think a lot of people are going to get hurt holding the bag waiting for 1k while savvier investors are going to get out at a different price   Full disclosure though I only buy puts on GME,2021-03-16 19:22:35.271199
You can buy and sell until 8pm but the market price is worse than regular trading hours due to less people buying and selling,2021-03-16 19:22:35.931518
JUST BOUGHT CALLS ON HF tears! 😂,2021-03-16 19:22:37.045102
That would be awesome  Cash gang and I could just drop it into spy and not have to check TOS daily anymore and ce back a year later to some extra commas in my port,2021-03-16 19:22:39.818470
the dude remind me of the Mars inhabitants in Total Recall ,2021-03-16 19:22:39.818622
Someday I hope to give birth to an ape ,2021-03-16 19:22:39.818704
boobs,2021-03-16 19:22:39.818778
Fuck CNN they don't wanna see us win,2021-03-16 19:22:40.400330
Hello  Please sell your GameStop to me for $10,2021-03-16 19:22:40.400464
What happened,2021-03-16 19:22:41.033704
Yes the price increase was from dumb retail investors who have been flat-out manipulated and lied to  There's no evidence that short positions are the same as they were in January ,2021-03-16 19:22:41.033839
Paper handed few shares this morning but I came back at top to atone for my sins this time  I ain't no bitch,2021-03-16 19:22:42.158298
Sherman increased holdings  That has to be a bullish sign  💎🙌,2021-03-16 19:22:42.158420
Socks are really neat actually cause your feet stay a bit warmer,2021-03-16 19:22:42.158514
The stocks should be like my local casino have to pay out 91% to keep their gaming license   🤔,2021-03-16 19:22:42.789681
NAME A STOCK WORSE THAN PLTR I'M WAITING,2021-03-16 19:22:43.911779
Did you guys see the PLTR ceo?  I love that weirdo,2021-03-16 19:22:43.911895
it will hit 17 before it hits 25,2021-03-16 19:22:43.911972
That seems like the plan    Make the stock look bad so stimulus cash won't be invested in gme    They don't seem to understand that rational thinking has no place here  Or any kind of thinking for that matter      We only know:buy hold moon ,2021-03-16 19:22:43.912050
Mech engr reporting in!,2021-03-16 19:22:45.013595
Papa Karp we love you!!!!,2021-03-16 19:22:45.013730
CNBC live interview,2021-03-16 19:22:46.148648
Looks like he took care of the crypt keeper,2021-03-16 19:22:46.148766
except no not at all really ,2021-03-16 19:22:48.269253
This is the way,2021-03-16 19:22:48.269380
Incredible  I’m very jealous  I have 120 at $250,2021-03-16 19:22:49.373434
Very wet AP? Wouldn’t know how that feels ill ask my wife’s bf,2021-03-16 19:22:49.373658
If GME closes green today I’ll watch the big short tonight ,2021-03-16 19:22:49.373753
you made a claim that elon tried to coup a country then cited google as a source    but yeah I'm the special one brah,2021-03-16 19:22:49.373842
As long as market goes green and I can at least print my calls sounds good to me,2021-03-16 19:22:49.373921
Meows,2021-03-16 19:22:49.374011
What's this a power hour for ants?!!,2021-03-16 19:22:49.967350
Set buy limits if your on RH,2021-03-16 19:22:51.094571
You got it        Closes @ $195 16,2021-03-16 19:22:51.684287
10 bro x,2021-03-16 19:22:52.784527
I take it you also read that yahoo article as “billionaire uses billions to make millions when brokers restricted trading in jan” fuck these people,2021-03-16 19:22:52.784660
I’m curious to see how the SAF group merger that was announced yesterday will play out with sundial  I’m holding some shares long ,2021-03-16 19:22:53.945051
Papa Karp please take us to green,2021-03-16 19:22:53.945176
Every day it drops below 10% of previous closing it is on ssr for the rest of the trading day and the next day ,2021-03-16 19:22:53.945253
tomorrow's crash will be called the Great Stimmy Collection of 2021,2021-03-16 19:22:53.945327
Do it anyways you need to de stress,2021-03-16 19:22:53.945398
Why aren't BABA puts on the menu? Winnie's gonna cuck em,2021-03-16 19:22:55.053068
Thats not a wallstreet bet retard,2021-03-16 19:22:55.053257
Stimulus checks hit tomorrow if someone is thinking about hopping in then now is the time to buy the fire sale while you can! This is not financial advice I just like the stock!,2021-03-16 19:22:55.053344
Those cocksuckers really think we're going to sell lmfao  the shit dropped to $40 a couple weeks ago and we still didn't fold ,2021-03-16 19:22:56.167556
Lol same,2021-03-16 19:22:56.167695
Were a dick on wheels,2021-03-16 19:22:56.167775
original,2021-03-16 19:22:58.164784
Well that drill was scary for a second,2021-03-16 19:22:59.263760
I can never get them off  Even with that stupid tool  I have had them fail I don't use them for a permanent fix  More of a bandaid until the weekend ,2021-03-16 19:22:59.896841
Melvin pays me to take big stinkies  I show respect by naming my big stinkies after him :,2021-03-16 19:22:59.896963
Yahoo finance is so ASS what do you guys use??? That isnt paid Lv2 data,2021-03-16 19:22:59.897043
Very fair assumption  I have calls for if April if you check out the o/I and volume there is high activity around that time  But I think that it can easily get back on track as they refute the short report and show a strong push towards the model and a set September production date  I think that should reflect in price now it won’t go to $100 or $50 maybe not $40  But I can see a 10-15 short term price jump,2021-03-16 19:22:59.897123
OP has been swing trading and posting as if he's buying and holding for karma,2021-03-16 19:22:59.897229
Okey dokey gimme a sec I'll pm you,2021-03-16 19:23:01.039484
Ain't over yet !!!,2021-03-16 19:23:01.039620
MODS,2021-03-16 19:23:01.039715
yes,2021-03-16 19:23:02.154735
132% of the public float and 115% of shares?   How is this even legal?,2021-03-16 19:23:02.154857
Good bot,2021-03-16 19:23:02.154936
The hf should be up against stimmies,2021-03-16 19:23:02.155015
I’m still negative $456  I’m sitting pretty got some nice discounted coming when stimmy hits in the morning!,2021-03-16 19:23:02.155091
Keeper of the Keys and Grounds at the preschool,2021-03-16 19:23:02.779957
Thx  I’m on fidelity and I thought I enabled it  Tried to buy this morning ,2021-03-16 19:23:03.889473
I disabled mine when I signed up ,2021-03-16 19:23:03.889600
I am a bot  You submitted a picture of a banned ticker NXP                             Yell at /u/zjz if it's above 1 billion-ish market cap and not related to crypto/pennies/OTC/SPACs ,2021-03-16 19:23:03.889679
Pepperoni and green peppers Mushrooms olive chives,2021-03-16 19:23:05.017766
Is the Boring Company actually building a technodrome?,2021-03-16 19:23:05.017885
why are people saying GME earnings could be a catalyst? Isn't everyone expecting the earnings to be low?? Just trying to understand why people are saying that,2021-03-16 19:23:05.017966
>the hedgies wont simply just roll over and give up   They should   You don't get out of a hole by digging deeper ,2021-03-16 19:23:06.162018
proof or ban,2021-03-16 19:23:06.162118
I support the sentiment     but objectively speaking this song is pure trash 😂,2021-03-16 19:23:06.769488
I’ve been checking your updates  Not sure how many of us there are though ,2021-03-16 19:23:06.769637
My portfolio is down 6 66% right now nice,2021-03-16 19:23:06.769725
Niceee 🤙,2021-03-16 19:23:07.896370
Eh yeah that’s valid  I bought $600 weekly puts  I agree with you no way it’ll hit $400 without a violent bounce,2021-03-16 19:23:07.896526
Proof or ban,2021-03-16 19:23:07.896614
Lmao,2021-03-16 19:23:09.102741
This wise ape has many wrinkles in his brain ,2021-03-16 19:23:09.102859
proof or ban,2021-03-16 19:23:09.102938
No money left I’m just a dumb teenager F,2021-03-16 19:23:10.225757
I'm buying chicken tendies and Chic Fil A cuz that's all I'll be able to afford once my $12k investment hits zero,2021-03-16 19:23:10.866320
Good thing this isn't one of those,2021-03-16 19:23:10.866418
Ah-ha! See I already know you’re the Melvintern   so  yea   that’s all ,2021-03-16 19:23:10.866520
Rule 6969:  Find a nice gal who gives good oo-mox ,2021-03-16 19:23:12.039063
yeah due for a breakout like it's been for the last 6 months  I wouldn't take static as a good sign right now I've lost a part of my shirt betting that static for a week was a consolidation instead of oh look suddenly eating shit for no reason,2021-03-16 19:23:12.039190
If you have an account with Stash Invest and are opted in their securities lending program you may be lending your shares to Melvin especially if you own the Gamers FTW! ETF aka GAMR or Retail Therapy aka XRT   Not financial advice ,2021-03-16 19:23:12.039313
Proof or ban,2021-03-16 19:23:12.039398
My man  What color lambo are you selecting?,2021-03-16 19:23:13.154053
Karp using pltr tech to spy on Mark Zuck 100% 😂,2021-03-16 19:23:13.154176
Square,2021-03-16 19:23:13.796138
Melvins a ratfucker,2021-03-16 19:23:13.796257
Please come back for me at $15 10 fellow apes,2021-03-16 19:23:13.796624
Very informative dd thanks a bunch,2021-03-16 19:23:14.910430
Jim Cramer uses coupons at restaurants and tips based on the discounted price ,2021-03-16 19:23:14.910559
Advance those stimmy checks today and strike!,2021-03-16 19:23:16.022244
It was 95% GME and 5% AMC before but yeah I LIKE THE STOCK,2021-03-16 19:23:17.130952
 🔥🔥🔥🦍🦍📈📈 PLANET OF THE APES,2021-03-16 19:23:17.805957
"PAPA ALEX KARP: "" BUY SOMETHING ELSE  ILL SEE YOU IN TWO YEARS "" 🙌🙌🙌🙌🙌🙌🙌 Refreshing to hear a CEO as honest as Elon  ",2021-03-16 19:23:18.902288
bought 7 more shares  I LIKE THE STOCK,2021-03-16 19:23:20.020249
Yeah I’m just feeling like I’m always a step behind and i know in that if i have to use my mouse at all in a year I’ll behind the kids who went to better colleges and actually learned how to use it,2021-03-16 19:23:21.126710
Good connection to a major financial institution and a lot of liquid capital    [https://www wallstreetoasis com/forums/can-individuals-trade-bonds-cds]https://www wallstreetoasis com/forums/can-individuals-trade-bonds-cds,2021-03-16 19:23:21.126813
Trying so hard to keep it below 210 when they tried to dip it sub 177,2021-03-16 19:23:21.126870
"Daddy Karp: ""I like that we gave retail investors opportunities to make money rather than just the HFs"" and ""We're in it for the long haul and if you don't like it you don't have to buy the stock no one is forcing you to"" double dipping my dick into PLTR as we speak",2021-03-16 19:23:21.126921
A cat told me what to do  GME has 9 lives  200$ x 9 = 1 8K,2021-03-16 19:23:21.986300
If you sold then essentially this guy just stole your girlfriend,2021-03-16 19:23:21.986396
Seriously lol,2021-03-16 19:23:23.115374
SPY NDAQ DOW,2021-03-16 19:23:25.281091
Proud to represent Canada 🇨🇦,2021-03-16 19:23:25.281188
**Back to 220 lets gooo**,2021-03-16 19:23:26.397812
Yes ,2021-03-16 19:23:26.397948
What  No  Its talking about coming across childporn watching porn online,2021-03-16 19:23:27.048170
Bad day to report earnings,2021-03-16 19:23:27.048293
Damn I’m even for the day I feel like I should get out though  Too much kangarooing ,2021-03-16 19:23:27.048375
lol covid boredom be hitting like a truck,2021-03-16 19:23:28.169983
Oh shit I think I made a typo of course I meant HOLD,2021-03-16 19:23:28.796908
I guess being added to sp500 is not good news for penn,2021-03-16 19:23:29.937311
Karp looking like a mad scientist,2021-03-16 19:23:29.937429
This is basically yesterday,2021-03-16 19:23:31.067784
If it means my tech and QQQ calls will print my VIX calls can go to the shredder!,2021-03-16 19:23:31.068095
Yes  SSR was triggered for today/tomorrow   ^It doesn't make much of a difference though,2021-03-16 19:23:31.068190
Vibe check,2021-03-16 19:23:31.068346
Bigger risk bigger reward,2021-03-16 19:23:32.197820
Nokia,2021-03-16 19:23:32.197939
It will be so hilarious when we close above open price,2021-03-16 19:23:32.803576
You lucky son of a gun,2021-03-16 19:23:32.803694
I’m gonna assume everything is gonna tank early then go up when jpow speaks ? Literally Everytime the majority thought is down the market goes right back up,2021-03-16 19:23:33.931084
How dumb would it be to yolo the rest of my portfolio into SPY 397c FDs,2021-03-16 19:23:33.931213
I’m still holding 44 shares of PLTR  I think I’ll keep them along with GME  Fuck AMC though ,2021-03-16 19:23:33.931308
You didn’t miss a lot with discovery though season 2 was pretty fun and I’m really looking forward to SNW with Anson Mount  Saru is a very decent character as are Tilly and Stamets but the rest of the crew is kinda forgettable ,2021-03-16 19:23:33.931389
[https://www youtube com/watch?v=Rce8QnuFRVk]https://www youtube com/watch?v=Rce8QnuFRVk,2021-03-16 19:23:35.061267
You guys are not buying the bottom  You are burning a good amount of money here ,2021-03-16 19:23:35.061394
🤘,2021-03-16 19:23:36.194194
Euro-tards need to come through today in AH   We climbed out of $175 this morning  It's your turn to get us to $250 AH ,2021-03-16 19:23:36.810911
You said source  I didn't know what you wanted sourced  Now that you're being more specific and engaging in a discussion to answer that question Twitter ,2021-03-16 19:23:37.932463
Can someone push jpow up to 8AM?,2021-03-16 19:23:37.932591
Your entire post is spam,2021-03-16 19:23:37.932711
It's a meme dude; Why are you taking anyone seriously here anyway?,2021-03-16 19:23:37.932788
We want to let you know that your You Invest Trade account is getting a new name: J P  Morgan Self-Directed Investing  There is no change to your account's features and benefits      they're still going to suck ,2021-03-16 19:23:39.036490
Proof or ban,2021-03-16 19:23:39.036726
I see you’re bullish but your comment might get downvoted lol,2021-03-16 19:23:39.036854
Limit orders any quantity,2021-03-16 19:23:40.197073
I’ll make you buy garbage to teach you and everyone else a lesson,2021-03-16 19:23:40.197193
Jfgi what SSR is  It's actually easier to type it into Google than it is here ,2021-03-16 19:23:40.197274
This AH/PM is bs and needs to stop  They keep manipulating market and sentiments as they desire!,2021-03-16 19:23:40.825373
I think it's a good oportunity  I myself bought in a few days ago at 44 82  Hope it doesn't go to shit ,2021-03-16 19:23:40.825515
CEO of PLTR likes wsb and retail investors ,2021-03-16 19:23:41.969558
Bullish?,2021-03-16 19:23:41.969676
I have never wanted to take a loan out against my home to invest in GME      That is until I saw this comment ,2021-03-16 19:23:41.969755
Yesssss,2021-03-16 19:23:43.105578
Alexa play dick in a box,2021-03-16 19:23:43.105691
Karp pump karp pump long term baybeeeee,2021-03-16 19:23:43.740095
Lol would still be in profit how bout u burn pltr for the pos it is lol,2021-03-16 19:23:43.740214
Keeping in mind that they borrowed $600M yesterday I'm looking forward to the fireworks ahead  Whenever that might be ,2021-03-16 19:23:44.856125
So unrealistic   tiger isn’t beating his meat and watching the line go up and down all day,2021-03-16 19:23:44.856252
Hedgies are shitting themselves right now they spent millions trying to deflate the price but it keeps wanting to climb back up,2021-03-16 19:23:44.856335
Not only everything mentioned here but with reporting being very very slow and irregular some of these super large institutions holdings might not like up because they sell faster than they report    The real really sketchy part is the failed to deliver shares,2021-03-16 19:23:46.173174
Female POV Blowjob is more like it   I mean that's pretty weird right?? No one would want to jerk off to that haha sounds pretty gay   sure hope SPY doesn't reach 397 again lol   ,2021-03-16 19:23:46.173306
Difference is RKT was trading at 20$ the dividend was 1$  GME is trading at 200$ right now 0 05$ or even 1$ is nothing in comparison  Plus let's not forget GME isn't in the best of situations to be wasting money on dividends simply to spite Wall Street,2021-03-16 19:23:46.173394
Seems counterproductive ![gif]emote|free_emotes_pack|joy,2021-03-16 19:23:47.296152
You wont need a house on the moon  We gonna be living in space pods!,2021-03-16 19:23:47.296392
Get in line!,2021-03-16 19:23:47.887931
Yes or no?,2021-03-16 19:23:49.003810
Let me start from the beginning when I was a boy in Bulgaria     *I am a bot and this action was performed automatically  Please [contact the moderators of this subreddit]/message/compose/?to=/r/wallstreetbets if you have any questions or concerns *,2021-03-16 19:23:49.003937
I heard the opposite that earnings are actually pretty damn high,2021-03-16 19:23:49.004031
Sir this is WSB that talk belongs in r/investing,2021-03-16 19:23:50.118650
Far too many zeros wrong with that,2021-03-16 19:23:50.118769
apes riding bulls  we thoroughly kick bear cavalry ass,2021-03-16 19:23:50.726058
That's gonna be one spicy meatball    😳,2021-03-16 19:23:53.173913
How many days must a man hold his stock   Before he has diamond hands?   How many GMEs must a Robinhood sell   Before she sleeps in the sand?   Yes and how many times must the downvote shills fly   Before they're forever banned?   The answer my friend is holding 'till the end   The answer is holding 'till the end  -Bob Diamond Hands Dylan  💎💎💎💎💎💎💎💎💎💎💎💎💎💎💎💎,2021-03-16 19:23:54.262617
Oh yeah     ,2021-03-16 19:23:54.262778
I agree lol  I have 18 shares and def want it to 🚀 but some people here are insane ,2021-03-16 19:23:56.512067
Lets go power hour buy if you can if you cant well hold the fucking line,2021-03-16 19:23:56.512202
STIMMYSS,2021-03-16 19:23:56.514458
Glad to see this comment high up   Hopefully it's the top comment    Amid all the frenzy of screaming and hollering and frat boy meme culture glad to see real people just wishing each other well ,2021-03-16 19:23:56.514610
https://www youtube com/watch?v=hkDt-aPeEis,2021-03-16 19:23:57.593121
I say when I sell!!,2021-03-16 19:23:57.593237
My ticket to ride that is # 42069,2021-03-16 19:23:58.191311
40K! I AM IN!!!!!!,2021-03-16 19:23:58.798449
old news priced in,2021-03-16 19:23:59.914003
shortsellers so dumb they think cup and handle refers to how they cup the bag while handling the shaft    down 10 points sissies  10 lousy points ,2021-03-16 19:23:59.914123
$15,2021-03-16 19:23:59.914204
yes although it doesnt really help much apparently,2021-03-16 19:23:59.914276
We like the stores ,2021-03-16 19:24:02.452215
Don't let it slip below 200 you degenerates!!!,2021-03-16 19:24:03.029142
All i can say is  I Like The Stock 🚀🚀,2021-03-16 19:24:04.153630
He’s self proclaimed neurotic,2021-03-16 19:24:06.198874
🚀🚀🚀,2021-03-16 19:24:06.199003
Spy green again argo gme should recover somebody doubt my logic,2021-03-16 19:24:06.199083
Same good luck!,2021-03-16 19:24:06.199160
GME is uncovering the true side of the stock market the OPPOSITE   It really is a game of opposites    whatever the news tells you or heavily suggests what to do do the exact **opposite** ,2021-03-16 19:24:07.652539
You have a point,2021-03-16 19:24:07.653169
RC is allowed to speak after that,2021-03-16 19:24:10.047951
Embarrassing part here i was a Comp Sci TA and spent a year within the major  Its not that its hard its just figuring out the program and what can all be done with it ,2021-03-16 19:24:10.048049
We’re gonna need a junk cam,2021-03-16 19:24:10.048107
Jim Cramer is the guy that leaves 1 second on the microwave timer at work and doesn't clear it ,2021-03-16 19:24:10.048155
As soon as I get home from picking my wife up I'm stripping and I'm doing the dick helicopter for an hour straight if we close above 200,2021-03-16 19:24:10.638697
I think it needs to gain  50 by the end of the week ,2021-03-16 19:24:10.638797
What time zone?  Might be hawaii ,2021-03-16 19:24:10.638852
AMC and GME to the orbit of saturns Uranus  🖐🍿🖐💎🚀🚀🚀🌚🍗🦍☘️💎💵,2021-03-16 19:24:11.285636
My sign is vital   My hands are cold,2021-03-16 19:24:11.285735
bruh no one can do math in here we don't know what this means ,2021-03-16 19:24:11.285799
EToro monumental dildo is making me a bit of money  Too bad my calls are totally screwed and I’m in the red lol,2021-03-16 19:24:11.933790
It hasn’t really anytime recently but the 1/1/22 premiums are super cheap and the IV isn’t bad if it moves up even a dollar you can stand to gain quite a bit imo,2021-03-16 19:24:11.933890
I’m literally considering selling my car and photos of my gfs baps just to get more money to buy this dip ,2021-03-16 19:24:13.074681
Is k bro lot of us bought higher,2021-03-16 19:24:13.074775
"Notice how PLTR's YouTube channel turns off comments    It's 100% because of the retards that spam ""PLTR!! 🚀🚀"" and ""I just bought in cuz of Karp's hair!""",2021-03-16 19:24:13.074831
All these Jim Cramer comments have no business being this funny,2021-03-16 19:24:13.074884
I'm running out of creative juices on these GME songs lyrics,2021-03-16 19:24:14.198163
It is     acceptable,2021-03-16 19:24:14.198255
I’m not buying these dips  This is a preview for tomorrow  Cash gang for now,2021-03-16 19:24:14.198308
Lmao :D,2021-03-16 19:24:14.810947
Imagine this quarter compared to the last and expected growth,2021-03-16 19:24:14.811113
Look   If you save   One cat   In the WSB community   And gave him everything he ever wanted   Would you nurture him?   And just buy the dip?    Yo   His paws are sweaty   tail’s weak fur is heavy   Pukes varmint on your sweater already   Ratatouille   He’s nervous   So on the surface he looks like a yeti   He drops bombs   And he keeps on bed-wetting   But he’s woke now   This lil guy wants to prowl   He opens his mouth   But he can’t say “Meow”   He’s chokin’ how?   Somethin in his throat comes out   This cat runs out winds up yells: BUY NOW!!,2021-03-16 19:24:15.955718
