Fuck off scammer  Retard ,2021-03-16 02:05:31.524017
I’m just curious  Every MBS etf I checked the price has dropped   a lot with the past two months,2021-03-16 02:05:31.524147
post malone prolly aint droppin shit,2021-03-16 02:05:33.285642
I like the idea! The problem is if they actually joined forces with us it's like fraternizing with your enemy  Plus all those big hedgies are purely profit driven shareholders would be pissed if even $1M was taken to finance a gorilla conservation fund  One can hope though 🦍,2021-03-16 02:05:33.285748
The zoo thing is nice but you guys buying Reddit awards gotta redirect that cash into gme think of the awards after you win bigly,2021-03-16 02:05:33.868047
"75% of calls end up worthless you say?  That's interesting   Perhaps GME is a bad example because of it's crazy ups and downs I wonder how much that % is skewed because people think ""I'm going to buy a crazy long shot 4/12 800c or how often that type of long shot buy happens on other stocks",2021-03-16 02:05:33.868175
Yikes ,2021-03-16 02:05:33.868265
I have been  Started with 300 shares at $57  Got 200 more to get down to $53  Once I sell some positions I’ll try to get down to $50,2021-03-16 02:05:35.857905
That’s Mr  Stearns  And his buddy Mr  Sachs   We call his friend the Saxman but ironically ,2021-03-16 02:05:40.333122
Can you explain what you mean by “gap fills”? Is that a particular chart pattern that precedes a drop?  Thanks,2021-03-16 02:05:40.333268
I made a fool of myself,2021-03-16 02:05:40.333349
Thanks for spelling it out Chad I had never seen that large a number,2021-03-16 02:05:42.007598
COVID IS A HOAX DONT BELIVE THE LIBERAL CRISIS ACTORS  NOBODY HAS DIED FROM IT REMEMBER BENGHAZI!  TRUMP 2020 LOCK HER UP,2021-03-16 02:05:43.543198
SHUT THE FUCK UP YOUR BITCH ASS STATE COUDLNT EVEN HANDLE 2 INCHES OF SNOW YOU PIECE OF SHIT,2021-03-16 02:05:43.543325
Also if all shares were verified a bunch of apes are going to realize it is THEIR shares that are being borrowed and sold short- gotta read the fine print with your broker ,2021-03-16 02:05:43.628805
Yea $GME seems like it’s dying- try that,2021-03-16 02:05:45.643799
That's the money made by WSB retards in like what half an hour in a normal day? 600'000'000$ is not enough  Please borrow us more tendies ,2021-03-16 02:05:47.806723
Were gonna fucking win 💪💪 fuck all or nothibg,2021-03-16 02:05:50.051220
Squeeze my tits,2021-03-16 02:05:50.051318
I am not mad just disappointed,2021-03-16 02:05:50.626946
HE LIKES THE STOCK,2021-03-16 02:05:51.234172
This little bitch deleted his account to avoid potentially being held accountable for his bet 😂  u/hewitt2,2021-03-16 02:05:53.230065
I’m waiting til Wednesday for my stimmy to hit then bam,2021-03-16 02:05:54.388316
I’m commenting about your comment in case you comment about the answers in a bit ,2021-03-16 02:05:54.388410
Pour one out for Joe,2021-03-16 02:05:54.388497
I'm holding the AMC line,2021-03-16 02:05:59.105606
It really is so glad I bought calls when it was down,2021-03-16 02:05:59.105736
Wait until earnings next week   then this is what we should do ,2021-03-16 02:06:00.643817
"Same  While tons of the ""old"" members were complaining about how GME ""ruined"" the sub and laughing at the drop I bought in more at 70-60  Hell wasn't embracing loss supposed to be the traditional memes of this sub?  And even before the second spike GME was fluctuating a lot even in the sub 100 range which meant you actually could pull really good profits that would rival many other popular picks of this year  I plan to do it again ",2021-03-16 02:06:02.238050
What the fuck lmao,2021-03-16 02:06:02.238198
Just finished nothing we didn’t know already but funny to see outsider perspective on it though,2021-03-16 02:06:04.301690
That's my plan   I need to read the fine print though  i've never had a RH account so I'll probably qualify ,2021-03-16 02:06:04.927122
Let the apes believe the financial world revolves around GME,2021-03-16 02:06:05.514991
ber r fuk   guess it's a day ending in y ,2021-03-16 02:06:06.172815
There are some unlikely ways that they COULD justify that price  For example game streaming service ala xbox game pass  Or if they use this cash to acquire/expand overseas   As it is now    Idk man,2021-03-16 02:06:08.257031
I am a bot from /r/wallstreetbets                                 You submitted one or more banned tickers: SSR                                   Message /u/zjz if they're above 1 25 billion-ish market cap and not related to crypto/pennies/OTC/SPACs ,2021-03-16 02:06:08.257170
No  This would mean spending less on gne,2021-03-16 02:06:09.359556
Bet they're like straight up doing rain dances and shit right now,2021-03-16 02:06:11.327034
No but I requested to have the covid test administered that way,2021-03-16 02:06:11.327161
dude leave out your price entry points  hedgies are scrubbing these posts   Im glad for you and all but i think until MOASS  shouldn't really tell them when you entered the ring    Let them fucking guess   Im guessing they are using this data to rape us   they dont show us their short positions so why the F should we show them our long positions? eh?  that being said- rock on dude ,2021-03-16 02:06:13.857695
🇨🇦🦍,2021-03-16 02:06:14.433218
It’s still outperformed the SP500 since it’s IPO  Was over 300$ prior to the regulation talks  Fair value of the stock is roughly 350$  Only reason it’s not and PDD and JD went so high since covid was due to the regulation threats  Earnings were amazing and when this blows over its going back to over 300$ as investors try to find fair value in a sea of overvalued tech stocks  This is my opinion  There is a risk of Chinese government breaking BaBa which is why the stock is trading so far below it’s fair value ,2021-03-16 02:06:16.473842
Yeah but 2/3 of us middle schoolers don’t play COD and roblox is so much cheaper to develop,2021-03-16 02:06:16.473992
Dang it! Wsb sentiment is bullish  You know what it means   ,2021-03-16 02:06:16.474078
Ironically this is a lesson video games taught me  Specifically Majesty: The Fantasy Kingdom Sim  While acting as a monarch I collected taxes and took a cut from all sales in the kingdom  So the way I saw it any money I gave the heroes or spent on the town would always come back to me  Therefor it was best to have as much of it as possible in the hands of the people making me more money and spending it  All their money is my money eventually so they needed as much as possible  It kept everything working as best as possible everybody had all the best armor and weapons and healing potions they could afford they looted the best dungeons and eventually all that gold wound up in my pocket   I got really high today and forgot what I was talking about but I'm now apparently installing Majesty so that's what I'm doing tonight ,2021-03-16 02:06:18.728156
calling bears gay is an insult to the gays,2021-03-16 02:06:18.728441
This could be spot on ,2021-03-16 02:06:19.328679
Only few people know about cuh,2021-03-16 02:06:19.937028
Nokia wont go up even if they get a contract from the avengers or thanos,2021-03-16 02:06:21.040735
Quick follow-up then can you submit that kind of multi-pronged approach as a single transaction through your broker or do you have to go through the whole buy/sell process all four times? Feels tedious and extra risky to have to go through all four separately on a wildly-swinging stock but if that's how it's done then that's how it's done ,2021-03-16 02:06:22.139730
Told ya yesterday,2021-03-16 02:06:22.139864
I honestly don't know what started it but it's dumb af,2021-03-16 02:06:22.738643
Lmfao what?? You read through this guy's entire post history and determined he's an advanced AI gold / silver collector?   Do you tie your own shoes or do you have prescription velcro kicks?,2021-03-16 02:06:22.738890
You can't time the market  As long as he holds he'll be fine ,2021-03-16 02:06:27.761229
I bought the dip  Fuck you and good luck ,2021-03-16 02:06:27.761366
I think the real problem is they're using too much avocado toast 🥑🍞,2021-03-16 02:06:27.761447
Sell my AMC calls at a premium and buy GMC calls at a hella discount ,2021-03-16 02:06:27.761543
Research and then come here for confirmation bias and to brag,2021-03-16 02:06:27.865990
No you ,2021-03-16 02:06:27.866116
Are they on an American exchange at all or just German?,2021-03-16 02:06:28.474185
I know but it’s the way things go on it up extreme down extreme  I’m going bonkers ,2021-03-16 02:06:29.074630
Is this a plan for roller coaster tycoon       I think incline number 2 is too steep   Better have bathrooms by the ride exit ,2021-03-16 02:06:31.052481
Ah ok thank you!,2021-03-16 02:06:31.052752
Making hedgies lose billions and saving an endangered species while making memes and having tendies  Who would have thought about this achievement? You guys rock!,2021-03-16 02:06:31.052840
This is the way,2021-03-16 02:06:33.544907
Could be due to speculation that fed will reduce MBS purchases ,2021-03-16 02:06:34.141879
FUBU you ape  For Us By Us ,2021-03-16 02:06:36.139088
Sooooon may the Teslaman come to take us on his rocket into the Sun  And when the trading was done we took our tendies “to goooooo” ,2021-03-16 02:06:36.139215
Why did it have a massive dip?,2021-03-16 02:06:37.265565
AMC Stock is currently valued generally as high as it has been since 2017 ,2021-03-16 02:06:37.265676
What are you even quoting lol  The idea that it’s a good thing we didn’t break 300 sounds retarded to me,2021-03-16 02:06:37.265735
I agree! It’s what they told me it would be   I think everyone is used to the BS they see on CNBC and FOX News so they assumed this would be more of that   They were thrown off by the title and didn’t realize it was a reference to Robinhood stopping trading of GME   Hopefully some stubborn people changed their tune after watching it!    And I’m pretty sure there will be a part 2!,2021-03-16 02:06:37.265797
finviz and a buttload of screeners  love me some finviz,2021-03-16 02:06:37.849580
What happened?,2021-03-16 02:06:38.982126
I think it hasn't been canceled because it sorta makes fun of cops  IDK though I fuckin love this it is so funny ,2021-03-16 02:06:38.982219
I like this DD,2021-03-16 02:06:38.982272
9 million /wallstreetbet users are getting $1200 stimulus checks this week  That’s $10 8 Billion  What if 10% put their money into GME or AMC what were all talking about  That’s what I call tendies baby ,2021-03-16 02:06:40.087710
Man cramers hand movements give me anxiety,2021-03-16 02:06:40.087816
Experience ,2021-03-16 02:06:42.161612
Sell,2021-03-16 02:06:43.248364
Fk you guys are smart,2021-03-16 02:06:43.248500
real estate fukt,2021-03-16 02:06:45.277528
Don’t they have some sort of lay-man brother?,2021-03-16 02:06:45.277672
I don't know what sell means,2021-03-16 02:06:46.382358
Cod mobile wants a word with you,2021-03-16 02:06:46.977866
American,2021-03-16 02:06:48.080183
Whoa we have the same amount of shares bro,2021-03-16 02:06:50.162206
I sense a sudden surge  I'm buying one   It's like throwing shit at the wall   If it sticks I profit   This is not financial advice  I am a pomeranian ,2021-03-16 02:06:51.255614
Hey shit for brains — how do you wipe your ass when you aren’t even as intelligent as the toilet paper? 🤔,2021-03-16 02:06:51.255742
Eyyyyy,2021-03-16 02:06:51.255823
Its a 4d 24/7 live movie,2021-03-16 02:06:55.511027
FOMO hard into the very top of an already overbought stock snd then sell it IMMEDIATELY when it tanks 10% ,2021-03-16 02:06:55.511156
I am a bot  I saw the thing you posted already here http://reddit com/l4tayj  Please read the rules                             Bother /u/zjz if this is an error this check can be somewhat coarse ,2021-03-16 02:06:55.511252
This again? I could've sworn I've seen this post before somewhere not too long ago ,2021-03-16 02:06:55.511335
#AMC army,2021-03-16 02:06:55.511467
They're borrowing money right now  Not exactly swimming in disposable income,2021-03-16 02:06:57.044956
No! No! You can't triple stamp a double stamp! You can't triple stamp a double stamp Lloyd! You can't triple stamp a double stamp! LLOYD! LLOYD!,2021-03-16 02:06:57.045250
powerful diamond hand grip  respect,2021-03-16 02:07:01.567731
Yeah leaps if anything on nok   This ticker moves at a snail's pace ,2021-03-16 02:07:01.567856
877 CASH-NOW,2021-03-16 02:07:01.686544
THIS IS THE WAY,2021-03-16 02:07:03.316635
I am a bot  I saw the thing you posted already here http://reddit com/m5ya4h  Please read the rules                             Bother /u/zjz if this is an error this check can be somewhat coarse ,2021-03-16 02:07:03.316763
This is glorious ,2021-03-16 02:07:03.316850
Bitch    we going to the Moon!!!,2021-03-16 02:07:03.316925
The only thing getting squeezed is my dick,2021-03-16 02:07:05.299157
You are a kind & noble man,2021-03-16 02:07:07.374160
Watched the Hulu GameStop doc   That pitkid is a cuck paperhander 🙄,2021-03-16 02:07:09.426610
Yes and no? The link at S&P Global in the top post says Citadel placed 600 million **dollars worth** of notes while your Business Insider page says there are 600 million **notes** at ~$100 each which would be a total of $60 B   I'm inclined to believe S&P over BI on this  Also Citadel apparently has $35B AUM and I doubt even they would be able to raise double that in this single offering ,2021-03-16 02:07:10.022625
The same thing it’s meant for the last ten years,2021-03-16 02:07:12.060255
Sold my 14 AMC to buy  8 GME @ 227 not the best time and I only have 2 141 @ 222 average after a series of bad calls  but I’m putting all the 🍌 into my 🚀 to join you travelling the galaxies    HOLD 👋TOGETHER 🌎STRONG 🦍,2021-03-16 02:07:12.650314
Me playing modern warfare,2021-03-16 02:07:17.177829
Sheeeesh 🦍🚀,2021-03-16 02:07:17.178063
Kahn,2021-03-16 02:07:18.672255
The reply is on the rise,2021-03-16 02:07:18.672351
balls people with balls get rewarded,2021-03-16 02:07:18.672403
Just delete the app and move to South America,2021-03-16 02:07:18.770683
Say it with me  We 👏 like 👏 the 👏 stock 👏,2021-03-16 02:07:18.770809
I audibly laughed at this ,2021-03-16 02:07:20.847873
I am a bot from /r/wallstreetbets  You submitted an image I've already seen before                     If you submitted something and then immediatley deleted it    don't do that next time                     Ask mods for an approval  If you edit it just to repost it you will probably be banned ,2021-03-16 02:07:21.479073
Didn’t ask for advice ,2021-03-16 02:07:22.073089
This!!!!,2021-03-16 02:07:22.669822
he's worse than ben carson,2021-03-16 02:07:23.776059
There’s two of them actually  Twinsies ,2021-03-16 02:07:23.776152
Well if there was ever a time to buy NOK it’s now that they’ve made huge deals with Amazon and Google to head the introduction of 5G into their tech    What do you know sometimes we call meme stonks out because they’re great    Actually that’s always why we call them out  But that’s alright - let the hedgies doubt  Only hurts them   NOK TO THE MOON!!!,2021-03-16 02:07:24.923434
Red at night Joe Rogan's delight,2021-03-16 02:07:24.923612
Sounds like they may need some capital on hand,2021-03-16 02:07:34.467207
God that fucking race man I remember screaming at the screen multiple times my first play through  Almost broke the controller a couple times ,2021-03-16 02:07:34.467317
Going to watch my AFMJF continue to rise    Tin for the win  Spot price is nearing all time high ,2021-03-16 02:07:34.467378
When I am Not Cashhing out Am looking at Monke You gatta do wacha gatta do  🐒  🐒  🐒,2021-03-16 02:07:34.467433
I like the cause,2021-03-16 02:07:34.577605
To be fair WW84 was an awful movie      even the big screen probably couldnt have saved that hot mess ,2021-03-16 02:07:36.073697
I’m generally pretty frugal in life which means Im okay at spotting bargains in the market and then not spend my winnings on anything cool like lambos,2021-03-16 02:07:40.241923
Yep  It's trading at like 97% of it's 52 week high  Not exactly a value ,2021-03-16 02:07:41.707723
Jim Cramer always starts with at least $50K when he plays Monopoly with his kids   ,2021-03-16 02:07:45.697554
"""How can we have insider knowledge when we have no knowledge?""   *I am a bot and this action was performed automatically  Please [contact the moderators of this subreddit]/message/compose/?to=/r/wallstreetbets if you have any questions or concerns *",2021-03-16 02:07:45.697755
These threads are getting really really tedious ,2021-03-16 02:07:45.697853
boomers with PTSD from the dotcom bubble crash have missed out on so many tech tendies,2021-03-16 02:07:45.697906
Make sure you ruin all the classic scenes and punch lines there’s a good lad  Some mother’s do ave em   ,2021-03-16 02:07:47.209035
I’ve had those before  That’s why I have a trailing stop set  But don’t you think it’s worth trying rather than making nothing great after year on an irregular market?,2021-03-16 02:07:47.320738
India literally ruined the party with the internet money,2021-03-16 02:07:48.883188
Jim Cramers never touched a girls vajayjay 🤡,2021-03-16 02:07:48.883308
It’s really fucking easy,2021-03-16 02:07:48.883387
Big money's plan:  1  Gamble a shitload of money in the hopes of getting more money   2  Go bankrupt   3  Kiss the government's ass for a bailout  4  See step 1 ,2021-03-16 02:07:52.603913
My guy that's good,2021-03-16 02:07:52.604036
From what I understand they're trying to have DFV appear as a guest on his podcast so until he invites DFV they're doing this to push the matter ,2021-03-16 02:07:52.604116
Covered calls are different  You could sell a call for this Friday covered since you own 100 shares at 12 5 for $37  You keep the $37 and as long as BB stays under 12 5 you get to keep your shares too  If you are worried about a price rise you can sell $13 call for $27  Again you keep the $27 and as long as BB stays under $13 you keep your shares  Even if it hits the call amount you still get money since they buy those shares from you ,2021-03-16 02:07:52.604197
This is the way ,2021-03-16 02:07:54.074392
It's definitely a crappy half measure   If it was meant to keep people afloat then someone earning 30k should get more than someone making 60k but they get the same   If it was meant to actual help local economies through spending then people earning more who would actually spend it like a bonus locally should have received something too   Now it does neither ,2021-03-16 02:07:55.675246
Y’all wanna see something interesting?  Look at The Coin’s all time chart  Now look at the Nasdaq all time chart  Illuminati confirmed ,2021-03-16 02:07:55.675387
Damn me too   ,2021-03-16 02:07:55.675498
Gme to the basement today  Lil worried theres still a sub-basement we are about to be introduced to ,2021-03-16 02:07:57.238154
This is the way ,2021-03-16 02:07:57.238665
This is fire af,2021-03-16 02:08:01.030599
Looks well diversified - multiple strikes and expiration dates!,2021-03-16 02:08:01.030692
What makes you think NOK is going anywhere? I'm not disagreeing I have 21May $4 5C's so I want it to take off  Just seems so   anemic?,2021-03-16 02:08:01.150494
Yall ready to see $SPY hit $270? I hear that trade talks are doing well dot e x e ,2021-03-16 02:08:05.093625
CRSR 35c,2021-03-16 02:08:05.093749
To prevent spam we have disabled YouTube videos from being posted  You can reach out to the mods for an exemption but you will be banned if it's considered low effort   *I am a bot and this action was performed automatically  Please [contact the moderators of this subreddit]/message/compose/?to=/r/wallstreetbets if you have any questions or concerns *,2021-03-16 02:08:05.093832
Oh my fucking God   ,2021-03-16 02:08:05.094178
I AM STUPID APE! I DON'T UNDERSTAND WHAT THIS MEANS! I JUST LIKE THE AND I KEEP HILDING IT!,2021-03-16 02:08:05.094294
No tendies necessary https://www diamondhearts org ♦️♥️,2021-03-16 02:08:05.187172
Cramer has no shame  He belongs on fox newz,2021-03-16 02:08:05.269327
Getting older and going through life I've learned that there aren't a lot of things that I believe in literally and figuratively   Such as: faith in humanity ghosts the moon landing and that my dad is coming back   But after joining this community I have regained faith in some things   I believe in you guys stupid apes and that the first REAL moon landing is coming GME   LET'S FREAKING GO!,2021-03-16 02:08:06.839289
Wipe my ass? Get out of here with that homo shit  Aint no one touching my ass not even me ,2021-03-16 02:08:08.522978
I even worked in two states last year and it wasn’t that big of a deal ,2021-03-16 02:08:08.523125
VFF,2021-03-16 02:08:08.629962
VNQ TLT and ITB  VNQ are calls TLT and ITB are puts ,2021-03-16 02:08:09.222612
#Are you Horny?,2021-03-16 02:08:09.222917
60 I reckon  Your ape math bad,2021-03-16 02:08:11.442024
In the photo we see DFV talking directly to WSB,2021-03-16 02:08:12.533026
You could put forward candidates for the board for the shareholders to vote on at the next annual meeting    I imagine I would be just as qualified as any of the gme board members not Cohen though since the majority of corporate board members literally don't do anything but approve M&A replace retiring or terrible CEOs and approve executive pay packages   If enough people signalled intent to vote for new board members and remove some of the existing ones then perhaps they would feel enough heat to act   I think it would be absurd to suggest individual investors can't coordinate nominating board members but institutions and billionaires can takeover boards  Instutions like Morgan Stanley are literally a collection of thousands of individual 'investors' through their 401ks and funds that use a proxy advisor to coordinate strategy and gain economies of scale/specialization    Replacing a board or crony CEO via collective action of individual shareholders doesn't seem like market manipulation to me  But I'm not a lawyer ,2021-03-16 02:08:12.533165
IF YOU'RE GOING TO FILIBUSTER YOU SHOULD RUN FOR SENATE!   *I am a bot and this action was performed automatically  Please [contact the moderators of this subreddit]/message/compose/?to=/r/wallstreetbets if you have any questions or concerns *,2021-03-16 02:08:12.533297
Just bought a TempurPedic split California king with the adjustable base   Can attest it is comfortable as shit but expensive   Never thought I'd drop almost $10k on a bed   If they could figure out how to make it without the smell it would be worth even more   That foam is pungent but they say it goes away after a couple weeks ,2021-03-16 02:08:13.155714
GME,2021-03-16 02:08:13.767136
if you’re long on GME why not wait until it’s finished crashing to YOLO your stimmy? RIP those who used their’s this morning @280,2021-03-16 02:08:13.767260
made a nice profit on XOM but if that actually happens hell ,2021-03-16 02:08:13.767347
Big green dildos here we come!,2021-03-16 02:08:14.991725
WSB did more for gorilla in a weekend than hedge funds did in a century,2021-03-16 02:08:14.991853
NGL we’re pretty fond of red too   That’s why we can’t lose ,2021-03-16 02:08:17.536543
100% this is going to rip into April,2021-03-16 02:08:17.536658
Somebody surmise the Gamestopped doc  Are we the baddies?,2021-03-16 02:08:18.129079
The article I read was written on the 3rd  Prior to that short attack,2021-03-16 02:08:20.299323
😂😂😂😂,2021-03-16 02:08:20.299420
ouch   that must hurt  Don't let those diamond hands become retarded hands ,2021-03-16 02:08:21.451556
I will never be like them ,2021-03-16 02:08:21.451653
GME AND RKT ARE ON TDA RESTRICTED LIST 🚀🚀🚀  RKT STATS:  104 million share float  121 million shares owned by institutions  5 8 million shrs owned by insiders  BILLION $$$ Buy Back  Guided Q1 UUUPPPP 90%-99% YoY  RKT 🚀🚀🚀 RKT 🚀🚀🚀 RKT 🚀🚀🚀,2021-03-16 02:08:23.424788
You guys are actually retarded  Literally every company is issuing bonds since it’s cheap af funding  Apple had a shit ton of cash lying around and still took on billions  ,2021-03-16 02:08:25.445160
No my friend all at once  Here is an example of an iron butterfly and how to set it up on both robinhood and webull   https://moongangcapital com/2021/02/13/the-atm-earnings-iron-butterfly-4-option-strategy/,2021-03-16 02:08:25.445357
Your not looking at the full picture though  It depends when he sold the calls and bought the shares  If I own 100 shares of a stock trading at $20 00 and sell a $10 the call price should be the intrinsic value $20-$10 plus the premium  If the stock trades sideways until expiration My shares get called away and I’m just left with the premium I earned  If it goes down below $10 the option expires worthless but the value of my shares are also cut in half but since I collected that intrinsic value at the option sale I’m basically in the same position   There’s nothing dangerous about this   it’s dumb but not risky,2021-03-16 02:08:26.012971
Me too 👌,2021-03-16 02:08:28.724030
Don't worry it's not you  That ape is smarter ,2021-03-16 02:08:30.733617
So to sum up:   GME and AMC both go down together it’s manipulation   GME goes up and AMC goes down: manipulation  GME goes down and AMC goes up: manipulation   Both GME and AMC go up: everyone in this sub are goddamn geniuses,2021-03-16 02:08:30.733750
Ur not wrong,2021-03-16 02:08:30.733813
To put a positive spin on it I'd say your fucked retard ,2021-03-16 02:08:31.334072
