If you tried the shit the hedges are doing at a roulette table the casino would take you out back and break your knees ,2021-03-16 19:37:41.191161
Then I will be happy with my little plastic dudes on the moon I always wanted to play Warhammer in Zero gravity,2021-03-16 19:37:41.191295
Thank you! fucking farmers make me sick,2021-03-16 19:37:41.191359
So Bill Gross intentionally shorting GME and posting his winnings  *unzips pants* https://www bloomberg com/news/articles/2021-03-16/bill-gross-says-he-made-10-million-betting-against-gamestop,2021-03-16 19:37:43.201691
Remember the hedgies KNOW tomorrow is a big stimmy drop  They are plotting    the best part is its simple for apes  Apes hodl,2021-03-16 19:37:43.201968
Steepness shitty clickbait articles senior leadership leaving bad balance sheets,2021-03-16 19:37:43.202143
Loved it even though you misidentified the sides ,2021-03-16 19:37:44.353915
Closed last night at 220,2021-03-16 19:37:44.354037
What a boring day holy shit lol,2021-03-16 19:37:44.354113
Lol dfv is now a whale ,2021-03-16 19:37:44.354185
Lmaoo,2021-03-16 19:37:44.354255
This lol 😂,2021-03-16 19:37:46.420678
This is the way,2021-03-16 19:37:46.420783
A certain meme company may be making a comeback i see  Cant talk about it on this thread yet though   ,2021-03-16 19:37:46.420837
What’s this from? I’m an idiot lol,2021-03-16 19:37:46.420890
"Also hedge funds: ""We HaVe ClOsEd OuT oUr PoSiTiOn""",2021-03-16 19:37:46.420939
Gme leeessss goooo,2021-03-16 19:37:46.420987
> can we maybe also remove or lock this post for basically hyping up this obvious trollbait?  No because that's a different subreddit   ,2021-03-16 19:37:46.421037
FUKIN F,2021-03-16 19:37:48.551889
Every bit counts!,2021-03-16 19:37:48.552332
Gotta buy up the paperhand day traders now,2021-03-16 19:37:50.619217
Do not scorn the weak kitty 🐈‍⬛  he may grow to be the brutal Tiger 🐅  ,2021-03-16 19:37:50.619317
More than the float that's all we need to know,2021-03-16 19:37:50.619372
actually true  thanks,2021-03-16 19:37:50.619422
Did anyone notice the AMC shares outstanding is at 450 million? Does anyone know why this increased? Are these including the synthetic shares?,2021-03-16 19:37:50.619528
Just filed my taxes  I get last year's 1800 stimmy plus the 1400 this go around  GME here I come,2021-03-16 19:37:51.215947
12 but they're pretty mediocre,2021-03-16 19:37:51.828315
What was the saying?  Every time a GME share is bought an ape gets his wings ,2021-03-16 19:37:52.925738
It was trading at 280 yesterday  But sure    we'll go with brrrrr,2021-03-16 19:37:52.925859
I like the stock,2021-03-16 19:37:52.925937
DRATS! That’s where I played tummysticks,2021-03-16 19:37:54.027142
We need more fuel for all the adopted apes we are bringing to Alpha Centauri and beyond!,2021-03-16 19:37:54.027261
FIFTEEN SHARES THEN A SHEEEEEEEEER DROP  PS thank you that was tremendous,2021-03-16 19:37:55.151420
Ma’am this is a Wendy’s would you like a large chocolate frosty on the house?,2021-03-16 19:37:55.151560
720c 3/19  Hold me ,2021-03-16 19:37:55.151652
like with a split? no stock is likely to do so it would trade at 6x already if it were,2021-03-16 19:37:55.151730
Could print for an hour this week,2021-03-16 19:37:55.151805
FAAMG BULLS RISE  SMALL CAP TECH BULLS IN SHAMBLES,2021-03-16 19:37:55.793572
This sub likes it too much ,2021-03-16 19:37:56.917602
No one knows  FFS stop fucking asking this ,2021-03-16 19:37:59.442730
Can anyone tell me what’s up with HMNY movie pass today???,2021-03-16 19:38:00.030981
Idiot reveals how much they don’t understand the stock market,2021-03-16 19:38:00.031079
Fr mans just having fun and some people are saying he is trying too hard  People do love to hate ,2021-03-16 19:38:01.136597
I didn’t adopt a whale for nothing come save us pepper!!!   AWWWOOWOWOWOOOOooOoOoOoo 🐳,2021-03-16 19:38:01.740974
Nope and it doesn't fucking matter 😎,2021-03-16 19:38:01.741100
My slightly ITM SPY and QQQ 5/21 calls that I got 6 days back are up more than 35% 🤷‍♂️,2021-03-16 19:38:02.873756
The only way to finish off this day is to play Back in Black on REPEAT until power hour is over  🚀🚀🚀🚀💎👐🦍,2021-03-16 19:38:05.680500
Where can I see pictures of their new Zoo?,2021-03-16 19:38:06.290536
Quick question for retard: does volume just calculate shares both bought and sold? How is it calculated,2021-03-16 19:38:08.417184
FUD  It’s still restricted?  Not all brokers right ?,2021-03-16 19:38:08.417345
Close yesterday was 220,2021-03-16 19:38:08.417446
I agree but I feel like most people will wait for a dip tomorrow and throw in then  If it had gone back to $200 yet this afternoon I would have moved  But right now I'm thinking I'll wait and make one big move tomorrow instead ,2021-03-16 19:38:08.417585
Lowkey cool ape 👋🦍,2021-03-16 19:38:08.417718
Me either or it's really slow   I can't tell if it's a technical issue or if it's piddly chit volume ,2021-03-16 19:38:08.417769
Come   on   Stronks     LIFT,2021-03-16 19:38:08.418202
From meme to art form  You rise above the medium sir,2021-03-16 19:38:09.523431
$15/hr ,2021-03-16 19:38:09.523564
Previous close,2021-03-16 19:38:10.131995
Is that a cup and handle pattern forming on the handle of another cup and handle pattern on the intraday chart 🤯🤯🤯🤯,2021-03-16 19:38:10.737613
You’ve cost me and my mahoosive holding of 20 shares approximately £100 today    How much did it cost you today hedgetards?,2021-03-16 19:38:11.847498
You know ten years ago I was in a giant beer garden at a Benigans getting wasted on Patty eve now I am in my basement office talking to fellow retards about stonks      I like this better!,2021-03-16 19:38:12.945714
GOD SPEAKS🦍💎✋🚀,2021-03-16 19:38:14.079560
Just bought 2 more cause fuck the 🐻🌈,2021-03-16 19:38:15.214211
What's Melvins exit strategy like wtf they gonna do?,2021-03-16 19:38:15.214317
TA or DD ???   I'm a DD kind a ape   DD is good short has to deliver and they can't without paying what we want for our stock!,2021-03-16 19:38:15.214381
Also it seems as tho everyone on here is super happy about GME all the time there’s nothing that can break your spirits   it seems like I’m looking into a pool of yacht owners sailing to the moon although honestly it’s like a bunch of guppies feeding of the shills off to a small amount of targeted Reddit posters who option trade out of you bag holders daily  Until of course the merry go round stops and the 🐳🐳🐳 move on to another STONKKKKK,2021-03-16 19:38:15.214479
Sure thing bud,2021-03-16 19:38:15.214587
I hope so! The pre market in green will explode,2021-03-16 19:38:15.852090
This is an options subreddit  Hence the BETS part of wallstreetbets ,2021-03-16 19:38:15.852212
Now THIS is the way,2021-03-16 19:38:15.852291
Man as the days go by it seems like the opportunities to make money in the market are slim  Everyone is always selling on any sort of pop for quick profit due to zero-commission trading ,2021-03-16 19:38:15.852378
RBLX,2021-03-16 19:38:16.999326
or if ur colorblind,2021-03-16 19:38:16.999448
Solid TA you should take your favorite purple crayon and draw us a dd,2021-03-16 19:38:16.999557
All information is relevant including dank memes ,2021-03-16 19:38:18.166610
Haven’t crossed quite yet   🤞🏼🤞🏼,2021-03-16 19:38:18.166717
I got one for you  Held onto em since this mornin ,2021-03-16 19:38:18.166772
$5 is not a meme!,2021-03-16 19:38:18.166821
High yields are very illegal and very uncool ,2021-03-16 19:38:18.776322
I panicked and bought 10 more shares today   Please keeping doing the opening short attack every day so that I can keep averaging down my cost ,2021-03-16 19:38:19.916366
Power fucking hour let’s goooooooo!!,2021-03-16 19:38:19.916513
Good job Ron Swanson ,2021-03-16 19:38:19.916599
Fuck you cunt,2021-03-16 19:38:19.916674
Don’t apply for margin  It’s a loan to buy shares,2021-03-16 19:38:19.916748
Now we just buy GME ,2021-03-16 19:38:21.050325
What's a sexfilme?,2021-03-16 19:38:21.050441
Previous day's close,2021-03-16 19:38:22.163828
It’s very simple  Hold,2021-03-16 19:38:22.163957
Funds are safu ,2021-03-16 19:38:22.769572
I think we all know the “why ” They’re going out of their way to disenfranchise us to twist our story to suit their own needs and because it ultimately helps the puppet masters that are pulling their strings  They don’t want us to be taken seriously ,2021-03-16 19:38:23.896989
HOLY MOLY i like the stock  Thanks for sharing ❤️,2021-03-16 19:38:23.897138
#HOLY MOLY!!   *I am a bot and this action was performed automatically  Please [contact the moderators of this subreddit]/message/compose/?to=/r/wallstreetbets if you have any questions or concerns *,2021-03-16 19:38:23.897226
Lol yes they are,2021-03-16 19:38:25.021568
That’s some big dick,2021-03-16 19:38:25.021689
Post your gains,2021-03-16 19:38:26.168665
What goes down must come up,2021-03-16 19:38:28.220750
Mr Kitty would you at today's current price still buy Catnip?,2021-03-16 19:38:28.220853
FOMO’d back in for 27 shares @205 🚀🚀🦍🚀🚀,2021-03-16 19:38:28.220925
To prevent spam we have disabled YouTube videos from being posted  You can reach out to the mods for an exemption but you will be banned if it's considered low effort   *I am a bot and this action was performed automatically  Please [contact the moderators of this subreddit]/message/compose/?to=/r/wallstreetbets if you have any questions or concerns *,2021-03-16 19:38:28.220981
"Just always respond with ""based? Based on what?""",2021-03-16 19:38:28.221078
Made so much off puts today  Thanks idiots ,2021-03-16 19:38:28.221126
That guy doesn't even look human  I feel sorry for him ,2021-03-16 19:38:28.221270
So they weren't lying when they said they were fools,2021-03-16 19:38:28.221353
 So you're telling me there's a chance?,2021-03-16 19:38:28.221536
I'll wait for them in the teens   Price too rich   All those great partnerships are priced in   The only way a company with that little earnings can be worth 40b,2021-03-16 19:38:29.316801
Bill Gross looks gross   He looks like a fucking demon ,2021-03-16 19:38:29.316900
If we make enough that could happen,2021-03-16 19:38:29.316951
Millions died from corona virus and won't have this chance   I buy GME to honor their memory,2021-03-16 19:38:29.317001
OH thank you,2021-03-16 19:38:29.912279
Not investing it right now is also an option ,2021-03-16 19:38:31.010479
Here’s my theory on Roblox    it’s actually a huge money laundering ring    buy gift cards with dirty cash    drug lord makes shit content “kids” pay to play it over and over and over     puts on this shit for sure,2021-03-16 19:38:32.113378
Damn his real life name checks out,2021-03-16 19:38:32.711675
I don't get jack shit  Biden lowering the income threshhold is kind of a bummer ,2021-03-16 19:38:35.231690
“They’ll probably suck” lol,2021-03-16 19:38:35.231786
It's based on the previous days closing price,2021-03-16 19:38:35.231837
Sad that one HF can make such a difference easily but they rather stuff as much cash up their asses as they can,2021-03-16 19:38:36.321924
I want to trade like Chuck,2021-03-16 19:38:36.322018
I want all the mf day traders to quit their shit,2021-03-16 19:38:36.975404
Lots of shills and Melvin interns trying to scare the apes,2021-03-16 19:38:38.087717
Say you’re holding a flaccid member  Doesn’t matter whose it is  You’re holding 100% of it but then it grows  Suddenly you’re holding more than 100%  And there are other hands on it too  Now everyone is holding it  I don’t know where this is going so good luck🤷🏼‍♂️,2021-03-16 19:38:38.087818
Buying EOD aint been terrible,2021-03-16 19:38:38.087880
Ugh  Yeah I'm an idiot ignore me ,2021-03-16 19:38:38.087929
time for Disney to break 200,2021-03-16 19:38:38.719739
Everyone begging for a green eod should probably buy more cause it won't go green without help ,2021-03-16 19:38:38.719834
Honestly? College fund for my kids and my two little sisters a car that actually seats our family fix our fence that blew down in November finish our completely unfinished basement let my wife finally go back to college to get the degree she was working on paint the house probably buy a new TV and then look at what we still have to set aside into a retirement fund    We live at the poverty line  We're on state assistance for food stamps and daycare costs  My wife just lost her job due to covid downsizing and we just bought this house 6 months ago with money we'd been saving for almost 10 years    I've only got 5 shares of GME but if it 🚀 to the point where I can put up a new fence finish my basement and buy my sons a couple new Lego sets I'll literally cry with joy cause things have been a little rough  But apes together strong 🍌🦧💎🙌🚀,2021-03-16 19:38:39.872839
son you are the bad kind of tarded,2021-03-16 19:38:39.872963
Does anyone know if Panini Cards manufacture are publicly traded? I don’t seem to find anything but they’re also Italian company so maybe that’s why I cant,2021-03-16 19:38:39.873017
I saw a shit article about some fuck claiming he made 10 mil shorting game and got irrationally mad  I'm coming for you and I'm deaf in one ear so I won't hear any bell  Hope you covered ,2021-03-16 19:38:39.873091
Quit crying hold or quit the market,2021-03-16 19:38:40.980955
Maybe you can build a sample project that you can show to recruiters  I believe it will differentiate you from other applicants,2021-03-16 19:38:40.981048
Driving up my price target like the true sack of shit he is ,2021-03-16 19:38:42.078876
I hope so  It's the best info I could find,2021-03-16 19:38:44.014579
sounds like a mechanical bull manufacturer,2021-03-16 19:38:44.014765
They aren’t working ಠ_ಠ,2021-03-16 19:38:45.133194
Same pattern every day ,2021-03-16 19:38:47.179086
Nah just meant go up 600%+ over the next year,2021-03-16 19:38:47.179210
Don’t care I’ll die with these shares,2021-03-16 19:38:47.179467
CRWD will miss earnings and moon,2021-03-16 19:38:47.179554
"As soon as he says ""^inflation"" SPY will drop 75 points ",2021-03-16 19:38:47.179628
"I believe it's ""a fuck load"" ",2021-03-16 19:38:48.290272
Oh men diamond balls 😄,2021-03-16 19:38:48.290531
No one knows  FFS stop fucking asking this ,2021-03-16 19:38:48.290639
If wsb talks about it,2021-03-16 19:38:48.891139
Getting excited to see what the rest of the week brings this is a crazy ride 💎👐🚀🌝,2021-03-16 19:38:50.020276
Sir this is wendys,2021-03-16 19:38:50.020373
What a battle today ,2021-03-16 19:38:50.020423
Bringing cash to JPOW's discount sale tomorrow ,2021-03-16 19:38:51.151413
Well   no one is still shorting from the exact same position they had months ago  There isn't a single person shorting $GME with their original sub $5 position      But many shorted it when it was over $300 over $400 ,2021-03-16 19:38:51.151552
HF are fukked,2021-03-16 19:38:51.151636
True it would be collectively better if everyone set the same sell price to 500k or whatever  But the DD shows that hedgies will have to buy every bodies shares in the end  Theoretically you could be the last retail investor with GME shares and still ask/get 500k for them   If you want some mathematical perspectives on this there’s plenty of DD on this subreddit that explains this all in a quantitative style,2021-03-16 19:38:51.151728
He has billions and could only make 10 million?,2021-03-16 19:38:51.764678
Thinking of subscribing to semiconductor enthusiasts monthly  Is it a good read??,2021-03-16 19:38:51.764799
https://youtu be/YedqV4Gl_us,2021-03-16 19:38:52.855436
These traps got traps inside of traps,2021-03-16 19:38:52.855571
I personally am a _____ investor and strongly believe in a few of them including the main one 2nd one and a privacy one aswell as one named after a bird  It’s easier to HODL after you’ve seen 80% dips! HODL ON BROTHERS,2021-03-16 19:38:53.998164
Gross Bob is gonna be sucking the zipple soon too ,2021-03-16 19:38:55.112776
Yesterdays close,2021-03-16 19:38:55.765355
I think the stimmies should be done ,2021-03-16 19:38:56.917754
Farmers in general or   ?,2021-03-16 19:38:56.917876
Do it for the ape WSB bought ,2021-03-16 19:38:56.917955
Yesterday's close was 220,2021-03-16 19:38:58.064709
Hm thanks for the breakdown oddly has become the norm,2021-03-16 19:38:58.064834
That does seem to be a likely move   Give us a bit of hope and drop it drastically before close   Sow FUD   But damn I’d buy even more shares if that happened   I can’t afford it but fuck it man ,2021-03-16 19:38:59.183787
It'll take a while before XOM restores pre-pandemic cash flows   due to their hedging they probably have been selling the bulk of their production for much lower than current spot price simply because they have to as part of their hedging because they can't count on parabolic prices to continue   i'll bet when oil was languishing at 20 bucks they sold a lot of their future output in the 30's and 40's rather than current spot  They'll trade below pre-pandemic for a while longer until we can see whether the current spot price is sustainable long term ,2021-03-16 19:38:59.788401
Spyder takes major damage from *Boot Crush!*  \-500 HP!  Spyder regenerates!  It uses *Poisonous Bite!*  *CRITICAL HIT!*  It's very effective!,2021-03-16 19:38:59.788580
Cause that’s where it closed yesterday,2021-03-16 19:38:59.788673
Any movement is a cup and handle if you just squint your eyes hard enough,2021-03-16 19:39:00.885210
PD,2021-03-16 19:39:00.885331
When you see the news mess up a subject you know about remember how well they did when they report on something you don't know anything about ,2021-03-16 19:39:01.984362
Liar,2021-03-16 19:39:03.109661
Oh shit good luck,2021-03-16 19:39:03.109786
You're a special kind of retard  Well done!,2021-03-16 19:39:03.109867
Yep but an imbalance in the overall books wouldn't just disappear  There's a lot of ways to do it  But there are also a lot of measures that should prevent it  I've already seen the posts of the order imbalances for buy and sell  You would assume that someone monitors the money side of it too  A net value per share drop would affect the market cap  If there wasn't money movement to adjust the marketcap to match then I would be surprised ,2021-03-16 19:39:03.109946
Are you serious,2021-03-16 19:39:05.193343
I'm an old fart    I like going to the movies    Yes the popcorn and sodas are super-overpriced and the candy is stale and the seats are sticky  I don't care    It's a core memory going to see *Star Wars* with my daddy when I was a wee bairn  Seeing *Bambi* and *Dumbo* and *Indiana Jones* and *ET* and *Close Encounters of the Third Kind*    &#x200B;  So I have bought AMC not because I plan to make tons o' tendies  Not because I think it's 'going to the moon'    I BOUGHT AMC BECAUSE I HAVE EMOTIONAL ATTACHMENT TO THE COMPANY FROM MY CHILDHOOD AND I DON'T WANT TO SEE SOME CONNIVING HUDDLE OF RICH TARTS DRIVE MY CHILDHOOD MEMORIES OUT OF BUSINESS ON THE TAIL OF A PANDEMIC    &#x200B;  So there ,2021-03-16 19:39:05.193503
Eat my dongus you fuckin nerd   *I am a bot and this action was performed automatically  Please [contact the moderators of this subreddit]/message/compose/?to=/r/wallstreetbets if you have any questions or concerns *,2021-03-16 19:39:05.193715
gosh darnit,2021-03-16 19:39:05.193816
You got it you got it bad   When you're on the phone   Check your stocks and open the app right back   You got it you got it bad   If you miss a dip without buying   Your whole life's off track   You know you got it bad when  You stuck in the house you don't wanna have fun  Stonks all you think about  You got it bad when you're out with someone  But you keep on thinkin' buying GME or else  You got it bad,2021-03-16 19:39:05.193903
What time frame?,2021-03-16 19:39:06.277881
Thanks guy that has negative 100 for no reason!,2021-03-16 19:39:06.277972
Yesterday’s close ,2021-03-16 19:39:06.278132
💎🍆💎🍆💎🍆It takes more than love and belief in this stock  Hold and buy if you can  If stimmy check can be spared tomorrow it’s something to consider  Cheers bitches this is one hell of a ride!!!💎🍆💎🍆💎🍆💎🍆💎🍆,2021-03-16 19:39:06.875626
Yes plz  👉👈🥺,2021-03-16 19:39:07.978336
Hold both retard ,2021-03-16 19:39:10.786559
If you're not making money off the highest AND lows then you don't understand GME yet ,2021-03-16 19:39:10.786655
Become it gets compared to last close not market open,2021-03-16 19:39:10.786708
20 MINS TO GET THIS PIG POSITIVE LETS GET IT,2021-03-16 19:39:10.786755
I was just making a joke about how vernacular and coloculal are hard for a smooth brained ape like me to banana,2021-03-16 19:39:11.419925
So anyways I started fapping,2021-03-16 19:39:11.420022
Ray Dalio literally said buying bonds is retarded,2021-03-16 19:39:12.043766
GME MAKES MY PP HARD [https://www youtube com/watch?v=eFCwhI8l25o&ab\_channel=Astaeria]https://www youtube com/watch?v=eFCwhI8l25o&ab_channel=Astaeria,2021-03-16 19:39:12.043861
It's based on the 4:00pm EST close the previous day  There after after hours European and pre-market trading between then and open at 9:3am EST  They fucked it in premarket and so we opened at 9:30am well under the previous 4:00pm close,2021-03-16 19:39:13.137427
Myyyyyy panini   Dodo dodo do do,2021-03-16 19:39:13.137791
On most charts whether the stock is in a gain or a loss Red/Green is not dpeendant on the opening of the day but on the closing of the last one   &#x200B;  In this case  GME closed at 220 yesterday and opened at 205 today meaning the stock only goes green over 220,2021-03-16 19:39:13.764121
federal bailout,2021-03-16 19:39:13.764248
Bingo,2021-03-16 19:39:13.764323
BULLS HAVE BEEN TRAPPED   The hedgies have set the nets,2021-03-16 19:39:14.913999
That's a rookie number  I'm asking $100k per share I know what I have ,2021-03-16 19:39:14.914122
I hate to burst your bubble but cats don’t become tigers,2021-03-16 19:39:16.061203
Memes aside is Tesla actually dead? Lol,2021-03-16 19:39:16.061302
If we win we should give the free ride to a terminally I'll child  If the point is to donate why wouldn't we donate the prize too?,2021-03-16 19:39:16.061356
First you turn off the people from buying before you try to cover,2021-03-16 19:39:17.193766
Yeah but I'm also using the sale of other stock to buy even more gme,2021-03-16 19:39:17.802722
Shills are QUIET now  As expected,2021-03-16 19:39:17.802844
LIVE TO FIGHT ANOTHER DAY   TOMORROW IS SAINT PATTIES DAY   GME GOES GREEN TOMORROW   🚀🚀🚀🚀 🚀🚀🚀🚀 🚀🚀🚀🚀,2021-03-16 19:39:18.902964
Let’s fucking go! I’m waiting on one of those random pops ,2021-03-16 19:39:18.903089
Im more the yolo Type of guy,2021-03-16 19:39:18.903169
His mom likes doggystyle u probaby suck at sex too,2021-03-16 19:39:18.903240
Diamond bottom in Canopy Growth or am I trippin? 😎💎,2021-03-16 19:39:20.023605
Alexa play hit em up,2021-03-16 19:39:20.023759
Stop loss order? Power hour is my stop loss order ,2021-03-16 19:39:20.023841
Probably rhymes with rank buptcy and trison pime,2021-03-16 19:39:20.023917
Hehe  Needs to be updated ,2021-03-16 19:39:20.023997
\`Thank you for choosing Wendy's come again,2021-03-16 19:39:22.616368
Quick give me some confirmation bias,2021-03-16 19:39:22.616505
>📈 📈  📈  📈  📈  📈  📈  📈  📈   YOu missed some of this,2021-03-16 19:39:22.616612
The 🥇only🥇 bags 💰I 👀 hold 🙌 are the double ‼️testicles 🏀🏀🏀🏀 between my 🦵legs🦵,2021-03-16 19:39:22.616668
It went up a penny   Now it's worth a penny ,2021-03-16 19:39:22.616719
This is the way ,2021-03-16 19:39:24.721867
If I listened correctly this guy knows what he's talking about and said it was a good move on apes behalf to buy and hold   [https://citywiremiddleeast com/news/bill-gross-on-gamestop-gamestonk-it-s-almost-like-i-m-an-idiot/a1475322?assetClassID=6]https://citywiremiddleeast com/news/bill-gross-on-gamestop-gamestonk-it-s-almost-like-i-m-an-idiot/a1475322?assetClassID=6,2021-03-16 19:39:26.791983
Closed at 220 yesterday  So it counts from that  Open at 205 means it opend at -75% give or take,2021-03-16 19:39:26.792199
That's the price it closed at yesterday it's always relative to last close price,2021-03-16 19:39:26.792264
Hahaha they can’t drop it that was weak af,2021-03-16 19:39:26.792316
SPY will probably dip enough tomorrow for some 400c 4/16 right?,2021-03-16 19:39:26.792366
***HF Sharting sounds intensifies***,2021-03-16 19:39:26.792415
What are some cheap-ish stocks that might double in the short-term?,2021-03-16 19:39:26.792515
What a dark episode of The Office!,2021-03-16 19:39:27.434840
Great fucking day !!!! We can def rip this thing to green let’s go!!!!! Just bought another for the cause,2021-03-16 19:39:27.434934
When are Americans expect to reciceve the stimulus? Majority by tomorrow?,2021-03-16 19:39:29.766671
Probably blows,2021-03-16 19:39:29.766767
That’s cray cray in a good way!,2021-03-16 19:39:31.770589
There isn’t one  AMC issued shares to raise money which diluted the pool  They’re also probably going to do it again  AMC is more a value play than a short squeeze attempt ,2021-03-16 19:39:32.389717
ON RH ROFLMAO :D,2021-03-16 19:39:32.389814
Congrats but fuck RH,2021-03-16 19:39:33.055848
The people who couldn’t afford Gme will say yes but unbiased Gme has more potential,2021-03-16 19:39:33.055948
Anything in the green is a massive win on our part today,2021-03-16 19:39:33.056004
