Let us all be loving and giving even when the enthusiasm and fun have died down one day  This is simply amazing and I think we all can afford to support the wonderful creatures of this magical planet into the future  💎🦍👐 That's what diamond hands do  💗,2021-03-16 02:46:35.443074
There's no way GME ever hits 420 in the rest of it's existence 😂,2021-03-16 02:46:36.983904
We’ll probably see more dips until a catalyst  We don’t have volume,2021-03-16 02:46:36.984004
Stay tune,2021-03-16 02:46:37.076843
Cramer should marry Sean Dyche they'd be a perfect couple,2021-03-16 02:46:38.615431
Well,2021-03-16 02:46:40.120852
have they made money lately or are they still net negative?,2021-03-16 02:46:40.120974
Sorry brother gme was so last month  Now we're buying fake adoption papers,2021-03-16 02:46:40.228059
"we can call it ""stimulus""",2021-03-16 02:46:41.728249
Munchn’ Bunchn’,2021-03-16 02:46:41.728346
I used to then I sold it to buy more GME  Now it's my sold button,2021-03-16 02:46:42.361340
Yep,2021-03-16 02:46:42.973080
>Saudis shit on those chicks for way less than 250k and I know I rather get a tattoo than a Saudi’s shit on my chest  Well thats something i didn't think i'd have to contemplate about today   ,2021-03-16 02:46:42.973206
How does one begin to do DD,2021-03-16 02:46:42.973297
That’s the spirit,2021-03-16 02:46:45.389578
I think they will try to keep it below $350 again  We need to burst through 300 soon I think,2021-03-16 02:46:49.774091
Attributing it to the dividend makes no sense and if that’s their explanation hopefully they can provide a bit more context  AAPL pays a dividend every quarter so why isn’t the options for AAPL all messed up?,2021-03-16 02:46:49.774209
I call bottom of the pile,2021-03-16 02:46:49.774272
🦍,2021-03-16 02:46:49.774321
What would happen if Gamestop decided to do a 3 or 4:1 split?,2021-03-16 02:46:49.774368
Numbers and a colorful graph? That’s all I needed to see I’m in,2021-03-16 02:46:49.879548
![img]emote|wsb_emojis|tendies,2021-03-16 02:46:49.879644
got a BB 4/16 20c today it did feel retarded,2021-03-16 02:46:49.879695
there should be a thread for stock of the week every week   apes strong together,2021-03-16 02:46:50.479987
This guy has fun hating on every AMC post,2021-03-16 02:46:52.479232
I am a bot  You submitted a Gain/Loss/YOLO that didn't look like it included **large** positions  Please read the rules ,2021-03-16 02:46:52.479388
Gorillas looking like an old school desk with the amount of obscene phrases they’ve had scrawled on them the past 24 hours ,2021-03-16 02:46:53.076199
Lets ask the magic conch shell 🐚,2021-03-16 02:46:53.076292
You'll have to ask the ape who posted the chart,2021-03-16 02:46:55.144572
Yeah  It's been on a real month to month wave since Oct/Nov  I was thinking it would get closer to 400 before the next downswing but maybe not ,2021-03-16 02:46:56.243907
Laxatives are the only way to stay straight,2021-03-16 02:46:56.244005
try hard not to buy OTM GME calls,2021-03-16 02:46:58.303600
I like the stock,2021-03-16 02:46:59.394165
What do you all think of VIAC  It has the same slope as GME did after the Technoking tweet and it is shorted 20% ,2021-03-16 02:46:59.394256
Hey Cramer  Shut the fuck up ,2021-03-16 02:46:59.394310
Back at you,2021-03-16 02:47:03.875501
This is not true at all  Fidelity did sell their shares    In December not January  Since then they bought back in ,2021-03-16 02:47:03.875618
Jim Cramer stoked the people going into the market when in crashed in 2008   He's a crook ,2021-03-16 02:47:03.983567
Words of wisdom my friend!,2021-03-16 02:47:08.269159
Ngl that spac netted me a lot of money when I exited somewhere near ATH still waiting for the merger so it can finally be talked about here,2021-03-16 02:47:08.269320
Or it goes to $1,2021-03-16 02:47:09.756766
Cage match to the death,2021-03-16 02:47:11.215790
Yep   Office managers? Gone   Office worker bees?  Gone   Chaz Dickworth the security guy?  Gone ,2021-03-16 02:47:11.215894
u/proptard666,2021-03-16 02:47:11.798750
FSR you can go when you're ready buddy    Ill keep buying in the red!,2021-03-16 02:47:12.415515
I will supply my three shares as an offering ,2021-03-16 02:47:14.305576
Probably hoping the price stays high enough during their selling window to paperhand out,2021-03-16 02:47:14.305673
Hookers and blow and camcorders?  Like that scene in robocop,2021-03-16 02:47:14.905842
It can't be theranos cause they were later   I dont think ill get this one ,2021-03-16 02:47:14.905939
This might be a good week to sell 800 covered calls   ,2021-03-16 02:47:16.008961
Jeez are you trying to bankrupt the guy ,2021-03-16 02:47:17.134150
100 percent Cramer is the of predicting stuff after it happens lol,2021-03-16 02:47:17.134243
There are more bad stuff than good on the company,2021-03-16 02:47:17.134296
imagine NOT thinking 100k was the floor lmaooo couldn’t be me,2021-03-16 02:47:17.750133
I don't get why they still trying how much of a win they need to recoup the billions lost?,2021-03-16 02:47:22.637657
Apes must stick together ,2021-03-16 02:47:31.141460
Apes hate apes love apes!?,2021-03-16 02:47:31.141780
That’s what I was saying   ,2021-03-16 02:47:31.141868
And bulls,2021-03-16 02:47:31.261100
So when the fuck did *Fucking Stock Traders* become Batmen? Batman? Bat-men - man? Oh who cares you guys fucking rock!,2021-03-16 02:47:33.041715
Right on,2021-03-16 02:47:33.041839
Please make amc to $100,2021-03-16 02:47:34.612056
But in this version of the story the stewardesses pass out bananas and tendies and Captain Sully flies us to the motherfucking moon,2021-03-16 02:47:34.723415
Ask Jimmy!,2021-03-16 02:47:36.283968
thats kinda a dick thing to say bro   like some apes got nothing,2021-03-16 02:47:36.284166
I am a bot  A Gain/Loss/YOLO should be a picture of a closed gain a closed loss or an open position > $2500 ,2021-03-16 02:47:36.284246
This is the way ,2021-03-16 02:47:36.284322
We is actually Me  Just a Me with an upside down W,2021-03-16 02:47:37.816656
Nope just learned how WSB works with meme stocks  I use it to my advantage,2021-03-16 02:47:37.816782
The guy Hans Zimmer who composed the soundtracks for the Dark Knight and Inception also did the soundtrack for Boss Baby and Kung Fu Panda ,2021-03-16 02:47:37.938861
donaldinho pumperino,2021-03-16 02:47:39.516593
some of these interns didn't watch that vid where the guy drank his piss  ,2021-03-16 02:47:39.516816
MONKE!,2021-03-16 02:47:39.594679
Because the divy came right out of the share price,2021-03-16 02:47:41.791263
PLTR 🚀🚀🚀🚀🚀,2021-03-16 02:47:41.791386
I imagine they’d have some attractive yield on these shit bonds so basically institutions needing to take on more risk to meet their own objectives or people who like citadel,2021-03-16 02:47:41.791482
Look out we got the next Warren Buffet here   Thanks for the hot take ,2021-03-16 02:47:42.381410
I think we all know that the stock of the week thread would just say GME until the end of time,2021-03-16 02:47:46.816821
How do i get a bonus from this,2021-03-16 02:47:46.816944
Samesis,2021-03-16 02:47:46.817022
Ya know I heard the same thing from people like you  Also claimed we were qanon types  That was when it was at $40 3 weeks ago  Yall shut up really quick the last 2 weeks 🤣 and now you feel brave enough to say it again ,2021-03-16 02:47:46.817102
Im offended     by how much I enjoyed this ,2021-03-16 02:47:48.352763
Everything,2021-03-16 02:47:52.748676
Well we are not perfect  We are just a bunch of mostly well-intended people trying to make tendies ,2021-03-16 02:47:52.860377
The Cup and Balls Pattern!,2021-03-16 02:47:52.860515
Back at you,2021-03-16 02:47:54.388537
This is the way buying $RKT tomorrow again  ,2021-03-16 02:47:54.388656
I have no problem buying shares everytime really struggling to understand why the hedge funds would ,2021-03-16 02:47:54.388737
You could do both by buying 4/19 SPY 420c,2021-03-16 02:47:56.154282
Who is wearing pajamas right now?,2021-03-16 02:47:56.154395
Good stuff you will be surprised at what you have by EOY  Keep at it and be patient I’ll be rooting for ya,2021-03-16 02:47:56.771683
I got the 3/19 ‘s,2021-03-16 02:47:57.394737
ima pick the world up an ima drop it on a gay bear’s head,2021-03-16 02:47:59.357956
I was in a Cult and I think that term gets used waaaay to loosely  This is more like the Mickey Mouse Club  Nobody is forced to be here ,2021-03-16 02:47:59.358080
Don't worry they're just pissed because gme went down today,2021-03-16 02:47:59.358235
GOEV Aug calls on the dip,2021-03-16 02:48:01.434976
now or at open but check the price @ 2am account deficits on RH resolve at 2am for some users,2021-03-16 02:48:01.435127
There’s a spongebob gif on the front page rn have we been overrun by Facebook boomers or something wtf is going on,2021-03-16 02:48:02.516495
goev weeklies,2021-03-16 02:48:02.516618
whats the website to check option volume? I thought i bookmarked it but cant find it,2021-03-16 02:48:02.516876
Best words of inspiration I've received since my dad told me I'm not worth sticking around for   Thank you dear ape  I will HODL,2021-03-16 02:48:03.106426
“People that refuse to get lowballed are so crazy” -you,2021-03-16 02:48:03.712954
Nice try hedge boi,2021-03-16 02:48:06.307917
Buy gme you fucking Idiot,2021-03-16 02:48:06.308212
How are idiots still buying the BS between GME and AMC? You can downvote all you want but both of those stocks are grossly overvalued even in the most optimistic growth going forward  Stop buying into a bubble because you're all gonna get screwed if you don't get out soon  And PS I think this goes for all stocks but guaranteed for those meme stocks,2021-03-16 02:48:06.308304
This is why the government hasn't shut shit down  GME fucking a HF and making millionaires out of a diverse disperse group of americans who are generally just your average good people     Better stimulus than they could have ever formulated   We're in the right here  The more we do things like this and the more the media tries to push a narrative that demonizes us - the more people will start to see the cracks in the story and come around ,2021-03-16 02:48:07.441962
I bought 1 at 230 I like the stock,2021-03-16 02:48:09.661554
Just yesterday bunny was calling u a boomer  Today you are from 1600 in a fortnight or so u will be a zombie or something  Be careful of bunnies bro ,2021-03-16 02:48:09.661702
That's what the media owned by hedgies want you to think  Cute,2021-03-16 02:48:09.661800
gme mega thread over there,2021-03-16 02:48:14.132445
87 to 213 average lol,2021-03-16 02:48:14.132595
Harambe died for this ,2021-03-16 02:48:15.636006
I am a bot  A Gain/Loss/YOLO should be a picture of a closed gain a closed loss or an open position > $2500 ,2021-03-16 02:48:19.435951
I usually buy in increments on the way down during dips i expect another short attack coming so setting a bunch of buy limit orders on the way down wouldn't hurt,2021-03-16 02:48:19.436074
Once Donald Trump is re-inaugurated we can all sell  I can’t keep track of that date though I keep hearing it change & im a tard,2021-03-16 02:48:19.436158
100% legit,2021-03-16 02:48:19.436236
*Online,2021-03-16 02:48:19.436307
Oh we definitely stick our noses into a lot of shit and it’s not even humanitarian but some corporate interest involved somehow ,2021-03-16 02:48:23.249854
Hmm hmm you are onto something here,2021-03-16 02:48:23.339693
Should wings be smaller than a dollar? Because that's all I know how to do ,2021-03-16 02:48:24.814485
Have you seen the new banner?,2021-03-16 02:48:26.304846
Don’t those blow up in the rain?,2021-03-16 02:48:26.304977
This is the way,2021-03-16 02:48:28.344377
Maybe Ill get some alex jones flair lol,2021-03-16 02:48:28.344515
He’s a joke,2021-03-16 02:48:28.344601
You underestimate the amount of retards with stimmys,2021-03-16 02:48:28.344677
When they start pushing in I start pushing out,2021-03-16 02:48:28.919201
oh gooood for you,2021-03-16 02:48:30.969948
That late WTf lol 😂 I was talking to a co worker on the phone and had to close the window  It didn't help    ,2021-03-16 02:48:31.553101
A loan for GME rocket fuel? Maybe Yellen called them up and said enough is enough you need to deliver those shares ,2021-03-16 02:48:31.553203
I am a bot  You submitted a Gain/Loss/YOLO which was a video or GIF                             Please make it a Reddit gallery of screenshots including entry and position info ,2021-03-16 02:48:31.553260
MAH STIMUHLUZ HITTT,2021-03-16 02:48:32.143315
All JP Morgan and Wells Fargo customers I read in an article earlier today  That checks with the eta I got on my IRS stimmy tracker ,2021-03-16 02:48:32.143433
“I like money”  -Frito,2021-03-16 02:48:32.143715
In your opinion   does it make any sense to play a couple of these positions ahead of the announcements? To sort of beat the crowd? They all seem mostly cheap contracts right now for OTM weeklies,2021-03-16 02:48:34.224872
I thought it was pretty bullish  Vlad looked like an idiot that fucked over retail    It wasn’t perfect but it’ll get people researching GME/WSB  Hopefully it brings in some volume ,2021-03-16 02:48:34.225035
This retard is a pretty well off retard  Instead of hating and crying  You should have taken a risk  Not to late to join the AMC rocket     oh wait     it’s obvious your holding GME bag aren’t you ? Lmao 😂 puss,2021-03-16 02:48:35.347044
Where’s the late night boys at,2021-03-16 02:48:37.469212
"""Let's recall the shares""",2021-03-16 02:48:38.029480
What plan?,2021-03-16 02:48:40.592763
Found him,2021-03-16 02:48:41.176385
Barchart,2021-03-16 02:48:45.913895
Too much read  Would you buy the dio yes or no?,2021-03-16 02:48:45.914017
Dont worry we did m,2021-03-16 02:48:50.263736
If AAPL can reach 140 by next month  That would be great,2021-03-16 02:48:50.263856
That’s what I thought too I have a margin account with them  Thought it’d be like Robinhood  But apparently you can only trade stocks with that options and OTCs can be traded after it clears which apparently takes 4 Fuckin business days  But my first deposit went in Friday and cleared today 1 business day so idk that’s why I’m asking,2021-03-16 02:48:50.263945
My amc 3/19 13 5 calls looked great today I use the calls to keep me entertained til my shares hit the moon,2021-03-16 02:48:50.264042
How do we keep this shit from tanking when we report?,2021-03-16 02:48:54.247940
Is that an entire Elon Musk?,2021-03-16 02:48:54.248038
This is the way,2021-03-16 02:48:54.345115
Idk I don't think Godzilla will kill him,2021-03-16 02:48:55.842359
As sad as it seems apparently so  If they both went up it wouldn't be a problem but somehow out AMC is considered a distraction from GME but none of the other thousands of stocks in the market,2021-03-16 02:48:59.870103
I am a bot  You submitted a Gain/Loss/YOLO that didn't look like it included **large** positions  Please read the rules ,2021-03-16 02:49:01.554839
They didn't pull out trillions   What makes you think that trillions got liquidated?,2021-03-16 02:49:01.675858
looks like they found someone to replace Jim Cramer's Mad Money Show,2021-03-16 02:49:03.356371
Janet Yellen?,2021-03-16 02:49:03.356547
Them saying dividend gave me enough to google search which led to a thetagang post which led to this: https://www investopedia com/terms/a/adjustedexerciseprice asp  It seems a special dividend causes an option price to adjust down by the size of the dividend  First time learning something new about options in a long time ,2021-03-16 02:49:04.858880
It’s not really non-sense when you think about how much of this type of shit has been going on ever since GME became worldwide news and the HF wanted to save their asses  I was really just spit balling a theory that I’ve seen thrown about lately that I just found a bit suspect given the timing of everything that’s been going on  Like I said I don’t think AMC is a bad play I have just seen lots of things happen that are perfectly timed to try and pull people away from GME    Call me delusional idc  Just my opinion ,2021-03-16 02:49:04.859188
Get your shitty car out of here!,2021-03-16 02:49:06.388081
i can sleep soundly knowing this guy is profiting off a sleeper stock  rest well king,2021-03-16 02:49:07.006290
my six year old son has loved spongebob for at least 3 years ,2021-03-16 02:49:07.601565
Seconded  Done deal ,2021-03-16 02:49:08.279909
Y’all gon make me cry,2021-03-16 02:49:10.390288
WSB never ran up GME  We just like the stock,2021-03-16 02:49:11.466446
This is my MO  I take profits too early and feel sad about how much I could have made but then I’m glad to have taken *some* profits in retrospect  I have a couple of legendary call plays in my record where I could have made 10x what I did but     didn’t 🙃,2021-03-16 02:49:11.466600
The regular apes should buy shares when the price is spiking  The whales and yes we have several on our side can afford the ITM call premiums  Let the whales handle that ,2021-03-16 02:49:16.131761
Should have specified for $GME  Based on history I expect the price to get much higher after this week   But I know nothing about finance just recognize patterns ,2021-03-16 02:49:16.131894
HELL YAH BROTHER! IF I'M STILL IN I'M STILL IN,2021-03-16 02:49:20.293969
thinking about sinking 100k into some more shares,2021-03-16 02:49:20.294090
Awww I’d waste your time any day :,2021-03-16 02:49:20.294170
Does SPY hit 400 tomorrow ?  Tune-in in 11 hours ,2021-03-16 02:49:24.470371
this is a buy if you mean buy puts,2021-03-16 02:49:24.470516
Mmmm   crowns,2021-03-16 02:49:24.470715
Heyy fucking bald fraud is back,2021-03-16 02:49:24.470796
Just buy less avocado toast guys,2021-03-16 02:49:24.579132
Except the hedgies were selling counterfit Xboxs and IOU slips  They didn't even have enough shares to borrow ,2021-03-16 02:49:28.405564
If you read the article it says that the resort is opening reservations back up starting April 1st  The reason they were there was that it was a bubble because their offices in NY and Chicago were affected by WFH orders  Now that they can work in their actual offices it makes no sense to buy out the resort especially if a sweetheart rate is off the table with them reopening ,2021-03-16 02:49:28.405679
Let me get my 🔬,2021-03-16 02:49:28.405748
I am a bot  A Gain/Loss/YOLO should be a picture of a closed gain a closed loss or an open position > $2500 ,2021-03-16 02:49:28.405799
[To the moon 🚀]https://i imgur com/gbc48qW jpg,2021-03-16 02:49:28.516142
Your stores suck,2021-03-16 02:49:30.133008
Now I can start trading options!!! I finally understand it now!,2021-03-16 02:49:30.133133
My pleasure!!  I want the HFs spines on a dessert cart!  The Pandemic was good for little ol me’s business and I am buying the shit out of GME as a result! I despise those who feed off the destruction of others  They tried to assasinate my favorite store growing up  To hell with em!   I am going to be buried with my GME shares as stuffing for my coffin and pillow  They ain’t getting my shares back!,2021-03-16 02:49:30.133364
This is big but they have about a $6m/yr donation stream ,2021-03-16 02:49:30.133491
Dropping many stacks on the way down as it slips  It will  I'll buy  I'll buy again ,2021-03-16 02:49:30.133579
I just added $60 to the total by sponsoring an ape [https://imgur com/a/dMs1awn]https://imgur com/a/dMs1awn,2021-03-16 02:49:34.060434
Believing in short ladder attacks is like believing in QAnon,2021-03-16 02:49:34.060564
Legend   Lol,2021-03-16 02:49:34.060640
Puts on SBUX  These mofo’s made me drive an extra 2 miles to a different location because they can’t decide on business hours  Can you believe it!?!  That was an extra 15 minutes out of my day I could have been glued to my portfolio ,2021-03-16 02:49:38.331053
First try: [https://imgur com/a/aJDr8Rc]https://imgur com/a/aJDr8Rc,2021-03-16 02:49:38.331183
We thank your girlfriends boyfriend for letting you buy GME ,2021-03-16 02:49:38.331246
every week shld be a different stock   we can keep gme megathread too i am talking of other than tht,2021-03-16 02:49:38.436039
That’s not a bad average  I think this squeeze is not ending soon  You should do really well as long as you don’t get too greedy  Somebody is going to be left holding the bag someone has to  I should have been more disciplined with GME but I’m up which is OK with me when I’m trading with crazy people 😆,2021-03-16 02:49:38.436207
Even apes have to retire at some point banana pension needed,2021-03-16 02:49:40.226738
Sundial lol,2021-03-16 02:49:40.226861
I mean maybe if thanos was in charge he would reduce 50% of the competition,2021-03-16 02:49:44.385393
Oh man  I’m 100 onboard with this CO,2021-03-16 02:49:44.385549
Gorillas gettin Louis V belts and Tesla’s,2021-03-16 02:49:44.486943
I always just use the yahoo options chain  It has volume IV bid-ask and more ,2021-03-16 02:49:46.094024
So there is a sale coming?,2021-03-16 02:49:46.094536
GME GME GME GME GME GME GME,2021-03-16 02:49:46.094869
Samesies,2021-03-16 02:49:46.095062
So are my 3/19 28 89’s unfucked?,2021-03-16 02:49:47.797418
Ha   Theranos   It was Genentech   Ticket DNA   Roche spun them off and then reacquired them years later ,2021-03-16 02:49:47.797560
i don’t have to be faster than the bear i just gotta be faster than you chief,2021-03-16 02:49:47.798027
Hey!!! Dude me too I like the stock too!!,2021-03-16 02:49:49.429116
Seriously I know people talk about WSB like it’s only retards gamble and dumb jokes but I personally love this community and take very seriously what you all have to say  One love guys  🦍❤️🦍,2021-03-16 02:49:49.429337
That’s ambitious ,2021-03-16 02:49:51.165598
https://imgur com/gallery/rYHftrf,2021-03-16 02:49:52.652772
The reality of this year has absolutely annihilated whatever credibility the financial news networks might’ve had ,2021-03-16 02:49:52.652900
I’m Tesla gang now!,2021-03-16 02:49:56.608856
I bet you eat your words  Wanna wager?,2021-03-16 02:49:56.608985
Now I know why GME went broke today      APES BUYING APES!!!! I’m ok with it! Just don’t let that shot happen again tomorrow cuz I LIKE THE STOCK!!!!!!,2021-03-16 02:49:56.609069
Hans also did some soundtrack work for Simpsons,2021-03-16 02:49:58.205542
I could watch this all day    but only today  tomorrow it’s back to the 🚀🚀🚀,2021-03-16 02:49:58.308011
I hear you but historically Citadel doesn't issue that many bonds  At least from what I can find  Also from most news articles I read it is fairly outside the norm for hedge funds to issue bonds ,2021-03-16 02:49:58.308107
It’s a strategy for sure!,2021-03-16 02:49:59.777137
These bonds get an A rating in WSB-BRA system in this system Double D is the best rating according to my wife's boyfriend ,2021-03-16 02:49:59.777233
My brother just retired from the Army  I sent him a salami  It cost about the same as a gorilla   Send a salami to ya boy in the army ,2021-03-16 02:50:01.338013
I’m gonna fuck so many guys tomorrow  Seriously watch out my market moves are going to be so good ,2021-03-16 02:50:03.475025
After I sell these calls then will be put time  Thinking this week sometime  I have 20c June 18 just in case I miss the surge point but I think we’ll see just a tiny bit more room to run potentially it going to 15-16/share before taking a dump ,2021-03-16 02:50:05.123963
Those are baby ape numbers! I thought we were full grown apes??????,2021-03-16 02:50:05.691049
Whoever bought those bonds is going to be selling bonds in a few months ,2021-03-16 02:50:05.691170
If this gets realized is there a method of determining who counterfeited the shares via trade log? I’m worried they just blame everything here on retail and “promise it won’t ever happen again like super cereal” ,2021-03-16 02:50:10.282172
Drugs,2021-03-16 02:50:10.282303
Who's drinking beer|wine|booze right now?  while reading this of course,2021-03-16 02:50:10.282384
Makes total sense  But then again I’m just a retard ,2021-03-16 02:50:10.282471
"""I don't think I have to outlast Dunder Mifflin David  I think I just have to outlast \*you\*""",2021-03-16 02:50:10.282550
Only the boomer stonks the meme stonks can only go up,2021-03-16 02:50:10.282634
Please SPY open 398 need to pay rent,2021-03-16 02:50:10.282703
We have officially entered the matrix  🤨,2021-03-16 02:50:11.876957
The problem is thinking it will keep going lower ,2021-03-16 02:50:11.877076
Imagine you had a popular opinion,2021-03-16 02:50:11.877153
Those were the 90 day out 30 35 40 50 less the $1 11 dividend ,2021-03-16 02:50:13.347220
Sorry i barely made it past the “but what’s more likely”,2021-03-16 02:50:15.332293
I own 120 $GME @ $212  On Monday each week I sell a slightly OTM call for that Friday  Example: Sold 3/19 250C for $6655  I keep the $6655 no matter what  Best case call expires and I do it again next week  Worst case it gets exercised and I make the premium + ~$4K on the stock and then I just buy more shares and start again    And if it starts squeezing during the week I buy back my option at an inflated price of course and hope it keeps going to cover my premium difference plus lots more  That happened last week except the keep going part  I bought to close my 3/12 225C as $GME was hitting $330 and then it turned around and sunk  I lost about $6K btwn my sold 225C and bought 225C but then I just sold the 250C after the price rose and broke roughly even overall ,2021-03-16 02:50:15.421809
