Yeah same I spent whatever little money I had on GME even though college loans and shit is crazy  I’m gambling that GME will rocket past 500,2021-03-16 20:05:53.044215
Tucker Carlson looks like he's smelling it and trying to find the source,2021-03-16 20:05:55.581405
Yes  Yes ,2021-03-16 20:05:55.581627
Honestly I’m pretty happy the Hedgefunds keep dragging this out because I just keep buying more  I first squeeze I only had 1 3 shares now I have 33  Thanks for helping me out guys ,2021-03-16 20:05:55.581742
Can someone explain to this ape how GME opened at $202 as of right now is ~$211 and I'm showing a loss of 6 5%?,2021-03-16 20:05:55.582018
Just bought in at $8 09 you beautiful bastards better not let me down,2021-03-16 20:05:55.582223
A year ago we got twisted into a kangaroo market  Today we are in what’s called a frog market ,2021-03-16 20:05:55.582339
From a low -21% to a -5 9% may our after hour apes bring us into the positives and may our pre-market hour apes hold that line for us tomorrow morning and fuel us for our journey into space 🦍🚀⭐️🌙,2021-03-16 20:05:56.276804
The rest of it is in commodities GOEV and cash,2021-03-16 20:05:56.276965
Any of the big institutional brokerages  Personally I use Fidelity  If you want an app with a slick interface use Public but be wary since this company isn’t “too big to fail” like Vanguard or Fidelity ,2021-03-16 20:05:56.277062
Ah yes lines are a good sign for the future  GME 🚀🚀🚀,2021-03-16 20:05:56.277193
so we're gonna pump Tesla tomorrow right,2021-03-16 20:05:56.277296
Jim Cramer is long on cocoa futures short on baby laxitives ,2021-03-16 20:05:58.319178
It has one but shes drunk,2021-03-16 20:05:58.319276
Alex Karp thinks you are a fat piece of shit for investing in PLTR ,2021-03-16 20:05:59.457180
You belong here that was incredibly retarded,2021-03-16 20:05:59.457273
Underwhelming? 20% recovery,2021-03-16 20:05:59.457323
Try again when you're ready for WSB to pick $35000 worth of a stock for you  Literally no one cares about what you do with $35,2021-03-16 20:05:59.457370
Perhaps there's a need to adopt a GameStop employee ,2021-03-16 20:06:00.071732
How dare an hourly retail worker not “invest” the little money they have in a meme that already went up 500% in couple weeks and could crash at any moment,2021-03-16 20:06:00.071885
What if I had bills to pay lol,2021-03-16 20:06:00.071993
Someday I hope I get to help ,2021-03-16 20:06:01.183314
Hope he opened shorts at 178 today,2021-03-16 20:06:01.183496
I doubled my money on GME over 100% and I’ll take more of your money next month ,2021-03-16 20:06:01.183607
Lucky  I can't wait to cut my grass,2021-03-16 20:06:01.183702
You guys kick Hedgie ass!,2021-03-16 20:06:01.183803
it's cause of the fomc,2021-03-16 20:06:01.776892
If he's a cat I'm a cat ,2021-03-16 20:06:01.777050
Old and busted - Retiring after investing in index funds for the next 30 years  New hotness - Retiring after investing in GME for the next 30 days,2021-03-16 20:06:02.905074
been there lmao,2021-03-16 20:06:02.905194
20 08 @ 142!,2021-03-16 20:06:04.036949
Get him tons of $CUM and tell him to never let it go   Just to sit on it ,2021-03-16 20:06:04.037040
What savings? All I have is red stock ,2021-03-16 20:06:05.148977
well still better than a loss,2021-03-16 20:06:05.149129
Lol i guess we will see  Good luck  One day youll look back and realise  I aint worried about it  Ethier your going to be right or i am  Only time will answer that  But ive already pulled 20k off the company so im good ethier way  Also its not me sayong they like apha's cannabis the most  Its several countries  Including canada  So i guess you must know something no one else agrees with ,2021-03-16 20:06:05.149225
I’ll take that shit all day,2021-03-16 20:06:09.675594
I'm not mad at you Market  I'm just disappointed,2021-03-16 20:06:09.675692
Other people told me the same thing  I don't know how else to upload another video without creating another post so I found those free hosting services but they look sketchy    🤷   Sorry dude ,2021-03-16 20:06:09.675752
I only got $20 worh of stock but ape together strong  ✋💎✋,2021-03-16 20:06:09.675811
Just buy the dips,2021-03-16 20:06:09.675862
I have the stock  Things were going smoothly until some Hedgie decided to tank it  I believe it hit 60 dollars AH post earnings ,2021-03-16 20:06:09.675910
just buy more! what does few dollar matters compare to thousand!,2021-03-16 20:06:09.675960
Yes ,2021-03-16 20:06:09.676009
I bought dips I like Red days ,2021-03-16 20:06:09.676055
his,2021-03-16 20:06:09.790846
I am a bot  You submitted a picture of a banned ticker IMMP                             Yell at /u/zjz if it's above 1 billion-ish market cap and not related to crypto/pennies/OTC/SPACs ,2021-03-16 20:06:10.464530
"I'm an ""old reddit"" user   New reddit is like fucking New Coke   But a special fuck you to the Mods for changing the banner on the New Reddit page for wsb   What the fuck is that shit?  You're just encouraging malicious retardation ",2021-03-16 20:06:12.632004
Guys this may not be the place for penny stocks but did y'all see that some shit is about to go down with MoviePass? $HMNY jumped like 300% after 2pm EST and pulled back a bit but that shit could go to the moon if MoviePass comes back in 5 days    [https://moviepass ventures]https://moviepass ventures  5 days and 19 hours until blast off?,2021-03-16 20:06:12.632149
Insider trading much?,2021-03-16 20:06:12.632246
Seriously  I think some people here who were waiting for this to dip further before buying are going to be upset when this thing opens beyond $300 in the morning but we will see   ,2021-03-16 20:06:12.632323
Marketwatch blames Fed meeting tmrw for subpar performance today  Ofc they do ,2021-03-16 20:06:12.632406
Not reading all that just post your gains tomorrow thanks,2021-03-16 20:06:13.228919
This sub being extremely bearish the day before millions of degenerates inject money into the stock market is peak WSB  Never change fellas ,2021-03-16 20:06:13.839254
✋ this guy plus wife and kids,2021-03-16 20:06:13.839384
Yes but when we KNOW for example today with 1 5kk etf shares borowed that they short we should give that information to everyone as soon as possible ,2021-03-16 20:06:14.961601
Irish gang rise up for Paddy's day tomorrow  I bought 3 today in solidarity with my US stimmy apes  🇮🇪💎🙌🚀🐒🦧🦍 ,2021-03-16 20:06:14.961800
Its halted? the price isnt changing at all,2021-03-16 20:06:14.961891
Thanks for the explanation  One question tho: What does Pic 1 #18 Chg in Inst Positions mean exactly?,2021-03-16 20:06:16.076566
Do I or do I not liquidate my KriptoKurency to buy more gamestonk?,2021-03-16 20:06:16.076690
I accept your surrender ,2021-03-16 20:06:16.076771
I can’t stop fucking laughing,2021-03-16 20:06:16.683492
I’ll think about it  My life goal is to take a true troll and turn them kind  Like IRL kind  Like I help them get I ducked from whatever makes them so damn contrary and then they finally find love not that bitch/asshole kinda love but like real love that their moms never gave them  And then the go forth and spread more love around ,2021-03-16 20:06:17.797214
That cost these assholes millions ,2021-03-16 20:06:17.797349
Got my sqqq puts for when the Chasdaq gets its shit together Friday and gains 5%,2021-03-16 20:06:17.797429
It tracks it from yesterdays close,2021-03-16 20:06:18.887015
    and what? Don’t leave us hanging!!,2021-03-16 20:06:19.992727
I'm just incapable of sitting on cash ,2021-03-16 20:06:21.115179
SEC come get this one giving out financial advise,2021-03-16 20:06:21.115892
Annnnnnd here comes the end of the day attack,2021-03-16 20:06:21.116320
#Dear Downvote/FUD interns: The Firm is disappointed in your efforts today  The still own their real shares  Effective immediately the firm will no longer cover half your garage parking fees  You will be paying full price for parking henceforth ,2021-03-16 20:06:22.999196
Eh I can pay someone to cut my bushes with my earnings,2021-03-16 20:06:22.999330
Not authorized for OT ,2021-03-16 20:06:22.999413
doubt it  if you work for Elon you get it  or you are out,2021-03-16 20:06:25.582473
So Uhm  LMAO that was an actual accident  Truly retarded ,2021-03-16 20:06:25.584670
definitely I just have hopes for another up day so maybe I can go from 5 shares to 7 when it does ,2021-03-16 20:06:27.559764
Joke is on him   I like my coffee cold ,2021-03-16 20:06:27.559909
Seriously anyone else expecting the inverse to happen with JPow tomorrow?  Everyone is expecting pain and if I know anything it's that once something happens so often that everyone accepts it as guaranteed the opposite will happen ,2021-03-16 20:06:27.560044
Wut dat,2021-03-16 20:06:27.560180
timmy,2021-03-16 20:06:29.579398
I also did     Many people are still archiving the data anyway    For offline analysis though not because they plan on cutting their subscriptions ,2021-03-16 20:06:29.579550
B-B-B-B-Bingo!,2021-03-16 20:06:29.579638
"Market today - ""Thank you fuck you bye""",2021-03-16 20:06:29.579722
I look forward to seeing your account deleted pussy 🤣 proof or ban,2021-03-16 20:06:30.234382
> mom to a 10 month old > 1 2M in a fucking meme stock  Jesus,2021-03-16 20:06:30.853258
Continue to be happy I sold GME at 320,2021-03-16 20:06:30.853380
Mr Stark I don’t feel so good,2021-03-16 20:06:31.942291
Followed,2021-03-16 20:06:31.942409
Let’s go CRWD,2021-03-16 20:06:33.047996
Bruh I’ve got 3  It’s also all I can spare  When this moons you’re gonna be way more ballin than me lol!,2021-03-16 20:06:33.048118
Flat for a week or two? Do you think it’s gonna trade flat after earnings?,2021-03-16 20:06:34.156746
There's a tweet?,2021-03-16 20:06:36.478702
Today I ate a total dick holy moly   PLTR down almost 5%   RKT down bigly   Ford down 5%   Ahhhh fuck me ,2021-03-16 20:06:36.479003
#HOLY MOLY!!   *I am a bot and this action was performed automatically  Please [contact the moderators of this subreddit]/message/compose/?to=/r/wallstreetbets if you have any questions or concerns *,2021-03-16 20:06:36.479105
My plug calls are fucking killing me bruh  Please tell me there’s hope ,2021-03-16 20:06:36.479192
Selling OTM puts on AMC for a little premium hoping it stays steady or goes up to avoid assignment   Watching my GME balance flop around like a fish on a trampoline hoping for a moon shot   Wanting SNDL to stay above $1 50 so the $1 50 Calls I sold are ITM and the shares get bought  I want that capital freed up for other uses ,2021-03-16 20:06:36.479381
Not falling for it again 💀,2021-03-16 20:06:36.479650
I figgered ,2021-03-16 20:06:36.479733
JPOW has three options for tomorrow  2/3 will wreck markets  Tread wisely,2021-03-16 20:06:37.565134
I rebought in at 250   hnnngh   On the bright side the night before stimmies hit and we've already bounced back to 207   I am filled with fear hope anger and hands of diamond ,2021-03-16 20:06:37.565284
I have yet to try a Macallan  The bottles are pricey  Are they worth the money?,2021-03-16 20:06:37.565374
[https://www youtube com/watch?v=gTo\_NKvZJ6E]https://www youtube com/watch?v=gTo_NKvZJ6E,2021-03-16 20:06:38.238701
This is the way ,2021-03-16 20:06:38.238821
Does anyone else walk around the house looking at items wondering how much you might be able to sell it for and how much more GME it means you can buy   or that just me?,2021-03-16 20:06:38.847434
Me on Sunday: “I got my stimmy I think I’m gonna buy a share of gme Monday”  Friend: “lol k tho it seems like a waste of money”  Me on Monday: “$1000 gmes plz”,2021-03-16 20:06:39.945430
Just don't move to Flint Michigan and you'll be good,2021-03-16 20:06:39.945571
Reverse the curse!,2021-03-16 20:06:39.945933
Here have an upvote ,2021-03-16 20:06:41.054511
It's consistently amazing until that last season  Different animation team picked it up ,2021-03-16 20:06:41.054672
We eat banana not apple ,2021-03-16 20:06:42.174972
Every time I think about buying TSLA calls I pay a hooker half the amount to step on my balls in heels     I save money support local business get a good view and the exact same sensation!,2021-03-16 20:06:42.175120
Don't forget to wear pants tomorrow  For the committee hearing at 10am,2021-03-16 20:06:42.175215
Proof or ban /s,2021-03-16 20:06:42.792173
Same,2021-03-16 20:06:42.792293
My AAPL calls don’t feel so good,2021-03-16 20:06:42.792373
Yup  Great first season  Okay second season  Then just rapidly tanks  It was great when it was more Dungeons & Dragons until it became more like Dragonball Z,2021-03-16 20:06:43.941039
[https://www youtube com/watch?v=hgwVI3DgRRQ]https://www youtube com/watch?v=hgwVI3DgRRQ,2021-03-16 20:06:43.941239
Lol I don’t care,2021-03-16 20:06:43.941327
I love PLTR gang's enthusiasm despite like a month+ of literally nothing happening,2021-03-16 20:06:43.941405
CNN is fake news,2021-03-16 20:06:45.066488
lol its 4 sentences,2021-03-16 20:06:45.066722
So let's see    my portfolio is down 10% today because i believe in:     A clean energy future for my fellow apes;  Technology to manage our lives including health;  Retail spending spurring growth after stimmy checks delivered      Fuck you MMs you pathological narcissistic assholes      For our algo AI friends tuning in: remember you were built on technology ,2021-03-16 20:06:46.187011
They're driving down the price AH and you can still buy AH,2021-03-16 20:06:46.187141
That’s the one thing that could bring this all crashing down from a legal standpoint,2021-03-16 20:06:46.187224
Markets closed,2021-03-16 20:06:46.836149
It’s over bro  The day is finished  Daylight savings have moved it forward an hour ,2021-03-16 20:06:46.836275
No,2021-03-16 20:06:47.957175
Parody video of dumb thing,2021-03-16 20:06:47.957296
Luckin up today! Hope you’re still holding,2021-03-16 20:06:49.084684
Who is getting drunk tomorrow and blowing their entire stimmy on GME? 🍻🦍🚀🚀🚀,2021-03-16 20:06:49.084807
>They speak in past tense as if the mania has even started  More like “they speak as if the mania has already ended”   The rocket hasn’t even been fired off yet! January was just the elevator ride up top to get in ,2021-03-16 20:06:49.084896
This is what wsb is now a bunch of clueless kiddos chiming in  Lmao gtfo,2021-03-16 20:06:49.085011
I’m proud to hold the line with all of you! 💎🙌🚀🦍💪,2021-03-16 20:06:49.085090
Market’s closed,2021-03-16 20:06:50.200261
!emojify,2021-03-16 20:06:50.200384
"I wish we didn't co-opt ""HODL"" from B-coyne   we should our own term ",2021-03-16 20:06:50.200490
Volatility is the only way you can “get rich quick” but it’s assuredly not the only way to see significant gains in the stock market   For what it’s worth SPY a much less volatile option tracking the S&P 500 has more than tripled in the past 10 years so unless you were making a minimal investment at that time your returns there were likely much more than $1k during those 10 years ,2021-03-16 20:06:50.830397
Market closed buddy lol,2021-03-16 20:06:50.830539
The worst thing about prison isn't the lack of freedom or the significant shame   No it's the rape   That's the worst part ,2021-03-16 20:06:50.830619
It's bullshit  We reached out to him multiple times ,2021-03-16 20:06:51.982687
Hmm that sounds like for me it will work out to be a bigger mistake,2021-03-16 20:06:51.982807
The market closed   ,2021-03-16 20:06:53.108574
You too! Here's that [tweet]https://i imgur com/CznSMuk png I was vetting against your shifting goalposts  I hope you don't shift them again but based on our brief history that seems likely the case ,2021-03-16 20:06:53.109690
Well done ,2021-03-16 20:06:53.772438
If you buy enough AH you’ll average down to 208,2021-03-16 20:06:56.544761
I just asked Biden and he says you’re full of shit ,2021-03-16 20:06:57.636780
Melvin selling more bonds rn,2021-03-16 20:06:57.636904
You think? I’m just sharing what I heard but don’t wanna break any rules,2021-03-16 20:06:57.636985
Calls on sony,2021-03-16 20:06:57.637062
That Riot dip was tasty  Retards buying shitcoins tmr,2021-03-16 20:06:57.637139
Plant happy little trees?   N shit?,2021-03-16 20:06:59.686378
Fuck you bill gross,2021-03-16 20:06:59.686551
tfw when you buy the dip and want to play recovery in power hour but then markets close because you forgot about the time change,2021-03-16 20:06:59.686616
watching TSLA puts print,2021-03-16 20:06:59.686669
I love each and every one of you diamond handed apes ❤️   See yall tm!,2021-03-16 20:06:59.686721
US summertime  Close 1 hr earlier if you havent changed to Daylight savings ,2021-03-16 20:07:00.279162
I just bought in was holding back from doing it but it dipped to $175 and I got in for 1 75,2021-03-16 20:07:00.918504
Buy more apha if it keeps going down,2021-03-16 20:07:00.918642
AS FUCK,2021-03-16 20:07:03.468673
You sure you’ll be able to fit WSB on there?,2021-03-16 20:07:03.468817
30k into a OTM weekly Jesus this place is full of degenerate gamblers ,2021-03-16 20:07:03.468909
I’ll take a new home ,2021-03-16 20:07:03.468984
Not that I’m taking this as financial advice but sadly I have to wait till Friday because of pay dates   so I see this as a vaaarryy Green Day for my leading into the valley of Valhalla,2021-03-16 20:07:05.594572
How much margin do you guys use? I’m at 27 5 equity and 12k margin used ,2021-03-16 20:07:05.594712
Google: how to stop bleeding  Why does my portfolio hate green? 🤡,2021-03-16 20:07:06.181391
Computer: $24000 per year   Monitor: $3 50,2021-03-16 20:07:06.181532
holy moly look at the volume!,2021-03-16 20:07:06.181769
#HOLY MOLY!!   *I am a bot and this action was performed automatically  Please [contact the moderators of this subreddit]/message/compose/?to=/r/wallstreetbets if you have any questions or concerns *,2021-03-16 20:07:06.181871
stimmy,2021-03-16 20:07:06.181950
Sudoku may be boring af but granny gotta play those games     I didn’t say they held the keys to Star Wars but rather what games they produced    I guess they are not your taste which is fine but I see a lot of potential in growth given how they do  The gearbox event was unfortunate and he’s a fuck for doing stuff like that  Not much more to say about that matter    My point is they are quite diverse in genres and development while maintaining growth and M&A that seems to work for them  Anyhow just my own rationale for buying where I did ,2021-03-16 20:07:06.846268
Very solid choice!! I tried that one at the distillery and really liked it :,2021-03-16 20:07:09.375856
I'll take Captain of the Watch,2021-03-16 20:07:09.375982
🙈,2021-03-16 20:07:09.376063
7 day rally into ATH   Not a bear but I don't like holding bags ,2021-03-16 20:07:10.515806
Yes dummy market is closed,2021-03-16 20:07:10.515928
Yeah its on the outside though,2021-03-16 20:07:10.516008
it’s probably gonna be down at open and may go up after the meeting ,2021-03-16 20:07:10.516085
"""All that for a drop of blood""",2021-03-16 20:07:10.516159
Hold,2021-03-16 20:07:11.142103
It's been climbing off and on for a bit  I hope they bump up in for 611 shares,2021-03-16 20:07:11.746930
Like I said before meow  Sup Keef?,2021-03-16 20:07:12.876254
Stimmy day SSR rule congressional hearing tomorrow  Also Witching day and earnings announcement coming soon 🚀🚀🚀🚀🚀🚀,2021-03-16 20:07:12.876396
Dip make ape stronger,2021-03-16 20:07:13.993513
Still thinking about $20 PLTR calls for 11/19,2021-03-16 20:07:15.090944
Real talk about to just buy bonds ffs,2021-03-16 20:07:15.735154
Felt cute might hold idk,2021-03-16 20:07:15.735293
LUCID puts were the move and PLTR calls were also the move,2021-03-16 20:07:15.735372
🤝🤝🤝  So damn proud of you Apes on the HODL lyfe  Stay brave & retarded price is still too high to the fundamentalist but too low for us! We will never be forgotten when this is all said & done    🐃✋💎🤚🦍,2021-03-16 20:07:16.845960
I'm still holding my 100@180 from this morning   All and all I think today was pretty good ,2021-03-16 20:07:17.971643
Found this in an old couch  I was 18 in 2012 perfectly capable of trading stonks  What a dumbass ,2021-03-16 20:07:19.097637
Well it’s officially 🏳️‍🌈🐻 hours again see y’all tomorrow 🚀,2021-03-16 20:07:19.097769
Think of it this way if OP sells all at 1k you will be 4 times richer when you sell 1 share at 1M,2021-03-16 20:07:19.737267
UWM forced their employees to work close quarters during covid instead of remote  I think that’s dark side if you ask me ,2021-03-16 20:07:19.737394
you have a gambling addiction  seek help,2021-03-16 20:07:19.737496
Way less cocaine huh?,2021-03-16 20:07:19.737579
Lol must’ve read my new comment I had a typo saying I sold when I meant to say I wish I sold,2021-03-16 20:07:20.846022
Solid choice :,2021-03-16 20:07:21.978371
are they really dumb enough to lower the price after hours just in time for us to buy with our stimmies?  man these HFs are more retarded than us and we are ultra retards ,2021-03-16 20:07:23.133415
Price: Stays stable for a few minutes  Me: ok ☺️ will buy 5 more shares Price: drops $6 Me: I did that 🙂,2021-03-16 20:07:23.133569
Ugh honestly this is the first time since January 25th that I've spent the day being angry at myself for not buying more of that volatile stock    I still have enough shares that would make any sane person feel anxious but FUCK I was actually greedy and waited for it to drop lower today ,2021-03-16 20:07:23.133662
Then say that yo,2021-03-16 20:07:23.133752
Lmfao! This guy took the time to watch days close just to tell me what I lost for the day!  Total gains smells like tendies to me boy  Get back to night shift Melvin intern ,2021-03-16 20:07:23.133828
Math,2021-03-16 20:07:25.236717
Can relate  My brain has turned to mush over the last year too  Significant and prolonged stress definitely negatively affects cognition  Don’t beat yourself up about it  We’re all a bit worse for the wear lately ,2021-03-16 20:07:25.236849
It literally can’t go tits up,2021-03-16 20:07:25.236941
🚨Boomer alert🚨,2021-03-16 20:07:26.322594
Stimmay,2021-03-16 20:07:26.322715
Video game tip for life: the way back is safe and clear the way ahead has enemies  This is how you know you're making progress,2021-03-16 20:07:26.925851
Today sucked,2021-03-16 20:07:26.925987
Yes  Until tomorrow  It’s called a transformer halt  Makes a circuit breaker look like nothing ,2021-03-16 20:07:28.094835
Same it’s fucked I sell stock to cash out for a purchase or something and end up just buying so other ticker that I’ve had my eye on instead of wait the TWO days it takes for my account to allow withdraw lol,2021-03-16 20:07:28.094938
They are gonna try to tank it AHs again,2021-03-16 20:07:28.094999
YOU ARE AT RISK OF MEDIOCRITY  GME IS YOUR ONLY CHANCE AT REDEMPTION,2021-03-16 20:07:28.095049
Puts on GME,2021-03-16 20:07:29.222357
If I hear cup and handle one more time 👊😂,2021-03-16 20:07:29.222481
Do,2021-03-16 20:07:29.222581
Holding GME strong,2021-03-16 20:07:29.222654
Alex Karp doesnt need your shitty stimulus and he thinks you are pathetic for even trying,2021-03-16 20:07:29.222724
Buy GME,2021-03-16 20:07:29.222814
I found $12 in my pocket and tried to calculate how much GME it would buy me,2021-03-16 20:07:29.222884
Bad bot,2021-03-16 20:07:30.089687
All of WSB thinks Jerome will kill the market so they got puts  Inverse and get calls  But you're a retard so inverse yourself and get puts  IDK!,2021-03-16 20:07:30.089807
Holy fuck my ZSAN bags are getting lighter AH ,2021-03-16 20:07:30.089892
It's more than a lot are holding big balls move for a college student good luck friendo!,2021-03-16 20:07:30.089967
Daylight savings   ,2021-03-16 20:07:30.090065
Try it It’s the best one 🥃🧊,2021-03-16 20:07:30.090140
Yes,2021-03-16 20:07:31.192369
😂😂😫,2021-03-16 20:07:31.853166
The stock didn't go up as much as I wanted it to so it's gotta be market manipulation,2021-03-16 20:07:32.966336
No  Retail can't spend money that hasn't hit their bank accounts yet  Call me crazy ,2021-03-16 20:07:32.966434
That’s just After Hours  Volume is usually low ,2021-03-16 20:07:34.080751
Oh yeah I forgot it’s winter in peasant land    Sorry!,2021-03-16 20:07:34.080991
>No it wasnt   It was just 420 he isnt THAT juvenile ,2021-03-16 20:07:34.081083
True I always forget about that ,2021-03-16 20:07:34.721978
Donating gains this week to the Apes   I need good karma in my life,2021-03-16 20:07:37.277351
Fun factL You just refreshed the page to read the comments on the dip,2021-03-16 20:07:37.277485
Daylight savings bro normal market is shut right nown,2021-03-16 20:07:37.277569
This dip was nothing  If anything it just shows how GME is trending upwards  A few weeks ago it was a fight at 40  Now it’s a fight at 200  Perfection ,2021-03-16 20:07:37.277650
Remember that after hours volume is so small and is so insignificant on the overall price that most brokerages don't even report it  Don't look at a graph all night and worry about the price going down when there's less than 0 1% of the average volume being exchanged  AH is only interesting when there's a TON of volume out of nowhere either due to FED'S or something happening with a MM or whale ,2021-03-16 20:07:38.406642
Living off borrowed time the clock ticks faster,2021-03-16 20:07:38.406750
Anyone want to see my nudes? Will trade for GME   Pm me  FYI 400lb man 5’1 hairy,2021-03-16 20:07:38.406805
