I'd like an explanation for what they think reddit is rebelling against why they seem to think of reddit as WSB or vise versa *and* that this is a unified group in either case ,2021-03-16 02:34:54.342364
I just like AMC stock!!,2021-03-16 02:34:54.342517
Half are American  That’s still ~$5 4 Billion that can prop up GME and AMC in the short term ,2021-03-16 02:34:54.342599
Short answer: no one could predict the time just hold   Longer answer: not enough options were ITM to propel us further up so there’s a temporary pit stop   Shorter answer:  hold   Shortest answer: h,2021-03-16 02:34:54.342662
is it possible to short citadel to death,2021-03-16 02:34:54.442303
Just finished it  I thought it ended in a really bullish way  I didn’t like all of it but I agree it was fairly neutral  If anything it leaned towards retail    I thought Vlad was made to look rather guilty of fucking over retail    Was it the best? No  Do I think people are going to watch this and start researching GME? Yes  I hope it gains traction in the next few days while people get their stimmys ,2021-03-16 02:34:56.027530
Heathy sell offs don’t happen in the span of 5 minutes  Get your shill ass on outta here,2021-03-16 02:34:56.632291
Why is his screen in his camera though?   ,2021-03-16 02:34:56.632420
And   ?,2021-03-16 02:34:57.262604
This sounds like a commercial,2021-03-16 02:35:02.074959
It comes up a lot  I had to explain this to a client just last week who has a co-defendant and the importance of both of them remaining forever silent ,2021-03-16 02:35:02.075892
Susquehanna is long GME rn,2021-03-16 02:35:02.076017
Citadel- “My anus    IS BLEEDING!”,2021-03-16 02:35:03.630623
It's ok rocket you go when you feel like it,2021-03-16 02:35:03.630719
Truly retarded,2021-03-16 02:35:03.726112
An analysis of the Dingle-Berringer bands shows tomorrow is going to be the next leg up ,2021-03-16 02:35:04.394977
Only if it goes down     😂,2021-03-16 02:35:04.395075
Fidelity has been good to me   I don't use the phone app I have this thing called a 'desk top' instead ,2021-03-16 02:35:06.553438
Someone was just posting about NFTs  Idk about unemployment benefits having anything to do with this but it’s definitely a money laundering scheme yes  The entire art world is just one giant money laundering scheme ,2021-03-16 02:35:06.553612
That’s a LOT of bananas!,2021-03-16 02:35:06.553679
I don't think I fully understand    2% interest doesn't sound bad at all!,2021-03-16 02:35:06.553730
ah yes the ever simplification of math by way of making it more complicated ,2021-03-16 02:35:08.675757
Please dont you could do something else like shove marshmallows or peanuts or something   All that wax wouldnt be very good in your digestive system    Dont earn that money just to use it in hospital fees ,2021-03-16 02:35:09.249463
I'm gonna inject more capital in and buy these dips  Just a retard,2021-03-16 02:35:12.578615
Ape sees another ape from across the global  This ape lives in LA and can verify the pent up demand  KTLA our local news network did a segment on the reopening today in LA  My god so  many  fucking  people ,2021-03-16 02:35:12.578753
Excellent point makes sense now ,2021-03-16 02:35:12.578851
Jim Cramer is the bait on a hedge fund's fishing hook    Don't bite  Ever ,2021-03-16 02:35:12.578925
Agreed man! Agreed!,2021-03-16 02:35:12.578995
u/savevideo,2021-03-16 02:35:12.579062
Magic Ape Ball,2021-03-16 02:35:16.664831
Thanks bro,2021-03-16 02:35:16.664977
What kind of clown show do they have over there you can't sell covered calls?!? Is it just a bad UI? Of any option those are the safest ,2021-03-16 02:35:16.665057
Whoosh?,2021-03-16 02:35:16.665137
###[View link]https://redditsave com/info?url=/r/wallstreetbets/comments/m5s7ir/surprise_mf/    ---   [**Info**]https://np reddit com/user/SaveVideo/comments/jv323v/info/&#32;|&#32; [**Feedback**]https://np reddit com/message/compose/?to=Kryptonh&subject=Feedback for savevideo&#32;|&#32;[**Donate**]https://ko-fi com/getvideo &#32;|&#32; [**DMCA**]https://np reddit com/message/compose/?to=Kryptonh&subject=Content removal request for savevideo&message=https://np reddit com//r/wallstreetbets/comments/m5s7ir/surprise_mf/,2021-03-16 02:35:16.665220
Wholesome sewer things,2021-03-16 02:35:16.665318
I am a bot  You submitted a Gain/Loss/YOLO that didn't look like it included **large** positions  Please read the rules ,2021-03-16 02:35:16.665391
Holy fuck,2021-03-16 02:35:18.242498
I know but it’s just so expensive already 😭 I wish I had invested earlier but I’m sure that’s every investors thoughts at some point,2021-03-16 02:35:18.243106
🐸🍦,2021-03-16 02:35:19.672202
cramer promoting using stimmy money churchill and tesla as high risk and amc and gme    that means they're all gonna crash right?,2021-03-16 02:35:23.654384
#APE WINS  FLAWLESS VICTORY ,2021-03-16 02:35:23.654566
💎🙌🚀🚀🚀,2021-03-16 02:35:23.654632
He's taking that Xerxes deepfake as a very high level compliment ,2021-03-16 02:35:23.654681
Son of bitch  Im in in in,2021-03-16 02:35:25.138834
It's the same movie as the first but with updated PC jokes   I didn't hate it but I'm not about to bring it up to friends as a conversation piece ,2021-03-16 02:35:25.138964
Your point?!,2021-03-16 02:35:26.642284
No that’s not what we do here you idiot  We yolo our life savings on autistic plays and then brag about it  If a hedge fund gets caught with their pants down then whatever we will take their money ,2021-03-16 02:35:26.642443
I may be spooked sad and angry  But I’m sure as hell not selling I’m in it until the end ,2021-03-16 02:35:26.751839
Theres a new ETF coming out called FOMO  What a time to be alive,2021-03-16 02:35:28.310075
Get your special helmets ready ,2021-03-16 02:35:28.310175
Well that's one opinion but if we're talking about national security then our financial freedom from foreign powers generally considered hostile China middle eastern oil producing countries etc  should be on top of that list  Besides that who designated America as the worlds police? I'm as patriotic as they come but even I admit America sticks its nose where it shouldn't be some times ,2021-03-16 02:35:28.936377
What kills me is the people that think there wouldn't be down days on the way up  Guys this will be nothing like the first go around  They weren't prepared they didn't think retail or really anyone would hang on that long  But here we are for a second round im certain they will push even harder tomorrow Friday matters to them a lot and if they have to deliver it won't matter what the price is they will have to deliver ,2021-03-16 02:35:28.936526
Hahaha holy fuck  That's hilarious    But   what a coward!!,2021-03-16 02:35:28.936646
One happy gorilla right there,2021-03-16 02:35:30.960442
They needed to buy back more shares than exist  At 140% shorted they needed to buy almost 100 million shares and as they did the price was going to reach thousands of dollars per share  The market cap would have blown up well past 16b as the shares went skyrocketing   It would have eclipsed the rest of the market however briefly and tanked everything because they *repeatedly* engaged in a strategy of infinite risk  They violated the rules of the free market to avoid detonating the bomb they created from over-shorting ,2021-03-16 02:35:32.912673
I love him because he lets my Wife’s boyfriend fuck his wife,2021-03-16 02:35:32.912894
The theory is basically that the HFs would bankrupt then the DTCC would use its insurance to foot the bill and the Fed would print the money to back it  Which assumes that people who lie and cheat daily for a living would just HAVE TO pay  It’s all predicated on the US wanting so badly to preserve the purity of its free market that it will just take the world’s biggest L  Obvious to me that the powers that be would rather just cheat say that we are economic terrorists or some BS and most of the finance world will welcome it  Because the alternative is catastrophic for them  Then they can adjust rules to prevent it happening again   We don’t even have close to a free market  Mortgage bailouts QE etc are already huge violations of that “purity” and guess what people still do business in the US ,2021-03-16 02:35:33.520175
"RemindMe! 120 days ""Is the outlook still stable for Citadel?""",2021-03-16 02:35:35.633430
May I interest you in *Crayon Stock??*,2021-03-16 02:35:35.633584
At least you’re not paying much in IV,2021-03-16 02:35:35.633639
maybe if those contract buyers focused on actually buying and holding rkt it will have a potential gamma squeeze  too many people is wanting to buy options for a quick flip and not actually buying and holding the stock that will make it BRRRRRR ,2021-03-16 02:35:35.633689
Fuck,2021-03-16 02:35:37.566683
Rumours the second coming of Harambe will be heralded when 420k is hit ,2021-03-16 02:35:37.566780
That’s y  y  ellow,2021-03-16 02:35:38.151506
Can u get a link please,2021-03-16 02:35:38.735907
🧙‍♀️🧙‍♀️🧙‍♀️🧙‍♀️ say this is going to be very profitable,2021-03-16 02:35:48.253815
Let's not act like we won the war already  Keep holding and buy the dip folks ,2021-03-16 02:35:48.253947
AAPL duh,2021-03-16 02:35:48.254028
I suppose I expected it to happen already  I mean how long can these fuckers keep fighting realistically?,2021-03-16 02:35:48.254102
Silverback 🦍 diamond hands 🙌 💎,2021-03-16 02:35:48.254179
My dude even if it doesn’t hit the mark you should buy GME employees some Wendy’s  I’ll chip in ,2021-03-16 02:35:48.254253
I was just driving back home from some errands and this dude cut me off  He was a real dick about it so I called 911 and told them he was a drunk driver  Home boy got pulled over by 2 cop cars in less than 5 minutes 😂,2021-03-16 02:35:48.254339
Careful you’ll probably get ringworm  You don’t want to know where that tongue has been ,2021-03-16 02:35:48.254423
Yeah fr  I thought we was in a chip shortage ,2021-03-16 02:35:48.254509
Sir this is a catnip lounge   *I am a bot and this action was performed automatically  Please [contact the moderators of this subreddit]/message/compose/?to=/r/wallstreetbets if you have any questions or concerns *,2021-03-16 02:35:48.254588
Coronavirus happened because people kept eating them ,2021-03-16 02:35:49.843637
yea DAD we know ,2021-03-16 02:35:49.843764
The Hedges are talking,2021-03-16 02:35:49.946214
It's sorta like a retarded class consciousness,2021-03-16 02:35:51.489164
Yep its called but gme,2021-03-16 02:35:53.016276
Guess where everyones capital gains tax from all this going ;,2021-03-16 02:35:53.016474
Oh no         One of the main strengths to AMC right now is we are full of step by step news stories enough to last until fall amd it’s all going to be free  Never underestimate an enemy or a friend or a damn good SOB executive    btw when I was at 5 50 I heard the same    Sorry you won’t join our rocket ride ,2021-03-16 02:35:53.121070
This is hard to follow  There are no colors or bananas  This ape’s head hurts ,2021-03-16 02:35:53.223675
Kinda crazy watching something you took part in ,2021-03-16 02:35:54.777683
A silver award for a silver back!,2021-03-16 02:35:55.413549
Not quite sure what you meant but I found this funny nonetheless  Mostly cuz I picturing someone crying while saying the falsely accuse people of being a shill would be an A+ video,2021-03-16 02:35:57.493205
Happy cake day you wank,2021-03-16 02:35:57.493306
Sub basement actually might be good if it happens on Wednesday all those stimmy checks and people can afford to buy in on more gme ,2021-03-16 02:35:57.493359
I mean  Can you even read?,2021-03-16 02:35:58.076923
This is the funniest goddamned thing I’ve ever read,2021-03-16 02:36:02.737210
This is perfect  We adopted monkeys so why the hell not?,2021-03-16 02:36:02.832874
Don’t stop until the donations hit $420694 20,2021-03-16 02:36:03.423960
Guess Im just going back to huffing etherfumes until I can literally see the fucking future,2021-03-16 02:36:08.267924
Honestly all three the two periods circled in the chart and the one you mentioned look pretty different to me   I also personally find Heikin Ashi to be more deceptive than useful   but they sure do look nice,2021-03-16 02:36:08.268113
Came here for this   Thank you   So many 🤡 ,2021-03-16 02:36:08.268181
Lmao,2021-03-16 02:36:12.585803
As far as I can tell Gamestop’s fiscal year end is at the beginning of Feb? Is that right?  When is their annual meeting?,2021-03-16 02:36:12.585906
Exactly my thoughts,2021-03-16 02:36:12.680126
Charles Schwab,2021-03-16 02:36:16.714739
This post was the most awarded across all of Reddit on March 15th 2021!  ^I am a bot for ^[/r/TopPostOfTheDay]/r/toppostoftheday ^ - Please report suggestions/concerns to the mods ,2021-03-16 02:36:16.714841
What Jedi trick is this?,2021-03-16 02:36:18.203236
Yeah wait until Thursday and then spend your entire life savings on GME 800C expiring the following day  Literally cannot go tits up and will absolutely teach citadel a lesson,2021-03-16 02:36:18.203334
I realized 75k on shares and calls the first time  Up 15k on shares even after the dip today but my call is down 1 1k so only up roughly one hundred fucking thousand dollars total on gme you jealous piece of shit,2021-03-16 02:36:18.203393
I'm 38 and have never invested in stocks until I jumped on the GME bandwagon  I've always meant to look into investing but have always have other things distracting me from it  My retirement plan up to now has been to grow fruit and nut trees and perennial vegetables to feed me into old age  I don't think that's a bad plan but learning about investing and having some money might be nice too   ,2021-03-16 02:36:18.203497
I’m in for a ball lick,2021-03-16 02:36:18.203600
So HOLD?,2021-03-16 02:36:18.203651
Comparing the most valuable company in the world to NOK now I know ur retarded LMAO,2021-03-16 02:36:19.745286
Monke see monke do,2021-03-16 02:36:21.354542
It'll likely be up in the morning get hit by borrowed shares causing it to dip trade sideways for a bit then go up by EOD/aftermarket hours  Wednesday seems to be when the majority of reinforcements arrive  Also Citadel had to give out I O U'sBonds in order to raise money so I think we're winning ,2021-03-16 02:36:21.354671
What happened in 2008?,2021-03-16 02:36:21.354766
l@und3R,2021-03-16 02:36:21.354844
If gme goes to $301k what happens? WSB-owned nonprofit zoo where Melvin’s office used to be?,2021-03-16 02:36:22.778405
netflix coming out with pirate and samurai shows !!! fuck me calls all they way,2021-03-16 02:36:24.275241
He also has 4/11 calls and is apparently a time-traveler so   ,2021-03-16 02:36:28.849041
This is the way,2021-03-16 02:36:28.849143
mikono ya almasi,2021-03-16 02:36:28.849193
Hold brother    Here is an updoot   🦍🦍🦍  💪💪🚀🚀🚀💎💎💎🙌🙌🙌🙌,2021-03-16 02:36:32.565959
One shall not sell PLTR  But if you absolutely must it's better if it's over 60 ,2021-03-16 02:36:32.566057
1,2021-03-16 02:36:36.415241
We need to get these beautiful beast a Bloomberg terminal next and really make things interesting ,2021-03-16 02:36:36.415342
When the squeeze hits we can have a good push it to the limit montage video,2021-03-16 02:36:37.967205
aapl 130 eow,2021-03-16 02:36:37.967301
loam 🤣  I R bankr ape!,2021-03-16 02:36:37.967355
Yetis are apes too  Not sure if I would be waiting for a handjob behind a dumpster at the Himalayan Wendy's from those ice cold diamond hands but we see you over there kid  Can't wait to share some crayons with you on the moon ,2021-03-16 02:36:38.084058
The Russell index stated they have UWMC in their preliminary and it's to be around March 21st-22nd  It's still anticipation with high likelihood due to meeting market cap ,2021-03-16 02:36:39.597544
5 million shares ,2021-03-16 02:36:39.597672
GME go up  Moon is up  Retard is happy ,2021-03-16 02:36:39.598122
the risk of the flair was worth it,2021-03-16 02:36:41.109431
Want to know this too  Finally have some money in my bank and trying to decide whether to buy now or wait and see if it dips further  Don't have a lot to work with ,2021-03-16 02:36:41.109588
Thought n bought,2021-03-16 02:36:41.109651
Sorry I can’t hodl  I have to buy more first ,2021-03-16 02:36:42.585373
Not on any of my main pages someone buried that shit ,2021-03-16 02:36:42.585539
Why?,2021-03-16 02:36:44.146849
good shit,2021-03-16 02:36:44.736276
We wont let you down dude dont pay off too soon🙌🏼💎,2021-03-16 02:36:45.602645
Now is when HF realize they're really fucked ,2021-03-16 02:36:47.858537
The problem with only buying options is that they can just run down the price with shorting   If you buy shares it takes the shares out of the pool forever and even if we miss this gamma squeeze shorts are permanently in a weaker position   Shouldn't the goal just be buy as many shares as possible?  If that's the case then waiting for them to try tank and buying back is the most capital efficient strategy to grab up shares ,2021-03-16 02:36:49.897059
You are a retard,2021-03-16 02:36:49.897168
You just said you're drunk  Which means ape rides rocket to the moon!,2021-03-16 02:36:51.969220
PLTR is going to explode tomorrow!!!!,2021-03-16 02:36:51.969319
Nikola is not trustworthy IMO  Canoo seems more reliable  Make sure you look into their backings  The best one though would be the one from Ohio that is Lordstown,2021-03-16 02:36:54.101790
I’ll admit I’m only a 3 year old investor and don’t know a whole lot  I’ve got hit with big losses already and it gets easier to stomach the loss but man oh man how much can a person take  It’s just a scary ride and yes I’m probably letting my emotions get to me  As far as folding It can’t be an option ,2021-03-16 02:36:54.101955
I hate the GME apes but I'm also a stoner hippie wants to save the environment man  I'd much rather the apes stick with saving endangered species than working with the hedge funds to stick it to the hedge funds ,2021-03-16 02:36:54.686254
Buying puts not selling   AMC will issue every share they can over $10 market cap already 50% higher than ATH,2021-03-16 02:36:54.686357
Buckle up she’s a wild one,2021-03-16 02:36:56.799246
The average ape here simply does not have money to buy a 10-20% ITM call,2021-03-16 02:36:57.391032
k retarded fucking moron confirmed bye  [inbox reply notifications disabled on this comment chain],2021-03-16 02:36:59.574279
They really need to pull out and cut their losses  They're not going to win this ,2021-03-16 02:36:59.574426
Id love to see a car that just has pictures of monke all over it  Then on the rear bumper is just loss porn so the person behind them knows how they are doing ,2021-03-16 02:37:04.055946
And to all the rich pricks that sleep at night by telling themselves they move the economy and make jobs for millions not horde wealth like pigs   Equivalent of a wife beater that justifies it by ‘putting a roof over her head’   Cut the shit and distribute our wealth,2021-03-16 02:37:04.056059
I’ve had a good experience with Schwab so far,2021-03-16 02:37:04.056125
Yep mention gme - downvoted  Mention AMC upvoted    Wondering what the hedges want us to buy today? LOL,2021-03-16 02:37:04.056180
Lmao bright on the spectrum ,2021-03-16 02:37:04.056230
Buy some 3/19 SCI 55 calls and hope they print,2021-03-16 02:37:04.056278
Oh Cramer!  Now I have to transfer some money and buy more GME just because I don’t like you ,2021-03-16 02:37:04.152679
Stupid sexy Flanders   ,2021-03-16 02:37:05.796190
that volume was not huge at all literally the same volume as last friday and thursday that got trade sideway because of SSR  Today was definitely a short attack,2021-03-16 02:37:06.408523
Bring it above $500 and I can keep my shares forever  1 sell will make my principle and I can stay with the rest ,2021-03-16 02:37:07.004498
Make it into Gamestops corporate office   With a giant Bronze Ape outfront ,2021-03-16 02:37:08.169530
There's a ton of dd on the gme page  If you're to lazy to do the dd then jump off or ride with the tide  The squeeze is going to be a fight they're not just going to give up the tendies to a bunch of retarded apes ,2021-03-16 02:37:08.783140
Appreciate the info shouldn't of said something I know nothing about my pitchfork is always a little too close,2021-03-16 02:37:09.891970
This whole GME saga is unfolding like the consequences of random choices in The Witcher 3  Hedge funds shorting a video game retailer leads to massive donations to a gorilla conservation organization  Who'da thunk?,2021-03-16 02:37:14.908193
honest work,2021-03-16 02:37:14.908307
What are you a boomer or something?,2021-03-16 02:37:14.908356
I look forward to your crayon eating shenanigans,2021-03-16 02:37:14.908403
if mod is reading take me off from discord block list    wtfk,2021-03-16 02:37:14.908490
imagine selling 230 covered calls at next weeks $16 strike and collecting $48k in premium,2021-03-16 02:37:14.908571
No… Taxation has one legitimate purpose and one purpose alone:  to raise revenue for the few legitimate functions government should be doing   It should not be “managing“ the economy  It makes a mess of everything it touches and it needs to go back in the box it came in   Sending checks to every American is just stupid  It’s the equivalent of plugging a power strip into itself and still coming out with less electricity than if you had left it alone   The situation of inflation you are talking about is made in one place and in one place alone and that is Washington  If you want to keep the value of your money stop all the taxing and all the damn spending  The endless taxation and the mindless spending have almost completely destroyed the value of the dollar ,2021-03-16 02:37:14.908636
If you do not see that trend you are missing out this week  AMC to the moon!,2021-03-16 02:37:14.908722
"Why do movies have ""cult followings""?    ""great devotion to a person or idea""  I don't think you know what that word means ",2021-03-16 02:37:16.456853
You don’t think they would highlight our Ape charity work?,2021-03-16 02:37:16.457264
Last year was June based on the post I referenced  I imagine it would be similar ,2021-03-16 02:37:18.048131
150,2021-03-16 02:37:18.048309
we are coming for you bb,2021-03-16 02:37:18.048362
Lol emotional nah fam  Calling u out ? I just said how I see it  U r a bitch lol the end haha  Oh yeah tell ur mum tomorrow she can suck me off I’m little tired tonight  Thanks ,2021-03-16 02:37:20.042732
Never heard of those,2021-03-16 02:37:20.042866
As long as the new one is a little bit further away from my avg I’ll be a lot more comfy,2021-03-16 02:37:24.430847
Though we should be proud  That means a major news organization feels our name is strong enough to push their agenda ,2021-03-16 02:37:24.431104
AMC long call plays?,2021-03-16 02:37:24.431189
Now it's time to leave the capsule if you dare ,2021-03-16 02:37:24.530785
"well as someone said "" a fuckery afoot""     Brace and buy   ",2021-03-16 02:37:26.232109
Anyone know what time jeromius poweelius is supposed to speak on weds?   So i can live watch the spy tank while hes talks and dont miss out on those dip buys ,2021-03-16 02:37:26.232991
They’re starting to believe,2021-03-16 02:37:26.819633
She said GME going to Mars,2021-03-16 02:37:29.027404
So basically GME is going full Phineas mode AGAIN ,2021-03-16 02:37:29.027563
"I don't trust Elon after he said *""censored* is worth too much lol"" just after releasing news that tesla invested in it  He screwed a lot of people and himself for no reason ",2021-03-16 02:37:29.027627
this meme stock short squeeze mania is going to end great for everyone   We’re all going to be millionaires and billionaires! And the stupid hedgies are all going to be living on the streets!  AMC to 20k and GME to 100k+! 100k is the floor I won't be selling until at least 500k  I put my life savings into both of them today and I won’t sell a single share till I hit my price targets!  Diamond hands! No paper pants for me! I like the stocks  I like the stocks! If he's holds we holds!  🤡,2021-03-16 02:37:29.027737
It was decent IMO better than I expected  Some interviews with WSBers and a pretty balanced take overall  Also they ended it with a title card about the recent rebound and how the story isn’t over so 🚀🚀🚀,2021-03-16 02:37:29.654536
You can float too,2021-03-16 02:37:29.654684
True,2021-03-16 02:37:29.654761
dick move but hilarious,2021-03-16 02:37:30.253187
Grindr,2021-03-16 02:37:30.845377
I ha e more respect for the person in the background laughing about it  Or maybe they yelled their favorite slander  It was hard to understand over myself laughing,2021-03-16 02:37:35.795401
Omg if that happens I will lick the tires on my car ,2021-03-16 02:37:35.795552
I am a bot  You submitted a Gain/Loss/YOLO that didn't look like it included **large** positions  Please read the rules ,2021-03-16 02:37:35.925097
Lol defensive?,2021-03-16 02:37:36.515440
nice find   I am proud of you,2021-03-16 02:37:38.567039
Smells like blue haired pronoun users lol,2021-03-16 02:37:39.154978
you'll get squeezed  They're better than you,2021-03-16 02:37:39.766883
I don't but I also don't want to give them any more of my $$,2021-03-16 02:37:39.767020
Bro I agree cramer's a bitch but in your first sentence you called him an asshole ,2021-03-16 02:37:40.883092
The average ape here simply does not have the money to buy a 10-20% ITM call,2021-03-16 02:37:40.883188
🚀🦍💎,2021-03-16 02:37:43.868247
